DocId,Cited by,Year,Document Type,Title,Abstract,Author Keywords,Authors,DOI
217,2.0,2015,Article,"Swettenham pier waterfront redevelopment, Penang","A waterfront is a place where life of a city bloomed. Water is the source of life. Life is the practice of living. A waterfront signified a city's growth, bounded by water. Swettenham Pier is one part of Penang Island's east coast waterfront link, and happened to be at the sport where Georgetown started. The spot where in history, Sir Francis Light landed on this island and where Georgetown is established along with the blooming of international entrepot activities. It was glorious back in the late 80's. The main objective of this thesis is to bring back the glory moment of Swettenham Pier, giving back the waterfront to the people of Georgetown, people of Penang. Having to attend to this said aim, the redevelopment of Swettenham Pier waterfront is to give a chance to the people to claim a part of this waterfront, for living, for leisure or for any unplanned activities, as to establish its aim to contribute back to the local people, local culture and local living. This call for a strategy to design a waterfront to revive the history, while injecting new life to the place for people and activities to be carry on care freely. The design potential of this project is to look through the entire master plan of the waterfront and then move into the micro elements that support the entire scheme. The master plan plays a crucial role in supporting the waterfront with various types of activities that serve various demographics of users. The redevelopment of the new cruise terminal would also be explored thoroughly in conjunction with Penang Structure Plan in order to come out with the design that could cope with future development. One of the key outcomes of this research is that community magnet or a civic component inserted in the scheme will contribute back to the local people and culture. © 2015 AENSI Publisher All rights reserved.",Public spaces/function plaza; Redevelopment; Revitalize; Socio-cultural; Tourist destination area; Urban design characteristics; Waterfront; Waterfront development,"Teoh Tong M., Ismail S., Yusoff S.Y., Utaberta N., Yunos M.Y.M., Ismail N.A.",
218,2.0,2015,Article,Planned to be reclaimed: Public design strategies for spontaneous practices of spatial appropriation,"Several contemporary studies on public space focus on its loss, in relation to an increase in people's disengagement from these types of spaces. Since the 1960s, a considerable part of urban culture has attempted to develop strategies for people to re-appropriate public space and to 'inhabit the city again.' This has defined a line of research that, although now consolidated, is still little known in its complexity. In the effort to create a unified framework for the different attempts through which architecture has historically responded to the rise of spontaneous forms of urban creativity, this paper outlines a short history of design strategies aimed at enabling and encouraging different forms of spatial appropriation. It also highlights a gradual shift from prescriptive and repeatable rules to site-specific approaches, prompting a new disciplinary convergence between urban planning and design, interior architecture, industrial design and public art. © Authors and Editors - Lisbon, November 2015.",Interior architecture; Public spaces; Spatial appropriation; Urban design,Leveratto J.,
219,2.0,2014,Article,From ecology landscape to construction of rural aesthetic spaces,"On the surface, rural aesthetic spaces are not considered practical or utilitarian. However, mapping them out is valuable, because permanently sustainable development is the essence of the relationship between man and land. In the early agrarian age, the layout of rural areas was guided by people's aesthetic views of ecology rather than modern precise statistics, calculations, and related design principles. The inherited philosophy of respecting the natural landscape is the original driving force for preserving aesthetic spaces. Ancient feng shui landforms should be preserved in China. These non-utilitarian elements carried villagers' natural aesthetic philosophy across generations and captured the meaning of continuous development of the man-land relationship. At present, rural research focuses on the economics of land use. Research on the ecological landscape construction of rural aesthetic spaces is limited, and this needs to be investigated as an important topic in the field. As rural landscapes evolve, human agricultural activities leave an imprint on the aesthetics of ecological spaces, and modern layout patterns result in an inversion of the rural landscape. In recent years, the destruction of the regional geographical structure by the rapid development of modern urbanization has been devastating.My research aims to analyze rural ecological landscapes and aesthetic spaces corresponding to the elements, and how aesthetic spaces are constructed based on geographical frames. I will carry out a multi-scale study of morphological characteristics, landscape space, and the relationship between evolution patterns and response mechanisms. In large-scale landscape areas, preserving the spatial relationship between villages and geographic landscapes is particularly essential if villages are to inherit cultural and historical traditions. Town regions are medium-scale landscape areas. Based on the investigation of geographic elements such as mountain ranges and water systems, the principle of ecological art composition requires villages and fields to consider distribution contrast and plan the height, scale, and density of rural construction, road linearity and strength, and other urban construction indexes from the perspective of ecological aesthetics. Small-scale areas usually adopt aesthetic space composition with architectural design methods, which should consider natural aesthetic philosophy, interior and exterior spaces, and rural social factors. The combination of geography and urban planning that shapes spaces and the connotation of space far exceeds social relationships when determining the development scale and construction layout of rural areas. The priority is to maintain harmony in the social space. The construction of rural aesthetic space operates through the ""hardware"" of the geographical landscape and the ""software"" of cultural inheritance and accumulation with respect to landscape forms, mechanisms, functional structures, and so on. Rural landscape planning must use geography as its basic space structure, base itself on regional geographical space analysis and landscape preservation, and place importance on indexes of preservation of the regional landscape and traditional culture. It should be specified that the requirements of landscape optimization and socioeconomic development are embedded in the requirements of ecological civilization and social development in the layout of landscape space. These elements form a landscape network that can maintain the comprehensive environment. The philosophy of landscape aesthetics should be expanded to broader spaces in order to introduce the concept of landscape beauty to towns, villages, and even farmlands. © 2014, Ecological Society of China. All rights reserved.",Ecological landscape; Geographical pattern; Rural aesthetics spaces; Urbanization,Yao Y.,10.5846/stxb201312102926
221,2.0,2013,Conference Paper,Human sensory assessment linked with geo-and mobile-data processing methods in urban planning exemplified on different cultures in Germany and Egypt,"Human sensory assessment is a new approach to objectively gather subjec-tive data concerning humans' perception of space and emotional reactions towards space in real-time. The resulting data enables urban planners to get a more comprehensive view of interdependencies between people and their urban environment. This paper shows the methodical framework be-ginning from gathering over processing and analyzing to visualizing emo-tional reactions of selected participants. The research aims to optimize and automatize the processing between human sensory assessment, geo-and mobile-data. The challenge lies in joining and processing the generated various data types to gain visual tangible results. In order to apply the complete methodical repertoire, different case studies and exemplary anal-yses were conducted in Germany and Egypt, dealing with the exemplary research question ""How do people of different cultures perceive their envi-ronment in different countries?"".",,"Bergner B.S., Exner J.-P., Memmel M., Raslan R., Talal M., Taha D., Zeile P.",
222,2.0,2012,Article,"Living near the ""town that lost its water"": Explaining residents' environmental concerns in a rural-small urban township in Ontario","This study is concerned with developing culturally sensitive risk management strategies among Old Order Mennonite (OOM) and other communities, living in the Township of Woolwich and farming along a tributary of the Grand River. Based on 34 semi-structured interviews with two groups of female participants, the multiple layers of culture (community context, people's shared core values, worldviews) were analyzed in terms of their effect on risk perception as well as risk attenuation or risk amplification processes. This research with excluded ""others"" articulated an exploration of modern environmental hazards in a place isolated from outsiders. The research reveals not only that epistemic difference shaped these women's perception of risk, but also that their responses were modified through ongoing obligation to cultural and religious separation, and a centuries-old resistance to change and modernity. By focusing on the influence of culture in risk perception, this case study contributes essential insights for environmental planners and managers into developing collaborative work with conservative religious communities faced with environmental hazards. Copyright © Environments: A journal of interdisciplinary studies/revue d'études interdisciplinaires.",Environmental planning; Environmental risk attenuation; Old order mennonites,"Dabrowska E.M., Bates J., Murphy B.L.",
223,2.0,2012,Book,"Schooling for sustainable development: A focus on Australia, New Zealand, and the oceanic region","“This book Schooling for Sustainable Development: A Focus on Australia, New Zealand and the Oceanic Region, is the product of passionate interests of teachers, scholars and researchers located in diverse parts of the Australasian region. Working with their colleagues within local contexts they have conducted research and gathered together information for practitioners and students interested in learning more about sustainable lifestyle practices. Some of the work has taken place in remote locations and some has been in within the confines of major cities. The Australasian Region brings together people and cultures that link traditional economies to global networks and lifestyles. Diverse terrain, politics and responses typify the region. Close to Asia there are lingering ties with old European ways and cultural beliefs. The major economies of Australia and New Zealand provide the lead with development practices for lesser economies such as Papua New Guinea, Fiji and the many island nations scattered throughout the South Pacific. This complexity is not easily represented. Key issues relate to land ownership, mobilities within the region and the gradual dissemination of knowledge, skills and wealth. The book will provide both reference material and interesting reading for teachers, researchers and practitioners in interested in community based perspectives on sustainability. We have learnt from each other and hope that others will benefit from our efforts. © Springer Science+Business Media Dordrecht 2012.",Curriculum developments; Environmental education curriculum; Environmental management; Geography; Indigenous perspectives; Management of change Sustainability education; Sustainable lifestyles; Urban planning,Robertson M.,10.1007/978-94-007-2882-0
224,2.0,2002,Article,"Local sites of globalisation: An architectural and ethnographic contemplation of urban space in Mexico City [Orte der ""Globalisierung"": Eine architektonische und ethnologische Betrachtung der Stadt Mexiko]","Taking into account that global economic and political processes are materialised and manifested on a local level, these processes provoke changes in the material culture of the city i.e. of environment, architecture, commodities etc. as well as in social interaction and cultural practice. These changes are not to be interpreted as homogenious adaptations abstract global effects, but they are translated in a dynamic process and mixed with existing (and ""traditional"") everyday practices. In urban space. which is composed by the materiality, historicity, social practice, and experience of the people who live this space are inscribed. Therefore urban space as a site of the local can be considered as the site where global tendencies we adopted subjectively and on the level of everyday life. Possible subjects to analyse theses complex layers of global effects and local phenomena are for example a) space, environment, architecture, b) everyday practice and experience. c commodities and consumption. Mexico City is a place where indicators of globalisation are materialised. The economic development of the last 30 years provoked urban transformation processes, which can be recognised as an ""intensification of urban space"" and processes of ""new centrality"". The architectural and ethnographic research of specific urban spaces provide access to both ""micro"" and ""macro"" visions of the local and the global of the metropolis. In this article example of qualitative research of urban transformation in Mexico City are presented in three concrete urban spaces. © 2002 Taylor and Francis Ltd.",Globalisation; Mexico City; Urban transformation processes,"Wildner K., Tamayo S.",10.1080/03233790215618
225,2.0,2000,Conference Paper,Ergonomics methodology for comparative study of street furniture in different cities,"Street furniture is available in all public area of cities the world. A garbage can, a newsstand, a pole, a bus shelter, a road sign, take an important role in the quality of life a city. The interactive role between public place and people influences and is influenced by social behaviour and regional cultural expressions. The purpose of this work is to analyse the street furniture of three Brazilian states. It was also analysed the context and surrounds that they were designed and built, as well as their interaction with the citizen's life. Our approach considers a comparative analysis of historical, social-cultural, environmental and function aspects verifying the importance of this equipment on the interaction between the public spaces and the users as long as the influence of local cultures and extra-territorial standards.",,"Mourthé C.R., De Menezes J.B.",10.1177/154193120004400807
226,2.0,2000,Article,A study of the city planning system of the ancient Bo-hai State using satellite photos,"This paper examines the city planning system of the ancient Bo-hai State using recently declassified intelligence satellite (CORONA satellite) photos acquired in the 1960s by the United States. Based on reconstructions made in my recent report, I have tried to make clear some principles shared by those in city planning. It is also intended to prove the usefulness of satellite images in historico-geographical and archaeological applications. The Bo-hai State was a kingdom which existed from 698 AD to 926 AD in the northeastern part of today's China. It was formed by the Tungusic people in association with refugees from Koguryo, which had fallen in 668. It actively imported Chinese culture and political system and boasted a high standard of civilization. While bringing tribute to Tang China, it dispatched envoys to Japan many times across the sea. Since records On Bo-hai itself have been lost, we can only obtain a glimpse of its prosperity through Chinese histories and records in Japan concerning envoys as well as archaeological evidence.",Ancient East Asian City Planning; Hill-fort; Historical landscape; Satellite photo; The Bo-hai State,Ogata N.,10.4200/jjhg1948.52.129
227,2.0,1997,Article,Art in the urban landscape,"This paper discusses the emerging use of public art in cities as a means of positively transforming the urban environment. It emphasizes the need for a symbiosis between an appropriate urban design and the natural transformation that occurs with the placement of sculptures in an urban context. It comments on several examples of planned artistic interventions and, in particular, analyses a recent major project of urban design in Concepcion, the third largest city in Chile. An environmental vision, that addresses itself to the contemporary city's development, has also to consider that urban spaces should provide adequate venues for leisure and civic entertainment for the inhabitant. Historically, the notion of art has been associated with the degree of culture of society and, indeed, it represents the expression and spirit of our urban communities. Hence, together with the macro-planning goals of development, there exists a chance to restore people's sense of belonging and pride of place, providing adequate spaces related to artistic manifestations that can contribute to the overall quality of life in neighbourhoods and inner city areas. The conclusions suggest that these types of artistic expression can be a key factor, but only by integration, that is a combination of an appropriate scale of intervention through urban design, rather than 'parachuting' the art into different places. © 1997 E. & EN Spon.",,Cartes I.,10.1057/udi.1997.31
228,2.0,1991,Article,Space as a resource,"At the micro level of a shelter programme, space is the most important commodity, which needs to be optimally used not only for upgrading the immediate and overall environment but also for reasons of the economics, finance, life style, tradition and culture of the people who are expected to live there. The author, one of the leading architects and planners in India today, brings out the futility of a cosmetic approach to planning ideas, where significant resources are ignored and which remain untapped and unutilized but which could make our living environment more congenial and desirable. This paper highlights the most intimate relationship of man with the immediate environment in our settlements. The author has made suggestions which can integrate and transform the space we are wasting as an invaluable resource for upgrading the quality of life in human settlements. (Ed.). © 1991.",,Correa C.,10.1016/0360-1323(91)90045-D
229,1.0,2021,Article,Continuity in tradition: A narrative on the cultural heritage of para and adda in Kolkata,"'Para' and 'adda' are two unique examples of intangible cultural resources of the Indian state of Bengal and Bangladesh. Para signifies a community or neighbourhood that share close spatial proximity and similar emotional ideology, whereas adda denotes an exchange of casual or intellectual discussions among people. Para refers to a spatial connotation with a neighbourhood, but the physical manifestation is not the only pre-requisite to form a para. Para reflects a networked social cohesion as the continuous affection concretely demonstrated in people's decisions about where to live, how to work and with whom to engage in their daily lives. Culture, ethnicity, language, food habit, mutual feelings of belongingness and robust social networking within a neighbourhood contribute to the growth of a para. Adda propagates the intensity of social networking and influence the development of para. The paper uses narratives to comprehend the co-evolution and correlation of para and adda as an unwavering tradition among the Bengali community in Kolkata. © 2021 ICE Publishing: All rights reserved.",Infrastructure planning; Town & city planning; Urban regeneration,Biswas A.,10.1680/jurdp.21.00016
232,1.0,2021,Article,Structural beauty: A structure-based computational approach to quantifying the beauty of an image,"To say that beauty is in the eye of the beholder means that beauty is largely subjective so varies from person to person. While the subjectivity view is commonly held, there is also an objectivity view that seeks to measure beauty or aesthetics in some quantitative manners. Christopher Alexander has long discovered that beauty or coherence highly correlates to the number of subsymmetries or substructures and demonstrated that there is a shared notion of beauty—structural beauty—among people and even different peoples, regardless of their faiths, cultures, and ethnicities. This notion of structural beauty arises directly out of living structure or wholeness, a physical and mathematical structure that underlies all space and matter. Based on the concept of living structure, this paper develops an approach for computing the structural beauty or life of an image (L) based on the number of automatically derived substructures (S) and their inherent hierarchy (H). To verify this approach, we conducted a series of case studies applied to eight pairs of images including Leonardo da Vinci’s Mona Lisa and Jackson Pollock’s Blue Poles. We discovered among others that Blue Poles is more structurally beautiful than the Mona Lisa, and traditional buildings are in general more structurally beautiful than their modernist counterparts. This finding implies that goodness of things or images is largely a matter of fact rather than an opinion or personal preference as conventionally conceived. The research on structural beauty has deep implications on many disciplines, where beauty or aesthetics is a major concern such as image understanding and computer vision, architecture and urban design, humanities and arts, neurophysiology, and psychology. © 2021 by the authors. Licensee MDPI, Basel, Switzerland.",Computer vision; Figural goodness; Head/tail breaks; Life; Wholeness,"Jiang B., de Rijke C.",10.3390/jimaging7050078
233,1.0,2021,Book Chapter,A study of built morphology and cultural imagery—a case of bengaluru pettah: Historic core of the city,"Cities are composition of complex matrix of neighbourhood held together by the movement networks. The local neighbourhood is very important to understand how people conceive the city in their minds. The representative memory captures the elements related to spatial identity of a place, but more often than not, these representations are pictorial images superimposed upon the fabric resulted from the standardized tools used for analysing the spatial qualities and its attributes. The recognition of the finding to capture elements related to experiences of spatial identity problematizes from well-established urban design spatial theories. On the other hand, Indian city is a collective of people, place and events. These neighbourhoods may not be central to social or business relationships nor centre for historic monuments, but the activities, users, events, location and spatial conditions that support them are very different—together key to the legibility of the city. More often than not, the impacts due to the city’s regeneration process sustain the test of time and manifest into a deeper system for building an image of the place. Hence, embedded meaning and meaningful association over time become crucial for the built morphology. One such neighbourhood is Pettah1—the old core of city of Bangalore. Bengaluru was one of the key trading centres of the south during the pre-colonial era. The idea of a town structured around Pettah (market), Kote2 (fort), Kere3 (lakes and tanks) and Totha4 (gardens and parks) was an unquestionable matrix of natural occurrences and cultural practices. Decades to follow many influences on to the town added a layer of new structure, and every stage of progress enunciated the past with a new skin of elements. It is this value of city’s memory that lie buried within us carrying forward our past into its present fabric. Hence, the study reveals the need to radically departure from the routines of recording legibility and imageability through mental, sensory and visual mapping and to record in terms of space, events, time, activities as well as sense of public-ness. Ultimately, the findings also brings optimism into urban design practice, offering new insight into how to record mosaic of an area in an Indian city that will capture the strong perceived and conceived imagery of a place and hence sensitive responsive proposals that will aid to carefully conceive a system for the future. © Springer Nature Switzerland AG 2021.",Character; Culture; Elusive; Morphology; Neighbourhood,"Bydar Shubhashchandra S., Subramanian R.R.",10.1007/978-3-030-51961-2_18
