DocId,Cited by,Year,Document Type,Title,Abstract,Author Keywords,Authors,DOI
302,,2020,Article,Research progress and implication of the“neural turn”in human geography,"Neuroscience is the science of the 21st century. The theoretical research results of neuroscience are affecting daily life, environment, space, context, and place profoundly. It provides a new way of thinking and method to explain human's mind and behavior. In the context of post- modernism, the understanding of selfconsciousness in human geography has become fragmented. Non- presentation theory and embodied cognitive geography claim that in most of the time, people are ""unconscious"". Subject self- consciousness is irrational, which takes place in the ""outflows"" daily life world. It emphasizes the showing, performance, and practice of the body. The meaning of the real world should be obtained through embodied cognition and behavior. They found evidence from neuroscience that led to a ""neural turn"" in geography. The ""neural turn"" devotes to linking human's mind and behavioral traits to biological evidence. It is different from inter-disciplinary debates that are breaking down the disciplinary boundaries between social culture and natural sciences. The laboratory methods cannot reflect the real world, and the social science methods are difficult to get rid of subjective factors. The ""neural turn"" can provide a research perspective of combining the-first-person and the-third-person for human geography. This article reviewed the recent studies on the ""neural turn"" in Western human geography. ""Neural turn"" research mainly concentrated in three aspects: Space perception, embodied affect, and behavior practice. It has involved economic, political, social, cultural, public policy, tourism, and education topics. The application of neuroscience in human geography can also be applied to multiple scales of space such as country, city, community, and body. Neuroscience perspective as a new path is used in urban planning, environmental design, tourism development, and public policy, among others. At the same time, the technical tools of neuroscience have become new data collection methods in human geography. Neural technology can capture imperceptible physiological changes in the human body in order to detect neural activity caused by mind and behavior in a particular environment and context. The collection of physiological data can surmount the representation of text and symbols to discover non- representational results. Brain images and eye tracking technologies have been applied in geography, presenting predictable visions for the future. At present, Chinese human geography pays little attention to neuroscience. This article is hoped to provide some reference and enlightenment for the study of Chinese human geography. The dialogue between neuroscience and human geography is still in its infancy and needs more empirical research. In this process, human geography can carry out more cooperative research to produce more knowledge spillover. At the same time, these studies need to explore the topic of Chinese localization in order to better realize the people- oriented approach in the research and application of Chinese human geography. © 2020, Editorial office of PROGRESS IN GEOGRAPHY. All rights reserved.",Behavior; Embodied cognition; Human geography; Mind; Neuroscience; Non-representational theories,"Wang M., Lin M., Zhu H.",10.18306/dlkxjz.2020.07.011
303,,2020,Article,Alterlivability speculative design fiction and the urban good life in starhawk's fifth sacred thing and city of refuge,"This article responds to two diverging notions of “livability”: the normative New Urbanist imaginary of livable cities, where the urban good life manifests in neoliberal consumer cultures, green gentrification, and inaccessible infrastructures, and the feminist and disability concept of livable worlds, such as those in which nonnormate life thrives. Whereas the former ought to broaden its notion of “lives worth living,” the latter would benefit from a more specific theory of design-the making and remaking of more livable worlds. In response, this article offers the concept of “alterlivability,” a design philosophy grounded in permaculture ethics. Drawing on two novels by ecofeminist writer Starhawk-The Fifth Sacred Thing (1994) and City of Refuge (2016)-the article explores the genre of speculative design fiction for its insights into prototyping more livable futures in the Anthropocene. Starhawk's novels illustrate alterlivability as a set of political commitments, design methodologies, and spatial forms that place disabled, racialized, and poor people at the center of alterlivable worlds. © 2020 Aimi Hamraie",Disability; Livability; Permaculture; Prototyping; Speculative fiction; Sustainability; Urban design,Hamraie A.,10.1215/22011919-8623197
304,,2020,Article,"New strategies for historical towns in the South of Italy. Rethinking values, physical constraints, and technological opportunities","The hinterland of central and southern Italy and the Islands is interspersed with mostly neglected architectural and urban heritage. These territories present many infrastructural, orographic, and economic constraints. A survival economy had survived, strongly tied to their productive, physical, and cultural identity. New models of the economy (sustainable, responsible, circular, green, sharing, and low-cost models) and new instances in the field of architecture and urban planning (accessible and inclusive spaces built for people) are certainly more appropriate for the reinterpretation of towns with a strong historical connotation: their characteristics are closer to a culture of quality, identity, slowness, without renouncing centrality, something that digital and internet connections allow despite the physical distance. A careful study of these places shows the recurrence of considerable constraints that can no longer be considered impossible. New technologies (digital, domotic, wireless, urban vehicle concepts, etc.) and the 4.0 revolution in the industrial field, which implies the use of enabling technologies, none of which requires physical proximity, support us in the study of specific compatible solutions for the reuse of urban and building heritage. © 2020 Universita Mediterranea di Reggio Calabria. All rights reserved.",,Mamì A.,10.14633/AHR252
305,,2020,Article,Ecology of the body and new geography of cities [Écologie du corps et nouvelle géographie des villes],"For a long time, geography ignored the body. It is omnipresent in the landscape of cities. It influences the organization of their spaces. Its pressure on urban power is accentuated by the recent development of a very lively corporeal ideology that is favorable both to the exhibition of bodies and to various playful and sporting activities. Urban authorities provide answers to townsfolk's corporeal aspirations. Cities open themselves and tool up in order to welcome cohorts of walkers, joggers, skaters, rollers, and bicycle-riders. Cars recede in front of public transport that aggregates bodies. The least free spaces turn into corporeal expression areas: squares, sidewalks, gardens and parks welcome languid, indolent, agile, or hurried bodies, and sometimes also the bruised bodies of homeless people. A survey conducted in Bordeaux sheds light on this body culture. It argues in favor of the idea that this new ethos has become a political force filling the vacuum left by a local democracy that is struggling to emerge. © 2020 Societe Geographique de Liege. All rights reserved.",Body; Bordeaux; Geography; Urban planning,Di Méo G.,10.25518/0770-7576.5995
306,,2020,Conference Paper,Peculiarities of the psychotype of the indigenous peoples of the North in the projection of illegal behavior in the urban environment of the Russian Arctic,"The article examines the peculiarities of the personality psycho-type of the indigenous peoples of the North, living in the cities of the Yamal-Nenets Autonomous Okrug (Arctic) and the territory of the Khanty-Mansi Autonomous Okrug, related to the regions of the Far North. The authors' attention is drawn to the psychological characteristics that determine the illegal behavior of the indigenous popu-lation. The natural-climatic conditions of the Russian North, its Arctic zone, is very specific and deter¬mines a number of features in the psychological portrait of the personality. The life hood of the inheri-tors and practitioners of traditional culture, taken place in the conditions of an impoverished living environment, is distinguished by a specific way of life and perceptions, activities and social stratifica-tions, therefore, imposes a number of conditions and restrictions revealed in the psychological foun-dations of behavior and its law-oriented norms. The same characteristics remain dominant in the transition to an urban environment. © The Authors, published by EDP Sciences, 2020.",,"Naumenko E., Naumenko O., Phillips V., Bortnikova Y.",10.1051/e3sconf/202020804002
308,,2020,Conference Paper,Songkram River Basin: Floating Vernacular Architecture,"Songkram river basin is located in the Upper North Eastern of Thailand (so called Isan). As a part of the 4 factors, one of the vernacular architecture of Songkram river basin, “Pae Sadung Yak”, the unique local fishery raft that strongly shown the sense of simplicity and wisdom. This research extract new design concept of vernacular architecture which will transform this bamboo fishing raft into the new application as a floating resort. The results of this research are not only preserving the intangible heritage local wisdom of this particular “Rock Salt”, but also the creation of circular economy which could elevate the wealthier status of the people in the area and attract people from different cultures such as the outsider or tourists and lead them to experience the new “Isan lifestyle” which handcrafted design for sustainable tourism. © 2020, The Editor(s) (if applicable) and The Author(s), under exclusive license to Springer Nature Switzerland AG.",Circular economy; Four factors; Songkram river basin rock salt; Sustainable; Tourism; Vernacular architecture,Pintong S.,10.1007/978-3-030-51566-9_4
309,,2020,Article,Re-locating the identity of Amman’s city through the hybridization process,"Purpose: The purpose of this paper is to define the identity, city identity and architectural identity; to review, analyze and synthesize different pieces from literature to explore and define the factors that shape the city identity; to define the strategies of hybridization process that can be used to re-locate (re-define) the city identity; to examine the most effective factors that shape the identity of Amman city from various perspectives, to examine the relationships/interrelationships between all the factors that shape any city identity from the designers’ perspective, finally, to apply the strategies of hybridization process to re-locate (re-define) Amman’s city identity. Design/methodology/approach: This research used two research methods to collect data as follows: literature review, content analysis and face-face questionnaire. Descriptive statistics were used to examine the most effective factors that shape the Amman’s identity from different perspectives. The Pearson product-moment correlation coefficient (Pearson r) was computed to assess the relationships between all factors that shape the identity of any city from the perspective of Jordanian designers and experts. Findings: This research concluded that the factors that shape the city identity are cultural factors (socio-cultural, historical, economical and globalization factors), environmental factors (geographic, climate and building materials factors) and urban and architectural factors (spatial design organization, architectural style, open spaces and parks, urban structure factors). Additionally, the six urban development factors that responsible for the hybridization process in a city are new architectural typology and new special configuration, urban edges and hybrid textures, public hybridization open spaces, roads highway-scapes, urban redevelopment through super sites by star architects and downtown urban developments. This research found that there are different perspectives about the definition and factors that shape the identity of Amman’s city because of differences in cultures, experiences, knowledge, education level and personal preferences. The city identity is not a constant concept. It is changed according to time, place, people, culture, global trends, economic status and experience. Moreover, the correlation results revealed that the relationships/interrelationships between all the factors that shape the identity of any city have strong/very strong positive linear associations and significant relationships (r > 0.89). Practical implications: Greater Amman Municipality (GAM) should provide a vision to redefine the identity of Amman city and control over the development pressure, built form and image of the city. This vision should be based on research, analysis and adoption of the most effective road map. GAM and all stakeholders should establish and enforce using specific architectural styles, urban design guidelines, building codes, policy tools and land use regulations to re-define the city identity. GAM should review, assess, approve and supervise all development projects through all design and construction phases especially in sensitive areas. GAM should focus on building capacity, empower its architects and planners, and re-organize (re-structure) their units and administrations especially planning and licensing departments to improve the city image and guide development. This research recommended that architects should design new, diverse and innovative architectural concepts, typologies and spatial configurations. Rapid development and new edges should be planned, designed and managed from the parts to the whole. The heterogeneous landscape and everyday activities will improve the vitality of urban and open public spaces and form of public culture. Architects and star architects ought not to make a clear and sharp separation between old and new development, architectural styles and typologies. Architects and urban designers ought to design hybrid physical urban environments, urban morphology, urban multi-functional activities, mix-use buildings, open spaces for social life, street patterns and furniture, squares, architectural style and typologies, spatial connectivity, green spaces and landscape entities. The designers and planners should consider how to create a city for living, working and recreation. Originality/value: This research defined the identity, city identity, architectural identity and the factors that may shape the city identities. This research proposed and used the hybridization process as a tool to re-locate (re-define) the identity of Amman city and any city to be more obvious. Additionally, this research examined the relationships/interrelationships between the factors that shape the city identity. © 2020, Emerald Publishing Limited.",Architectural identity; City identity; Hybrid design,"Alhusban A.A., Alhusban S.A.",10.1108/JPMD-07-2019-0066
310,,2020,Book Chapter,Universal Design in Sustainable Urban Planning,"There is a fil rouge connecting Universal Design and sustainability which within the Brundtland Report can be recognized in the pillar of social sustainability. The demographic and epidemiological aspects that are affecting western countries, the definitions of health and healthy cities given by the World Health Organization and the international documents dealing with sustainable development oblige building designers and urban planners to reconsider their social role and become “health operators”. The strict link between human beings and the built environment underlined both by Universal Design and International Classification of Functioning is the reasons why our cities and settlements need high quality urban spaces in order to enhance everyday life social dimension. Three urban projects in Manhattan, Den Haag and Copenhagen will be presented to show how sustainable urban planning can promote social interaction and inclusion, cohesion of communities, human health and well-being, cultural expression and dialogue among a wide diversity of people and cultures. © 2020, Springer Nature Switzerland AG.",,Arenghi A.,10.1007/978-3-030-41072-8_6
311,,2020,Book Chapter,Introduction,"The Warsaw Housing Cooperative (â€˜Å»oliborz republicâ€™) is a historic example of an attempt to replace the extensive system of representative democracy and majority rule with the principles of direct democracy and the self-governance of various entities/subjects, an example of creating a commons based on biopolitical production of customs, norms, tastes, principles of cooperation and, finally, subjectivity. A common good produced and distributed contrary to the logic of capital in a modern city, at a time it was desperately lacking its resources. The cooperativeâ€™s ambition was to show people how to live and to turn (passive) residents into (active) citizens. Soon, the cooperativeâ€™s founders have transpired to beâ€”as we would now sayâ€”activists, or critical spatial practitioners (Markus Miessen), and the development became a laboratory for modernist urban planning practices. What began as an estate for working-class residents, thanks to the involvement of intellectuals keen on the concept of â€˜sociology in actionâ€™, saw the introduction of numerous experimental forms of urban communal living. An analysis of this historical case relates to questions often posed today by both the urban grass-roots movements and researchers such as David Harvey and Andy Merrifield: Who owns the city? Who does the city belong to? Who should manage the city and how? The performative perspective allows me to see â€˜architecture in actionâ€™ and dwelling as a process, rather than a form. The resident-turned citizen can be seen as engaged in subversive and freedom-oriented undertakings (social, political, economic and educational). In turn, the critical perspective (inseparable from the performative one) revealed the extraordinary power of rebellion and the desire for change resulting from the combination of thought and action, thanks to culture understood as praxis. I assume that the WHC residentsâ€™ strategies, described in this book, may prove valuable particularly today, when modern cities are implementing a model of governance based on urban entrepreneurship, while local governments are eager to dismantle the municipal social welfare system, privatise public goods and collective consumption and cooperate with private investors more often than with residents. © 2020, Springer Nature Switzerland AG.",Criticism of modernity; Performative perspective; Preposterous history; Urban studies; Utopian studies,Matysek-ImieliÅ„ska M.,10.1007/978-3-030-23077-7_1
312,,2019,Conference Paper,Modern approaches to preservation and development of historical objects of culture,"Architecture is always a memory tool. Connection between architecture and history is one of the necessary aspects of social existence and professional comprehension of the art of building. Each epoch leaves its trace in architectural works of art. Development of equipment and technology changes internal space of outstanding architectural structures inevitably fast and sometimes affects their appearance as well. Natural and man-made disasters and wars cause multiple reconstructions, as a result of which the initial image of a building transforms, which makes it look more contemporary, understandable and attractive for people. The first part of the article identifies the main principles of arrangement of additional functional spaces of developing objects of culture. Further on, museum and theatre complexes, on the basis of which an analysis of social, urban-planning and technology factors that influence their formation and aesthetic image is carried out, are researched. Results are summarized and conclusions are made. © Published under licence by IOP Publishing Ltd.",,Teleshova N.A.,10.1088/1757-899X/687/5/055027
314,,2019,Book,Creating great places: Evidence-based urban design for health and wellbeing,"This book provides a bold vision and roadmap for creating great places. Imagining and designing urban environments where all people thrive is an extraordinary task, and in this compelling narrative, Cushing and Miller remind us that theory is a powerful starting point. Drawing on international research, illustrated case studies, personal experiences, as well as fascinating examples from history and pop culture, this practical book provides the reader with inspiration, guidance and tools. The first section outlines six critical theories for contemporary urban design - affordance, prospect-refuge, personal space, sense of place/genius loci, place attachment, and biophilic design. The second section, using their innovative 'theory-storming' process, demonstrates how designers can create great places that are inclusive, sustainable, and salutogenic. Creating Great Places is an insightful, compelling, and evidence-based resource for readers who want to design urban environments that inspire, excite, and positively transform people's lives. © 2020 Taylor & Francis.",,"Cushing D.F., Miller E.",10.4324/9780429289637
315,,2019,Conference Paper,Contributions for the Rehabilitation of the Castro da Senhora do Bom Sucesso-Mangualde (Portugal),"Portugal is undoubtedly, a destination for the practice of Nature Tourism, containing a vast and rich natural, historical and cultural heritage. This settlement, Castro of Senhora do Bom Sucesso is a place where the surrounding landscape stands out with several mountains around it, in an environment where the flora and fauna, characteristics of this region, stand out. The whole history of the place, refers to a certain period of the past, valuing it and able to make the experience that the Nature Tourism can provide even better. Being one of the highest places in the central region of Portugal, it is for many people, a special place of enjoyment and relaxation. In this place, hundreds of years ago, there were between 80 and 100 houses of ancient people from the Celtic culture. Later, due to the abandonment by Men, these houses became disused, falling into a rapid decay process with the collapse of walls and roofs, making the roads impassable and the place covered with vegetation. Thus, in this work, in methodological terms, based on literature review, the collection of cartographic elements of the place, and in the field and cabinet studies, it was possible to develop an investigation on the Military Heritage of the region, in order to analyze in detail, the relation of the nature of the place with the architecture. This work resulted in a proposal for the site of the former Castro do Bom Sucesso, with the main objective of creating an Ecotourism Park, around the Celtic culture and autochthonous nature, organized in the following main equipment: I) Reception of the Ecotourism Park; (ii) ""Celtic Bungalows"" iii) Celtic Interpretation Center; iv) biological pool and v) Camping. The paper presents the main elements developed, from the design to the form and location of the equipment that, to be built, is believed to improve the regional economy through a scientific, didactic, cultural and sustainable tourism. © 2019 Published under licence by IOP Publishing Ltd.",,"Gomes Rodrigues M.V., Ferreira Gomes L.M., Cabral De Carvalho A.B., Miranda Beato C.",10.1088/1757-899X/603/4/042045
