DocId,Cited by,Year,Document Type,Title,Abstract,Author Keywords,Authors,DOI
99,12.0,2008,Editorial,Introduction modern architecture and the middle east: The burden of representation,"The essays in this volume investigate the contribution that local Middle Eastern contexts make to discourses in international modernism. The essayists define modernization not only as the extension of industrialized building processes and urban infrastructure, but also as the spread of ideals of progress and standards of comfort-which is to say, modernization is the ideology as well as the built framework for the administration of industrial societies. Architecture can help consolidate identity by providing both a degree of social cohesion and iconic forms that can become a source of pride for communities. Yet, for others, such architectural forms can become stereotypes that flatten culture into amere sign.Throughout these essays, one discerns an abiding concern for questions of representation, for how buildings and monuments-or in some cases, the lack of them- acquiremeaning, harden conviction, and set the spatial infrastructure for subsequent generations. The Middle East, with its diverse social, religious, and national histories, has often been seen by architects and academics as rich in traditional architecture but poor as a resource for understanding the Modern period. Europeans have idealized the Middle East as an almost timeless place, a region that stands in distinct and didactic contrast with the disruptive displacement and disillusionment that has resulted from its own industrialization.1 These essays describe the unique ways by which Middle Eastern countries have invented their own versions of modernism, sometimes aligned and sometimes at odds with more familiar European versions, and in varying relations with larger patterns of imperialism and colonialism. When individual designers and decision makers crossed national borders to build or to learn, to provide aid or extract resources, as architects, teachers, or tourists, the dichotomies of modern-traditional orWestern-Eastern did not truly hold. Our goal here is to build into the study of transnational architectural exchange the widest consideration of constituencies and the most extended opportunities for input.Contributors examine awide range of cultural encounters in terms of institutionalization of relationships, dynamic interactions of bureaucratic structures, and patterns of patronage amid debates over design and urban planning. Even local histories aremultiple, often disputed in their formation, and inevitably shifting over time. Taken together, they illustrate the various strategies that set national policies and decidewho is housed and who goes wanting, who is remembered and who is forgotten, and who is empowered to remake the built landscape. Several essays profile the individuals who helped realize certain specificallyMiddle Eastern forms of modernity. Some of them, such as European art historians and expatriate architects and archeologists, positioned themselves as the arbiters of Western knowledge, while others were seen as importingWestern ideals and technologies to theMiddle East. In other cases, institutions, such as governments or development agencies, assumed these roles. In many instances, however, cultural authority was as much a matter of dynamic transitions in political or architectural sympathies as it was the result of official credentials. These essays call attention to circuits of intention and response, which inflamed allegedly objective depictions of technological progress into heated debates regarding the nature of modernity itself. Modernism and the Middle East contextualizes the challenges facing building efforts today by placing themwithin a larger historical trajectory stretching from colonialism and the rise of nation-states to the present postcolonial search for local identity.By detailing howarchitecture has been integral to complex political ambitions and economic programs, the contributors make evident the historical roles played by competing visions of the built environment, as forms of representation and as ameans of directing capital and labor flows. With such attention to its deep traditions and rapidmodernization, the Middle East emerges as a rich setting for the study of modern architecture. Modernism and the Middle East begins at the cusp of the twentieth century amid the decline of colonialism and the rise of independent nation-states in regions once ruled by theOttomans (r. 1290-1924) in present-day Turkey and North Africa, and the Qajars (r. 1779-1924) in Iran (see fig. I.1).2 Under the dynastic leadership of the Sultan, overseer of the holy sites of Mecca andMedina and the supreme ruler of the Sunni Islamic world, the relatively stable and unified Ottoman Empire had administeredmuch of today's Middle East. But this administrative unity and geographic cohesion was eroded greatly during the nineteenth century, and it dissolved completely in the twentieth.3 Beyond the actual loss of land, Ottoman rule was disrupted by major infrastructure developments, most notably the Suez Canal (1854-69), which brought French and, later, English capital and technology to Egypt.4 By the twilight of World War I, in 1918, Istanbul had itself come under Allied control, and the six-hundred-year-oldOttoman Empire came to an end, its former lands divided into areas administered by the French (Syria and Lebanon) and the British (Iraq and Palestine).5 Even as newnations emerged with at least nominal sovereignty from the Mandate period, the idea of a coherent, if not exactly cohesive, Middle East was reinforced. The Mandates carved new political entities, such as Palestine and Iraq, out of former Ottoman administrative zones, but it kept these nations from being fully independent, and left them wanting in terms of industrial development. At the same time, European occupation sparked nationalist movements in neighboring Turkey and Iran, resulting in the overthrow of puppet monarchies and the rise of charismatic military leaders,who threwoff centuries of imperial rule and modernized in the name of national progress. The advent of Mustafa Kemal in Turkey (1919) and Riza Khan in Iran (1921) brought new modes of judicial and educational reforms (often based on European models), in an effort to forge homogeneous, if fictive, native identities.6 The characterization of entire peoples by their positions along the trajectory of history and modernization was asmuch embraced by regional leaders as it was imposed by European power and ideology. Oil came to be written into this idea of a cohesive Middle East as much by its discovery there as by the increasing industrial thirst for sources of fuel. The image of Arab states unified by oceans of oil lying unseen beneath their soil emerged in the nineteenth centurywith the advent of a British-controlled Anglo-Persian oil company. It was extended as new fields were discovered, such as those in Iraq in the 1930s and those in Kuwait and Saudi Arabia by 1945. With the institution of the American's Marshall Plan (1948-52), the European economy was reconfigured according to American precepts, resulting in an emphasis on continued growth in productivity and an even greater dependence on oil. The Middle East thus moved to the center of foreign-policy strategies for a number of Western nations, becoming also a site of contentious ideological positioning between the Soviet Union and the United States, with both nations acting out their political differences through technical aid and development projects as well as cultural exports. Although some small Persian Gulf monarchies enjoyed considerable advantages over their oil-poor neighbors, toWesterners the regionmaintained its conceptual integrity as a site of superpower struggle and vast economic opportunity.7 The creation of the state of Israel, on May 14, 1948, also helped consolidate an idea of the Middle East, albeit in a way unanticipated by mostWestern politicians. Although Jewish immigration to the area in the first half of the twentieth century had profoundly accected the economic and demographic character of Mandate Palestine, the United Nations' 1947 plan to partition the area into Jewish and Arab states,whichwas rejected by the Arab League, formed in 1945, seemed only to reassert Western colonialism at the very moment it was breaking apart elsewhere. Within this context, theMiddle Eastmust be historically situated as a place defined both by European colonial interests and by the specific imperial configurations that had existed in the region. Just as the specter of essentialism hovers over the term ""Middle East,"" one may argue that it also haunts the idea of a homogeneous ""Europe""; nonetheless, as Dipesh Chakrabarty has argued in another context, these terms highlight, rather than obfuscate, the problematic of domination and intellectual dependency that permeates any discussion of these two entities.8 The interdependency of Europe and the Middle East can be seen in the unfolding of an ""Oriental"" supplement to European identity: what was understood by nineteenth-century policymakers as the ""Eastern question"" had to do less with the inhabitants of these regions than with the raw currency of human labor and material wealth promised through imperialism. © 2008 by University of Washington Press. All rights reserved.",,"Isenstadt S., Rizvi K.",
100,11.0,2015,Book,"Cosmology, calendars, and horizon-based astronomy in ancient mesoamerica","Cosmology, Calendars, and Horizon-Based Astronomy in Ancient Mesoamerica is an interdisciplinary tour de force that establishes the critical role astronomy played in the religious and civic lives of the ancient peoples of Mesoamerica. Providing extraordinary examples of how pre-Columbian peoples merged ideas about the cosmos with those concerning calendar and astronomy, the volume showcases the value of detailed examinations of astronomical data for understanding ancient cultures. The volume is divided into three sections: Investigations into Mesoamerican horizon-based astronomy, the cosmological principles expressed in Mesoamerican religious imagery and rituals related to astronomy, and the aspects of Mesoamerican calendars related to archaeoastronomy. It also provides cutting-edge research on diverse topics such as records of calendar and horizon-based astronomical observation (like the Dresden and Borgia codices), iconography of burial assemblages, architectural alignment studies, urban planning, and counting or measuring devices. Contributors—who are among the most respected in their fields— explore new dimensions in Mesoamerican timekeeping and skywatching in the Olmec, Maya, Teotihuacano, Zapotec, and Aztec cultures. It will be of great interest to students and scholars of anthropology, archaeology, art history, and astronomy. © 2015 by University Press of Colorado.",,Milbrath S.,
101,11.0,2014,Article,"Indigenous Rough Sleeping in Darwin, Australia: 'Out of Place' in an Urban Setting","Much of what is known of street homelessness is informed by accounts from urban centres throughout North America and the UK. The nature of the problem and the ways in which it is addressed are implicitly assumed to be similar across diverse major cities. The street homeless are thought to be highly marginalised and vulnerable. In turn, contemporary policy aims to provide housing/accommodation and welfare to address this form of homelessness as deep exclusion. Based on empirical research in Australia's northernmost capital city, Darwin, this article demonstrates the role of culture in how homelessness is experienced and addressed. It argues that cultural mobility and modes of behaviour that normalise rough sleeping are embedded within condoned poverty and discriminatory legislation directed towards Indigenous people. Indigenous people are constructed as out of place in urban environments and rather than housing and welfare, the focus is directed towards moving the problem. © 2013 Urban Studies Journal Limited.",,"Parsell C., Phillips R.",10.1177/0042098013484541
102,11.0,2000,Article,Virtual study abroad and exchange studio,"The digital design studio has an area of application where conventional media are incapable of being used; collaboration in learning, design and dialogue with people in places other than where one lives. This distinctive opportunity has lead the authors to explore a form of design brief and virtual design studio (VDS) format not well addressed in the literature. Instead of sharing the same design brief, students in this alternative format design a project in the other students' city and do not collaborate on the same design. Collaboration with other students takes the form of teaching each other about the city and culture served by the design. The authors discovered these studios produce a focus on site context that serves our pedagogical objectives - a blend of architectural, landscape architectural and urban design knowledge. Their students use a range of commercial CAD and computer supported collaborative work (CSCW) software common to that used in many VDS experiments reported on in the literature. However, this conventional use of technology is contrasted with a second distinctive characteristic of these studios, the use of custom software tools specifically designed to support synchronous and asynchronous three-dimensional model exchange and linked attribute knowledge. The paper analyzes some of the virtual design studio (VDS) work between the Swiss Federal Institute of Technology, the University of Toronto, and the University of Melbourne. The authors articulate a framework of VDS dimensions that structures their teaching and research.",,"Dave B., Danahy J.",10.1016/S0926-5805(99)00048-5
105,10.0,2019,Conference Paper,Enablers and Barriers of Lean Implementation in Construction Projects,"Lean aims to maximize customer satisfaction while minimizing waste. However, Lean philosophy has not been well understood yet in the construction industry for the fact that the complexity and dynamic nature of construction projects bring up uncertainties that may be hardly handled by construction practitioners. Moreover, project-based nature of construction business makes Lean implementation even more challenging for construction people. Even though Lean efforts in construction have recently increased, there are problems with the implementation processes. It is undeniable that successful Lean implementation strongly affects project performance. Therefore, it is essential to reveal enablers and barriers in Lean implementation so that the construction industry practitioners might conduct projects more effectively and satisfy project requirements (i.e. schedule, budget, safety). This study aims to provide a set of core enablers and barriers of Lean implementation in construction projects and guide construction professionals to better satisfy project requirements. Within this context, the study proposes seven major enabler and barrier groups, namely the financial, managerial, technical, workforce, culture, government, and communication and twenty-seven components for each group. Moreover, a survey was designed and administered to Lean practitioners to rank the enablers and barriers based on importance level. Clear understanding of technical requirements in Lean practices was ranked as the most important enabler of Lean implementation whereas lack of top management support was ranked as the most important barrier in the Lean implementation. However, the average rankings were not found to be diverging indicating that selected components of enabler and barrier groups are properly chosen. The study is expected to lead Lean practitioners with creating value to customers while preventing them from experiencing waste. © 2019 Published under licence by IOP Publishing Ltd.",,"Bayhan H.G., Demirkesen S., Jayamanne E.",10.1088/1757-899X/471/2/022002
111,9.0,2016,Article,The Role of the Built Environment in Human Life. Selected Issues,"Creation of the built environment and research in this field pose a particularly difficult challenge nowadays. The pace of social and technological change does not allow for evolutionary development of cities and the formation of their land use according to current conditions. Creating spatial solutions that are unmatched in their contexts is becoming not only possible, but very probable (see Alexander, 1964). The development of the built environment involves not only art, technology, history, economics and law, but also philosophy, culture, medicine, psychology, sociology and many other spheres in which human life is manifested. However, only a relatively small number of disciplines such as spatial planning, urban design, urban planning, etc. (ignoring at this point the differences in the meaning of the concepts) in their application layer are meant to create space and bear responsibility for it. Also society has certain requirements of practical nature towards them. This article attempts to outline the nature of research on space urbanised by people and to determine the four main fields of research aimed at the problems of man and the built environment. In the next part, particular attention is paid to issues related to the impact of the built environment on the life of its residents in order to highlight the particular role and complexity of this area of research. This study, acting as a kind of test of the research, cannot be considered representative. Nevertheless, the analysis prompts several reflections on the current and future role of the built environment in the development of our civilisation, as well as further challenges related to it. © 2016 European Spatial Research and Policy 2016.",built environment; physical environment; quality of life; spatial planning; urban planning,Lamprecht M.,10.1515/esrp-2016-0011
114,9.0,2011,Article,"Borrowing from the past to sustain the present and the future: indigenous African urban forms, architecture, and sustainable urban development in contemporary Africa","Urban spatial expansion resulting from urbanization in Sub-Saharan Africa (SSA) is not going to stop or stabilize in the near future. Efforts should therefore be concentrated on accommodating this phenomenon through the promotion of sustainable urban planning and development. Relying on secondary data, this paper examines models of indigenous African urban forms and architecture to understand these forms and their characteristics, and how these models and associated management, design, and planning principles can be adopted in contemporary SSA urban development in the quest to achieve sustainable urban development. This paper argues that planning is culturally and contextually defined and the specificities of a place are critical in planning. Developing strategies based on indigenous urban forms which embody local peoples' culture, aspirations, experiences, and values is consistent with the concept of sustainable urban development. The article concludes that there exist clear elements of socially, politically, economically, culturally, and environmentally sound and responsive sustainable planning principles to be derived from indigenous urban forms and architecture which can inform current urban development process in SSA. © 2011 Copyright Taylor and Francis Group, LLC.",indigenous; Sub-Saharan Africa; sustainable urban development; urban form,Asomani-Boateng R.,10.1080/17549175.2011.634573
115,9.0,2007,Article,Information technologies and civic engagement: Perspectives from librarianship and planning,"Urban planning and librarianship are parallel fields in many ways. Both have theoretical and practical underpinnings driving each discipline; are interdisciplinary in focus; and both professions gather and disseminate information to stakeholders. Essential to the success of each discipline is an engaged user population. The authors use a case study from the Village of Oak Park to examine and reflect upon the effect of the Internet and other technologies in the public's ability to participate in an open planning process. The Village of Oak Park is known for its architectural heritage and outspoken community. Within its 4.5 square miles live a diverse population of approximately 52,000 people from different cultures, races, ethnicities, professions, lifestyles, religions, ages, and incomes where a majority of the population have some advanced education and over 80% of the households report home Internet use. How does a community like the Village of Oak Park engage in the planning process? What role does information play in this process? Can modern Information Technologies facilitate civic engagement? These questions are examined during a year-long case study conducted by the University of Illinois at Chicago (UIC) in cooperation with the Village of Oak Park (VOP). Specifically, the investigators examined how information is gathered and used in the planning process and how the introduction of Information Technology (IT) tools influenced public participation and introduced many citizens to e-government through the planning process. The use of these tools is compared to the traditional planning process. Data from the project is presented to demonstrate a different kind of role librarians play in the research process. Last, the authors discuss the role of privacy in the gathering and sharing of information with the reliability of that information and the impact of privacy on the public planning process. © 2006 Elsevier Inc. All rights reserved.",,"Quinn A.C., Ramasubramanian L.",10.1016/j.giq.2006.08.005
116,9.0,2000,Article,Integrative analysis of city systems: Bangkok 'man and the biosphere' programme study,"This paper argues that integrative analysis of city systems helps us to see beyond their current environmental and social problems to underlying causes, and it suggests different opportunities for possible interventions. Focusing on a single aspect of a city or its people without understanding its context risks interventions which treat symptoms rather than causes and whose short-term 'solution' often means that the problem returns in the same or perhaps a different form. Our integrative analysis of Bangkok suggests that the root of its environmental (and some social) problems lie in decision-making structures and a political culture which has historically fostered self interested decisions by stakeholders rather than the public interest. This has produced a land use and built environment configuration that largely ignores the functioning of the natural flood plain ecosystem and the well-being of residents. People adapt their behaviour to their environment but often in ways that have serious cumulative impacts on the city. This analysis suggests that problems need to be addressed at their source: the nature of decision-making by stakeholders, at every level. This requires the engagement of all parties inside and outside government, the elite and otherwise. To the extent that planning has a viable role, the focus needs to be on the source of the impacts, such as national development planning, rather than in sectors such as transport, where the problems are evident.",,"Ross H., Poungsomlee A., Punpuing S., Archavanitkul K.",10.1177/095624780001200212
