DocId,Cited by,Year,Document Type,Title,Abstract,Author Keywords,Authors,DOI
290,1.0,2020,Article,Uncertainties of human perception in visual image interpretation in complex urban environments,"Today satellite images are mostly exploited automatically due to advances in image classification methods. Manual visual image interpretation (MVII), however, still plays a significant role e.g., to generate training data for machine-learning algorithms or for validation purposes. In certain urban environments, however, of e.g., highest densities and structural complexity, textural and spectral complications in overlapping roof-structures still demand the human interpreter if one aims to capture individual building structures. The cognitive perception and real-world experience are still inevitable. Against these backgrounds, this article aims at quantifying and interpreting the uncertainties of mapping rooftop footprints of such areas. We focus on the agreement among interpreters and which aspects of perception and elements of image interpretation affect mapping. Ten test persons digitized six complex built-up areas. Hereby, we receive quantitative information about spatial variables of buildings to systematically check the consistency and congruence of results. An additional questionnaire reveals qualitative information about obstacles. Generally, we find large differences among interpreters' mapping results and a high consistency of results for the same interpreter. We measure rising deviations correlate with a rising morphologic complexity. High degrees of individuality are expressed e.g., in time consumption, in-situ- or geographic information system (GIS)-precognition whereas data source mostly influences the mapping procedure. By this study, we aim to fill a gap as prior research using MVII often does not implement an uncertainty analysis or quantify mapping aberrations. We conclude that remote sensing studies should not only rely unquestioned on MVII for validation; furthermore, data and methods are needed to suspend uncertainty. © 2008-2012 IEEE.",Cognition; earth observation; elements of image interpretation; level of individual buildings (LoD-1); manual visual image interpretation (MVII); perception; uncertainty; urban morphology,"Kraff N.J., Wurm M., Taubenbock H.",10.1109/JSTARS.2020.3011543
305,11.0,2020,Article,A machine learning-based classification system for urban built-up areas using multiple classifiers and data sources,"Information about urban built-up areas is important for urban planning and management. However, obtaining accurate information about urban built-up areas is a challenge. This study developed a general-purpose built-up area intelligent classification (BAIC) system that supports various types of data and classifiers. All of the steps in the BAIC were implemented using Python modules including Numpy, Pandas, matplotlib, and scikit-learn. We used the BAIC to conduct a classification experiment that involved seven types of input data; namely, Point of Interest (POI), Road Network (RN), nighttime light (NTL), a combination of POI and RN data (POI_RN), a combination of POI and NTL data (POI_NTL), a combination of RN and NTL data (RN_NTL), and a combination of POI, RN, and NTL data (POI_RN_NTL), and five classifiers, namely, Logistic Regression (LR), Decision Tree (DT), Random Forests (RF), Gradient Boosted Decision Trees (GBDT), and AdaBoost. The results show the following: (1) among the 35 combinations of the five classifiers and seven types of input data, the overall accuracy (OA) ranged from 76 to 89%, F1 values ranged from 0.73 to 0.86, and the area under the receiver operating characteristic (ROC) curve (AUC) ranged from 0.83 to 0.95. The largest F1 value and OA were obtained using the POI_RN_NTL data and AdaBoost, while the largest AUC was obtained using POI_RN_NTL and POI_NTL data against AdaBoost, LR, and RF; and (2) the advantages of the BAIC include its support for multi-source input data, its objective accuracy assessment, and its robust classifiers. The BAIC can quickly and efficiently realize the automatic classification of urban built-up areas at a reasonably low cost and can be readily applied to other urban areas in the world where any kind of POI, RN, or NTL data coverage is available. The results of this study are expected to provide timely and effective reference information for urban planning and urban management departments, and could also potentially be used to develop large-scale maps of urban built-up areas in the future. © 2019 by the authors.",Machine learning; NTL; POI; Road network; Urban built-up area,"Sun L., Tang L., Shao G., Qiu Q., Lan T., Shao J.",10.3390/RS12010091
315,,2019,Conference Paper,Urban street contexts classification using convolutional neural networks and streets imagery,"The classification of streets on road networks has been focused on the vehicular transportational features of streets. Examples of street labels include arterials, major roads, minor roads and so forth based on their transportational use. City authorities on the other hand have been shifting to more wholistic planning of streets. The modern approach towards designing and planning streets is more inclusive of the street context, meaning the side use of a street combined with the transportational features of a street. Several city authorities are developing new classification schemes for street context that extends traditional classification methods to include the use of land on the sides of a street. In those classification schemes, streets are labeled for example as commercial throughway, residential neighborhood, park etc. This modern approach to urban planning have been adopted by major cities such as the city of San Francisco, the state of Florida and Pennsylvania among many others. Currently, the process of labeling streets according to their contexts is manual and hence is tedious and time consuming. It will require manual labor to regularly relabel streets as the city develops. In this paper, we propose an approach to deploy advancements in computer vision towards modern urban planning. We propose a framework for automatic classification of street contexts. Using labeled street imagery we train deep convolutional neural networks (CNN) to perform the classification of street context. We show that CNN models can perform well achieving accuracies in the 81% to 87% range. We test various CNN architectures and report on their performances. © 2019 IEEE.",Applications; Big Data; Computer Vision; Data from the wild; IoT; Urban Computing,"Alhasoun F., Gonzalez M.",10.1109/ICMLA.2019.00198
318,16.0,2019,Article,Deprivation pockets through the lens of convolutional neural networks,"Machine learning techniques have been frequently applied to map urban deprivation (commonly referred to as slums) in very high-resolution satellite images. Among these, Deep Convolutional Neural Networks have shown exceptional efficiency in automated deprivation mapping at the local scale. Yet these networks have never been used to map very small heterogeneous deprivation areas (pockets) at large scale. This study proposes and evaluates a U-Net-Compound model to map deprivation pockets in Bangalore, India. The model only relies on RGB satellite images with a resolution of 2 m as these are more commonly accessible to local urban planning departments. The experiment assumes a practical situation where only limited reference data is available for the model to learn the spatial morphology of deprivation pockets. It tests whether an updated map of deprivation pockets can be obtained with limited information. The model performance to map a large number of deprivation pockets is examined by incrementally changing the model architecture and the amount of training data. Results show that the proposed model is sensitive to the amount of spatial information contained in the training data. Once sufficient spatial information is learnt through a few samples, the city scale mapping accuracy outperforms existing models in mapping small deprivation pockets, achieving a Jaccard Index of 54%. This study demonstrated that a well-designed convolutional neural network can map the existence, extent, as well as distribution patterns of deprivation pockets at the city scale with limited training data, which is essential for upscaling research outputs to provide important information for the formulation of pro-poor policies. © 2019",Bangalore; Convolutional neural networks; Deep learning; Deprivation pockets; Slums,"Wang J., Kuffer M., Roy D., Pfeffer K.",10.1016/j.rse.2019.111448
323,7.0,2019,Article,An urban data framework for assessing equity in cities: Comparing accessibility to healthcare facilities in Cascadia,"As cities continue to grow worldwide, policymakers and urban planners face the dual task of meeting rising demand for essential services while ensuring that benefits accrue to their citizens equitably. We propose a framework for assessing inclusivity and equity in cities, which leverages open data and machine learning techniques to inform urban infrastructure investment strategies. The framework is applied at a regional scale to compare differential access to healthcare facilities (public hospitals and clinics) via public transit in Vancouver, Seattle and Portland. We find important distributional impacts on vulnerable populations across the three cities. Portland displays the highest inequity in hospital and clinic access, and Vancouver the least, owing to Vancouver's relatively compact geographic area and high population density. For seniors, over 75% are socially excluded from hospitals and over 50% from clinics in Portland, compared to 30% and 3% respectively in Vancouver. In all three cities, significantly more residents of low-income neighborhoods are excluded from healthcare compared to their counterparts in high-income neighborhoods. This translates into proportionally higher transportation costs for low-income area residents compared with high-income area residents, regardless of whether they are socially excluded or not. Transportation costs are notably high for low-income seniors in Seattle and Vancouver. These findings pose a challenge for inclusive planning, since low-income and senior populations may require specialized services and are more reliant on public transportation than the average population. Our evaluation framework provides a systematic approach for municipalities to account for the distributional effects of transportation and service infrastructure planning, to integrate equity into their decision-making, and to learn from the successes and pitfalls of each other's urban policies. © 2019 Elsevier Ltd",Equality; Gini index; Inclusivity; Machine learning; Self-organizing maps,"Mayaud J.R., Tran M., Nuttall R.",10.1016/j.compenvurbsys.2019.101401
339,13.0,2019,Article,Impact of community deprivation on urban park access over time: Understanding the relative role of contributors for urban planning,"As an important element of urban landscapes, park plays an important role in building environmentally sustainable cities. Thus, it is important to examine park accessibility and how it changes over time in relation to community deprivation so as to provide all residents with equitable services. Using the Gaussian-based 2SFCA (two-step floating catchment area) method, this paper analyzes dynamic park accessibility from 2016 to 2018 for communities within the Hangzhou metropolitan area in China and then quantifies the relative role of local contributors to park accessibility changes (population, park and transport network). A machine learning algorithm, which handles the interdependences of deprivation dimensions, is further employed to determine the relationship between community deprivation and park accessibility changes. Results show that park accessibility continued to grow during the study period, and most communities achieved excellent park accessibility by 2018. Population decreases and park increases contribute positively to improved park accessibility, while transport network changes have had less of an impact. Deprived communities have observed a rising trend of park accessibility, while the elderly concentrated communities are more likely to experience declined park accessibility. Our study provides a new methodological framework, which integrates the geographical accessibility model, economic chain substitution model and machine learning algorithm, for understanding the dynamic park access and associated social inequalities in rapidly urbanizing regions. The lessons learned from this study should be insightful for urban planning. © 2019 Elsevier Ltd",Accessibility; Dynamic changes; Green spaces; Hangzhou; Neighborhood SES; Park; Social deprivation,"Li Z., Wei H., Wu Y., Su S., Wang W., Qu C.",10.1016/j.habitatint.2019.102031
365,3.0,2019,Article,Using Random Forests on Real-World City Data for Urban Planning in a Visual Semantic Decision Support System,"The constantly increasing amount and availability of urban data derived from varying sources leads to an assortment of challenges that include, among others, the consolidation, visualization, and maximal exploitation prospects of the aforementioned data. A preeminent problem affecting urban planning is the appropriate choice of location to host a particular activity (either commercial or common welfare service) or the correct use of an existing building or empty space. In this paper, we propose an approach to address these challenges availed with machine learning techniques. The proposed system combines, fuses, and merges various types of data from different sources, encodes them using a novel semantic model that can capture and utilize both low-level geometric information and higher level semantic information and subsequently feeds them to the random forests classifier, as well as other supervised machine learning models for comparisons. Our experimental evaluation on multiple real-world data sets comparing the performance of several classifiers (including Feedforward Neural Networks, Support Vector Machines, Bag of Decision Trees, k-Nearest Neighbors and Naïve Bayes), indicated the superiority of Random Forests in terms of the examined performance metrics (Accuracy, Specificity, Precision, Recall, F-measure and G-mean).",decision support system; machine learning; random forests; urban planning,"Sideris N., Bardis G., Voulodimos A., Miaoulis G., Ghazanfarpour D.",10.3390/s19102266
383,10.0,2019,Article,"Comparison of approaches for urban functional zones classification based on multi-source geospatial data: A case study in Yuzhong District, Chongqing, China","Accurate and timely classification and monitoring of urban functional zones prove to be significant in rapidly developing cities, to better understand the real and varying urban functions of cities to support urban planning and management. Many efforts have been undertaken to identify urban functional zones using various classification approaches and multi-source geospatial datasets. The complexity of this category of classification poses tremendous challenges to these studies especially in terms of classification accuracy, but on the opposite, the rapid development of machine learning technologies provides us with new opportunities. In this study, a set of commonly used urban functional zones classification approaches, including Multinomial Logistic Regression, K-Nearest Neighbors, Decision Tree, Support Vector Machine (SVM), and Random Forest, are examined and compared with the newly developed eXtreme Gradient Boosting (XGBoost) model, using the case study of Yuzhong District, Chongqing, China. The investigation is based on multi-variate geospatial data, including night-time imagery, geotagged Weibo data, points of interest (POI) from Gaode, and Baidu Heat Map. This study is the first endeavor of implementing the XGBoost model in the field of urban functional zones classification. The results suggest that the XGBoost classification model performed the best and was able to achieve an accuracy of 88.05%, which is significantly higher than the other commonly used approaches. In addition, the integration of night-time imagery, geotagged Weibo data, POI from Gaode, and Baidu Heat Map has also demonstrated their values for the classification of urban functional zones in this case study. © 2018 by the authors.",Multi-source geospatial data; Urban functional zones classification; XGBoost; Yuzhong district,"Cao K., Guo H., Zhang Y.",10.3390/su11030660
396,,2019,Conference Paper,Exploring different combinations of data and methods for urban land use analysis: A survey,"Modern planning and management of urban spaces is an essential topic for smart cities and depends on up-to-date and reliable information on land use and functional roles of the places that integrate urban areas. In the last years, driven by increased availability of geo-referenced data from social or embedded sensors and remote sensing (RS) images, various methods become popular for land use analysis. This paper addresses the various methods employed in this context, as well as needed data and respective categorization, best applications of each method, and their comparison. We focus on approaches based on data from RS images, open maps and various categories of crowdsourced data. We identify and discuss the way these approaches use Data Mining (DM) and Machine Learning (ML). From our initial study we concluded that even using the same methods and the same kind of data, results depend on spatial configuration of the data, accordingly to the specificity of each region. The work described in this paper is intended to provide relevant contributions to method selection for knowledge discovery for city planning and management, taking into consideration available data and the pros and cons of each technique. Copyright © 2019 for this paper by its authors.",,"Andrade R., Alves A., Bento C.",
397,2.0,2019,Conference Paper,Detecting advertising on building façades with computer vision,"Outdoor advertising influences the visual environment of any modern city. Advertising and information signs on building façades are one of the types of outdoor advertising. As a rule, there are laws and design codes in cities that define permissible look of such signs. At the same time, in metropolises, there is a problem of timely detection of advertising constructions on façades that violate these rules. City-scale monitoring of façade conditions is beyond the capabilities of any city's authorities. To address this issue, we propose a solution which combines street-view maps and machine learning to automate the process of searching for law-breaking advertising objects on building façades. We develop a dataset for a machine learning model and a set of checks for detected advertising objects to check their legality. The resulting approach can provide data for future research and help maintain coherent urban visual environment. © 2018 Elsevier B.V. All rights reserved.",building façades; computer vision; illegal advertising; machine learning; urban studies; urban visual environment,"Bochkarev K., Smirnov E.",10.1016/j.procs.2019.08.210
401,,2019,Conference Paper,Multi-criteria Evaluation vs Perceived Urban Quality: An Exploratory Comparison,"This study compares a service-based and environmental evaluation of an urban area with that of its perceived walkability. The Pampulha region in Belo Horizonte, Brazil was first put through a multi-criteria spatial evaluation with respect to a set of spatial data considered relevant for liveability and quality of life in cities, and was subsequently assessed in terms of perceived walkability (using a machine learning procedure of a training set provided by local auditors). The two types of analysis were compared and qualitatively aggregated to obtain a joint spatial score of the urban environment. The findings provide useful insights for planning and urban policy. © 2019, Springer Nature Switzerland AG.",Machine learning; Spatial multi-criteria analysis; Urban quality; Walkability assessment,"Blečić I., Santos A.G., Moura A.C., Trunfio G.A.",10.1007/978-3-030-24302-9_44
402,2.0,2019,Conference Paper,Development of generating system for architectural color icons using google map platform and tensorflow-segmentation,"In this research, the goal is to develop a generating system for architectural color icons using Google Map Platform and Tensorflow-Segmentation. There has been no case of developing a system that allows users to visualize the color tendency of buildings as architectural color icons for each building element from images of various regions. It is considered meaningful to be able to create criteria for decision making in architecture and the urban design by developing a system to clarify the current state of the architectural colors. It will contribute a rise in the consciousness of landscape conservation and be essential for the design of architectures and public objects. This paper includes the explanation of development method, use experiments, and consideration of five problems among architectural color icons creation. It is assumed that the accuracy of the present system will be better as the technology improves. © 2019 and published by the Association for Computer-Aided Architectural Design Research in Asia (CAADRIA), Hong Kong.",Color analysis; Color palette; Google street view; Image segmentation; Machine learning,"Kato Y., Matsukawa S.",
413,10.0,2019,Article,Mapping long-term dynamics of population and dwellings based on a multi-temporal analysis of urban morphologies,"Information on the distribution and dynamics of dwellings and their inhabitants is essential to support decision-making in various fields such as energy provision, land use planning, risk assessment and disaster management. However, as various different of approaches to estimate the current distribution of population and dwellings exists, further evidence on past dynamics is needed for a better understanding of urban processes. This article therefore addresses the question of whether and how accurately historical distributions of dwellings and inhabitants can be reconstructed with commonly available geodata from national mapping and cadastral agencies. For this purpose, an approach for the automatic derivation of such information is presented. The data basis is constituted by a current digital landscape model and a 3D building model combined with historical land use information automatically extracted from historical topographic maps. For this purpose, methods of image processing, machine learning, change detection and dasymetric mapping are applied. The results for a study area in Germany show that it is possible to automatically derive decadal historical patterns of population and dwellings from 1950 to 2011 at the level of a 100 m grid with slight underestimations and acceptable standard deviations. By a differentiated analysis we were able to quantify the errors for different urban structure types. © 2018 by the authors.",Dasymetric mapping; Dwelling units; Dynamics; Estimation; Historical demography; Multi-temporal; Population; Topographic maps; Urban morphology; Urban planning,"Hecht R., Herold H., Behnisch M., Jehling M.",10.3390/ijgi8010002
445,5.0,2018,Conference Paper,Deep CNN-based methods to evaluate neighborhood-scale urban valuation through street scenes perception,"Social data from city level provides unprecedented opportunities to identify urban attributes from various angles. Citizens are likely to evaluate the quality of the neighborhood and make important decisions by their perceptions and the feedback from the environment. In this paper, we studied the correlation between the neighborhood's environment with their properties values and land values. It is profitable to train the algorithm by parallel deep convolutional neural networks on the visual urban scenes data associated with quantitative non-visual urban characteristics in the same views. The result of our approach defines a scenarized profile from building-level details to city-level traits. The main contribution of this work is providing a unique and more accurate perspective to urban valuation estimations, by integrating the scattered sources of pieces of information and implanting into the available images. This urban evaluation approach will be more human-centered, which can be extended to help urban planners and citizens to explore the significant impacts on city decision optimization or spatial economics-related issues like decreasing the cost of properties assessment. © 2018 IEEE.",Deep convolutional neural network; Machine learning; Properties valuation assessment; Street view imagery; Urban study,"Zhao J., Liu X., Kuang Y., Chen Y.V., Yang B.",10.1109/DSC.2018.00012
