DocId,Cited by,Year,Document Type,Title,Abstract,Author Keywords,Authors,DOI
449,102.0,2018,Article,Using image recognition to automate assessment of cultural ecosystem services from social media photographs,"Quantifying and mapping cultural ecosystem services is complex because of their intangibility. Data from social media, such as geo-tagged photographs, have been proposed for mapping cultural use or appreciation of ecosystems. However, manual content analysis and classification of large numbers of photographs is time consuming. This study develops a novel method for automating content analysis of social media photographs for ecosystem services assessment. The approach applies an online machine learning algorithm – Google Cloud Vision – to analyse over 20,000 photographs from Singapore, and uses hierarchical clustering to group these photographs. The accuracy of the classification was assessed by comparison with manual classification. Over 20% of photographs were taken of nature, being of animals or plants. The distribution of nature photographs was concentrated around particular natural attractions, and nature photographs were more likely to occur in parks and areas of high vegetation cover. The approach developed for clustering photographs was accurate and saved approximately 170 h of manual work. The method provides an indicator of cultural ecosystem services that can be applied rapidly over large areas. Automated assessment and mapping of cultural ecosystem services could be used to inform urban planning. © 2017 Elsevier B.V.",Machine learning; Recreation; Recreational ecosystem services; Singapore; Urban ecology,"Richards D.R., Tunçer B., Tunçer B.",10.1016/j.ecoser.2017.09.004
455,1.0,2018,Conference Paper,Can we predict the scenic beauty of locations from geo-tagged Flickr images?,"In this work, we propose a novel technique to determine the aesthetic score of a location from social metadata of Flickr photos. In particular, we built machine learning classifiers to predict the class of a location where each class corresponds to a set of locations having equal aesthetic rating. These models are trained on two empirically build datasets containing locations in two different cities (Rome and Paris) where aesthetic ratings of locations were gathered from TripAdvisor.com. In this work we exploit the idea that in a location with higher aesthetic rating, it is more likely for an user to capture a photo and other users are more likely to interact with that photo. Our models achieved as high as 79.48% accuracy (78.60% precision and 79.27% recall) on Rome dataset and 73.78% accuracy(75.62% precision and 78.07% recall) on Paris dataset. The proposed technique can facilitate urban planning, tour planning and recommending aesthetically pleasing paths. © 2018 ACM.",Data mining; Flickr; Machine learning; Social metadata,"Rakin Haider Ch.Md., Ali M.E.",10.1145/3172944.3173000
470,,2018,Conference Paper,Investigating Customer Satisfaction Patterns in a Community Livability Context: An Efficiency-Oriented Decision-Making Approach,"A comprehensive understanding of neighborhood facilities distribution and functions along with residential quality of life satisfaction is a key asset for relating livability management to transportation networks. Due to the simultaneous involvement of varied factors with an individual's perception of livability, this concept is difficult to measure. Therefore, a more objective means of quantifying livability is needed. The service industry has demonstrated the intersection of machine learning classifiers and survey domain knowledge for evaluating users' quality of experiences; however, this process of inquiry-based learning has never been considered for solving the communication difficulties between community stakeholders and transportation agencies. Another area of overlap is that of urban computing, which integrates computing technology in the traditional context of urban areas, connecting ubiquitous sensing technologies, computational power, and data about the urban environment to promote quality of life for people living in a particular community. To this aim, the focus of this study is on interpreting a linkage between society stated preferences and quantitative measures of livability by extracting information from survey-based methods and translating it to a quantitative framework using combined service industry and urban computing methodologies. This work focuses on four transportation planning-related research questions in this blended framework: understanding existing livability patterns, predicting heterogeneous perceptions of quality of life, prioritizing public preferences, and developing a multidimensional livability index (MLI). © 2018 American Society of Civil Engineers.",,"Sarram G., Ivey S.S.",10.1061/9780784481561.019
480,,2017,Conference Paper,Localization Decisions of Entrepreneurs: The Role of Path Dependency and Market Forces,"The purpose of this research is to determine the role of path dependency and market forces in the localization decisions of entrepreneurs from different industries. We hypothesize that most industries develop new entities based on the number of companies from the same industry that already exist in a region. We also hypothesize that entrepreneurs create new entities based on related industries operating within the same knowledge pool. To test these hypotheses, we used the machine learning decision tree method. The input variables are the number of companies from 86 industries located in 2,531 communities in Poland in 2009. The target values are the number of new companies from these industries created in the years 2009-2015. The principal results show that localization decisions are mostly based on demand and supply industries, in which manufacturing industries play crucial role. Path dependency appears in less than half of the industries' models and thus is not the main factor influencing decisions regarding the creation of new companies. The highest share of path-dependent industries is in manufacturing sector, but the degree of the dependence is lower than in the service sector. The service sector seems to be the least path-dependent, as services usually serve other industries. Competition in industries is a rare factor in new company creation; however, if it appears, it usually shrinks the industry. © Published under licence by IOP Publishing Ltd.",,"Pylak K., Majerek D.",10.1088/1757-899X/245/6/062025
482,38.0,2017,Article,Building block level urban land-use information retrieval based on Google Street View images,"Land-use maps are important references for urban planning and urban studies. Given the heterogeneity of urban land-use types, it is difficult to differentiate different land-use types based on overhead remotely sensed data. Google Street View (GSV) images, which capture the façades of building blocks along streets, could be better used to judge the land-use types of different building blocks based on their façade appearances. Recently developed scene classification algorithms in computer vision community make it possible to categorize different photos semantically based on various image feature descriptors and machine-learning algorithms. Therefore, in this study, we proposed a method to derive detailed land-use information at building block level based on scene classification algorithms and GSV images. Three image feature descriptors (i.e., scale-invariant feature transform-Fisher, histogram of oriented gradients, GIST) were used to represent GSV images of different buildings. Existing land-use maps were used to create training datasets to train support vector machine (SVM) classifiers for categorizing GSV images. The trained SVM classifiers were then applied to case study areas in New York City, Boston, and Houston, to predict the land-use information at building block level. Accuracy assessment results show that the proposed method is suitable for differentiating residential buildings and nonresidential buildings with an accuracy of 85% or so. Since the GSV images are publicly accessible, this proposed method would provide a new way for building block level land-use mapping in future. © 2017 Informa UK Limited, trading as Taylor & Francis Group.",GSV (Google Street View); image features; machine learning; urban land-use mapping,"Li X., Zhang C., Li W.",10.1080/15481603.2017.1338389
483,47.0,2017,Article,Mapping urban form and function at city block level using spatial metrics,"This paper focuses on the potential of urban metrics describing the presence and the configuration of built-up and open space areas for mapping distinct types of urban form and function at city block level. Next to traditional, patch-based metrics used in landscape ecology, alternative metrics are proposed, measuring the presence and the spatial arrangement of built-up and open space areas along a set of radial transects, along contours parallel to the urban block boundary and along the block's perimeter, as well as metrics describing the internal composition of the built-up area. Use of the proposed metrics for identifying different types of urban form and function was tested on the Brussels Capital Region. Large-scale vector data was used to define built-up structures and to analyse the morphological properties of the built-up area at block level. Decision tree classification was applied in conjunction with bootstrap aggregation to gain insight in the distinctive character of the defined metrics, and the robustness of land use and urban form classification based on these metrics. Our study points out the shortcomings of traditional landscape ecological metrics for mapping urban form and emphasizes the need for alternative approaches for analysing urban landscapes, more explicitly describing the morphological characteristics of the urban fabric. © 2017 Elsevier B.V.",Brussels Capital Region; Land use; Machine learning; Spatial metrics; Urban form; Urban function,"Vanderhaegen S., Canters F.",10.1016/j.landurbplan.2017.05.023
484,19.0,2017,Article,Structure and information in spatial segregation,"Ethnoracial residential segregation is a complex, multiscalar phenomenon with immense moral and economic costs. Modeling the structure and dynamics of segregation is a pressing problem for sociology and urban planning, but existing methods have limitations. In this paper, we develop a suite of methods, grounded in information theory, for studying the spatial structure of segregation. We first advance existing profile and decomposition methods by posing two related regionalization methods, which allow for profile curves with nonconstant spatial scale and decomposition analysis with nonarbitrary areal units. We then formulate a measure of local spatial scale, which may be used for both detailed, within-city analysis and intercity comparisons. These methods highlight detailed insights in the structure and dynamics of urban segregation that would be otherwise easy to miss or difficult to quantify. They are computationally efficient, applicable to a broad range of study questions, and freely available in open source software. © 2017, National Academy of Sciences. All rights reserved.",Diversity; Information theory; Machine learning; Multiscale analysis; Segregation,Chodrow P.S.,10.1073/pnas.1708201114
513,,2017,Conference Paper,The syntactic signature of starbucks' locations Towards a machine-learning approach to location decision-making,"The space syntax Theory of Natural Movement postulates that everything else being equal, land use selects their location based on the asymmetry of accessibility created by the configuration of the street network. In this article, I test the hypothesis whether configurational (syntactic) properties of an urban street network are relevant for the location of land use. If syntactic features are relevant, then land use types may have a 'syntactic signature'. To identify this blueprint, I apply machine-learning techniques to datasets of syntactic measures, for ten business types. The results are ten models, each with the syntactic blueprint of a type of business. The models are used to predict the existence, or not, of such businesses in segments of the map of London. The performance of the models varies, with fifty per cent reaching statistical significance, including one with 'good' prediction ability. The models for Starbucks coffee shops and solicitor's offices have the strongest prediction ability. The exploratory exercise demonstrates the potential of the machine-learning method Random Forests, when supervised and individually applied to a business activity, to identify the syntactic signature of business types. Such models can be used during planning and design and on location studies. The results strengthen the candidacy of syntactic measurements to location-decision-making. Moreover, they reinforce the theory of Natural Movement.",Land use; Machine-learning; Random forest; Space syntax; Spatial configuration; Urban planning.,Silva J.P.,
535,,2016,Conference Paper,Feature selection and knowledge extraction from buppu 2000 and 2010 censuses using artificial intelligence,"The census of population and dwellings undertaken by national state institutions world over at regular time intervals, is a fantastic source of information. However, there are major challenges to overcome when transforming the census data that usually consists of a vast number of attributes, into useful knowledge. In this paper, an artificial intelligent approach is investigated to select appropriate attribute features that indicate interesting patterns in Beppu census wards in 2000 and 2010. The results of the SOM (unsupervised artificial neural network) based clustering, GIS visualisation and machine learning (J48 and JRip functions of WEKA), provide relevant discerning features, new patterns and new knowledge that can be of use in many application domains, such as urban planning, resources management and transport planning. © 2015 IEEE.",component; GIS mapping; JRip and J48 (WEKA); Self-organising map clustering,"Shanmuganathan S., Yan L.",10.1109/FSKD.2015.7382087
538,3.0,2016,Conference Paper,Urban land use information retrieval based on scene classification of Google Street View images,"Land use maps are very important references for the urban planning and management. However, it is difficult and time-consuming to get high-resolution urban land use maps. In this study, we propose a new method to derive land use information at building block level based on machine learning and geo-tagged street-level imagery - Google Street View images. Several commonly used generic image features (GIST, HoG, and SIFT-Fisher) are used to represent street-level images of different cityscapes in a case study area of New York City. Machine learning is further used to categorize different images based on the calculated image features of different street-level images. Accuracy assessment results show that the method developed in this study is a promising method for land use mapping at building block level in future. © 2016, CEUR-WS. All rights reserved.",,"Li X., Zhang C.",
567,66.0,2014,Article,Building type classification using spatial and landscape attributes derived from LiDAR remote sensing data,"Building information is one of the key elements for a range of urban planning and management practices. In this study, an investigation was performed to classify buildings delineated from light detection and ranging (LiDAR) remote sensing data into three types: single-family houses, multiple-family houses, and non-residential buildings. Four kinds of spatial attributes describing the shape, location, and surrounding environment of buildings were calculated and subsequently employed in the classification. Experiments were performed in suburban and downtown sites in Denver, CO, USA, considering different building components and neighborhood environments. Building type classification results yielded overall accuracy > 70% and Kappa > 0.5 for both sites, demonstrating the feasibility of obtaining building type information from LiDAR data. The shape attributes, such as width, footprint area, and perimeter, were most useful for identifying building types. Environmental landscape attributes surrounding buildings, such as the number of road and parking lot pixels, also contributed to obtaining building type information. Combining shape and environmental landscape attributes was necessary to obtain accurate and consistent classification results. © 2014 Elsevier B.V.",Building classification; Decision trees; LiDAR; Machine learning; Random forest; Support vector machines,"Lu Z., Im J., Rhee J., Hodgson M.",10.1016/j.landurbplan.2014.07.005
575,7.0,2013,Conference Paper,Classification of sidewalks in street view images,"Mapping sidewalks in urban environments is key in the creation of pedestrian-friendly, sustainable cities. Currently, urban planners are hindered by a lack of information available in a format suitable for the large-scale analysis of sidewalk design. To demonstrate the impact that information technology could have in this area, we leverage techniques from machine learning and computer vision to gather information about the presence and quality of sidewalks in map images. In particular, we identify sidewalk segments in street view images using a random forest classifier, utilizing a set of local and global features that include geometric context, presence of lanes, pixel color, and location. Our results illustrate that this approach is effective in classifying sidewalk segments in a large set of street view images. This algorithm can be easily extended to other datasets, and can be automated to gather complete, fine-grained details about sidewalks for arbitrarily large urban environments. © 2013 IEEE.",,"Smith V., Malik J., Culler D.",10.1109/IGCC.2013.6604476
577,5.0,2012,Conference Paper,Classification of urban scenes from georeferenced images in urban street-view context,"This paper addresses the challenging problem of scene classification in street-view georeferenced images of urban environments. More precisely, the goal of this task is semantic image classification, consisting in predicting in a given image, the presence or absence of a pre-defined class (e.g. shops, vegetation, etc.). The approach is based on the BOSSA representation, which enriches the Bag of Words (BoW) model, in conjunction with the Spatial Pyramid Matching scheme and kernel-based machine learning techniques. The proposed method handles problems that arise in large scale urban environments due to acquisition conditions (static and dynamic objects/pedestrians) combined with the continuous acquisition of data along the vehicles direction, the varying light conditions and strong occlusions (due to the presence of trees, traffic signs, cars, etc.) giving rise to high intra-class variability. Experiments were conducted on a large dataset of high resolution images collected from two main avenues from the 12th district in Paris and the approach shows promising results. © 2012 IEEE.",kernel-based machine learning; semantic image classification; spatial pyramid matching; street-level images; visual words,"Iovan C., Picard D., Thome N., Cord M.",10.1109/ICMLA.2012.171
579,6.0,2012,Review,Visual gaze analysis of robotic pedestrians moving in urban space,"This study is founded on the idea that an analysis of the visual gaze dynamics of pedestrians can increase our understanding of how important architectural features in urban environments are perceived by pedestrians. The results of such an analysis can lead to improvements in urban design. However, a technical challenge arises when trying to determine the gaze direction of pedestrians recorded on video. High noise levels and the subtlety of human gaze dynamics hamper precise calculations. However, as robots can be programmed and analysed more efficiently than humans, this study uses them for developing and training a gaze analysis system with the aim to later apply it to human video data using the machine learning technique of manifold alignment. For this study, a laboratory was set up to become a model street scene in which autonomous humanoid robots of approximately 55cm in height simulate the behaviour of human pedestrians. The experiments compare the inputs from several cameras as the robot walks down the model street and changes its behaviour upon encountering visually attractive objects. Overhead recordings and the robot's internal joint signals are analysed after filtering to provide true data against which the recorded data can be compared for accuracy testing. A central component of the research is the calculation of a torus-like manifold that represents all the different three-dimensional (3D) head directions of a robot head and allows the ordering of extracted 3D gaze vectors obtained from video sequences. We briefly describe how the obtained multidimensional trajectory data can be analysed by using a temporal behaviour analysis technique based on support vector machines that was developed separately. © 2012 Copyright Taylor and Francis Group, LLC.",gaze analysis; localization; manifold learning; pedestrians; robots; saliency; tracking,"Wong A.S.W., Chalup S.K., Bhatia S., Jalalian A., Kulk J., Nicklin S., Ostwald M.J.",10.1080/00038628.2012.688013
591,8.0,2008,Conference Paper,Urban Data Mining using emergent SOM,The term of Urban Data-Mining is defined to describe a methodological approach that discovers logical or mathematical and partly complex descriptions of urban patterns and regularities inside the data. The concept of data mining in connection with knowledge discovery techniques plays an important role for the empirical examination of high dimensional data in the field of urban research. The procedures on the basis of knowledge discovery systems are currently not exactly scrutinised for a meaningful integration into the regional and urban planning and development process. In this study ESOM is used to examine communities in Germany. The data deals with the question of dynamic processes (e.g. shrinking and growing of cities). In the future it might be possible to establish an instrument that defines objective criteria for the benchmark process about urban phenomena. The use of GIS supplements the process of knowledge conversion and communication.,,"Behnisch M., Ultsch A.",10.1007/978-3-540-78246-9_37
