DocId,Cited by,Year,Document Type,Title,Abstract,Author Keywords,Authors,DOI
7,,2022,Article,Supervised Machine Learning Approaches to Modeling Residential Infill Development in the City of Los Angeles,"While infill development is widely accepted by cities as an alternative to urban sprawl, a very dearth of research has attempted to measure infill development and identify contributing factors to infill development. Filling this research gap, this paper models residential infill development in the City of Los Angeles by employing five machine learning (ML) algorithms. This paper attempts to identify the best-performing ML algorithms by comparing the performance of the ML algorithms. Of the five ML algorithms tested, the random forest (RF) and k-nearest neighbor (kNN) algorithms are selected as the best-performing algorithms. The RF algorithm ranks independent variables from most to least important. Overall, the ranks suggested that residential infill development in the City of Los Angeles is significantly influenced by the physical conditions of property and neighborhood rather than socioeconomic characteristics. Diverse land uses, good housing mixes, and rail transit accessibility also, importantly, contributed to the infill development. This finding suggests that the city's planning efforts, such as the promotion of accessory dwelling unit (ADU) development and the expansion of rail transit, can create a virtuous circle for sustainable urban development. © 2021 American Society of Civil Engineers.",,"Kim D., Shim J., Park J., Cho J., Kumar S.",10.1061/(ASCE)UP.1943-5444.0000787
15,,2022,Review,Automatic identification of addresses: A systematic literature review,"Address matching continues to play a central role at various levels, through geocoding and data integration from different sources, with a view to promote activities such as urban planning, location-based services, and the construction of databases like those used in census operations. However, the task of address matching continues to face several challenges, such as non-standard or incomplete address records or addresses written in more complex languages. In order to better understand how current limitations can be overcome, this paper conducted a systematic literature review focused on automated approaches to address matching and their evolution across time. The Preferred Reporting Items for Systematic Reviews and Meta-Analyses (PRISMA) guidelines were followed, resulting in a final set of 41 papers published between 2002 and 2021, the great majority of which are after 2017, with Chinese authors leading the way. The main findings revealed a consistent move from more traditional approaches to deep learning methods based on semantics, encoder-decoder architectures, and attention mechanisms, as well as the very recent adoption of hybrid approaches making an increased use of spatial constraints and entities. The adoption of evolutionary-based approaches and privacy preserving methods stand as some of the research gaps to address in future studies. © 2021 by the authors. Licensee MDPI, Basel, Switzerland.",Address geocoding; Address matching; Address parsing; Deep learning; Machine learning; Natural language processing,"Cruz P., Vanneschi L., Painho M., Rita P.",10.3390/ijgi11010011
34,,2021,Article,Identifying urban built environment factors in pregnancy care and maternal mental health outcomes,"Backgrounds: Risk factors related to the built environment have been associated with women’s mental health and preventive care. This study sought to identify built environment factors that are associated with variations in prenatal care and subsequent pregnancy-related outcomes in an urban setting. Methods: In a retrospective observational study, we characterized the types and frequency of prenatal care events that are associated with the various built environment factors of the patients’ residing neighborhoods. In comparison to women living in higher-quality built environments, we hypothesize that women who reside in lower-quality built environments experience different patterns of clinical events that may increase the risk for adverse outcomes. Using machine learning, we performed pattern detection to characterize the variability in prenatal care concerning encounter types, clinical problems, and medication prescriptions. Structural equation modeling was used to test the associations among built environment, prenatal care variation, and pregnancy outcome. The main outcome is postpartum depression (PPD) diagnosis within 1 year following childbirth. The exposures were the quality of the built environment in the patients’ residing neighborhoods. Electronic health records (EHR) data of pregnant women (n = 8,949) who had live delivery at an urban academic medical center from 2015 to 2017 were included in the study. Results: We discovered prenatal care patterns that were summarized into three common types. Women who experienced the prenatal care pattern with the highest rates of PPD were more likely to reside in neighborhoods with homogeneous land use, lower walkability, lower air pollutant concentration, and lower retail floor ratios after adjusting for age, neighborhood average education level, marital status, and income inequality. Conclusions: In an urban setting, multi-purpose and walkable communities were found to be associated with a lower risk of PPD. Findings may inform urban design policies and provide awareness for care providers on the association of patients’ residing neighborhoods and healthy pregnancy. © 2021, The Author(s).",Built environment; Postpartum depression; Pregnancy care,"Zhang Y., Tayarani M., Wang S., Liu Y., Sharma M., Joly R., RoyChoudhury A., Hermann A., Gao O.H., Pathak J.",10.1186/s12884-021-04056-1
43,1.0,2021,Article,An end-to-end point of interest (Poi) conflation framework,"Point of interest (POI) data serves as a valuable source of semantic information for places of interest and has many geospatial applications in real estate, transportation, and urban planning. With the availability of different data sources, POI conflation serves as a valuable technique for enriching data quality and coverage by merging the POI data from multiple sources. This study proposes a novel end-to-end POI conflation framework consisting of six steps, starting with data procurement, schema standardisation, taxonomy mapping, POI matching, POI unification, and data verification. The feasibility of the proposed framework was demonstrated in a case study conducted in the eastern region of Singapore, where the POI data from five data sources was conflated to form a unified POI dataset. Based on the evaluation conducted, the resulting unified dataset was found to be more comprehensive and complete than any of the five POI data sources alone. Furthermore, the proposed approach for identifying POI matches between different data sources outperformed all baseline approaches with a matching accuracy of 97.6% with an average run time below 3 min when matching over 12,000 POIs to result in 8699 unique POIs, thereby demonstrating the framework’s scalability for large scale implementation in dense urban contexts. © 2021 by the authors. Licensee MDPI, Basel, Switzerland.",Data conflation; Data fusion; Data integration; Machine learning; Natural language processing; Volunteered geographic information,"Low R., Tekler Z.D., Cheah L.",10.3390/ijgi10110779
65,,2021,Article,Application of random forest and shap tree explainer in exploring spatial (In)justice to aid urban planning,"In light of recent local, national, and global events, spatial justice provides a potentially powerful lens by which to explore a multitude of spatial inequalities. For more than two decades, scholars have been espousing the power of this concept to help develop more equitable and just communities. However, defining spatial justice and developing a methodology for quantitatively an-alyzing it is complicated and no agreed upon metric for examining spatial justice has been developed. Instead, individual measures of spatial injustices have been studied. One such individual measure is economic mobility. Recent research on economic mobility has revealed the importance of local geography on upward mobility and may serve as an important keystone in developing a metric for multiple place-based issues of spatial inequality. This paper seeks to explore place-based variables within individual census tracts in an effort to understand their impact on economic mobility and potentially spatial justice. The methodology relies on machine learning techniques and the results show that the best performing model is able to predict economic mobility of a census tract based on its spatial variables with 86% accuracy. The availability and density of jobs, compactness of the area, and the presence of medical facilities and underground storage tanks have the greatest influence, whereas some of the influential features are positively while the others are negatively associated. In the end, this research will allow for comparative analysis between differing geographies and also identify leading variables in the overall quest for spatial justice. © 2021 by the authors. Licensee MDPI, Basel, Switzerland.",Economic mobility; Geographic information systems; Random forest classifier; SHAP tree explainer; Spatial justice,"Deb D., Smith R.M.",10.3390/ijgi10090629
91,,2021,Article,Sustainable development scale of housing estates: An economic assessment using machine learning approach,"Economic sustainability is often addressed from the perspective of economic growth and at the national level. In contrast, this research attempts to examine the question of economic sustainability of human settlement at a local project level. Urban planners need to strike a balance between dispersal and over-concentration of population in cities. The existing theories suggest that either excessively low or extremely high levels of household concentration is undesirable to a neighborhood. In this study, an economic assessment using machine learning (ML) techniques is used to identify the threshold scale of a housing estate, which comprises many privately owned residential units (like condos) with shared amenities. Using two decades of property transaction data in Hong Kong as our evidence, this study has found that a tipping point exists in the development scale of these housing estates. Housing values initially rise with the number of residential units in a housing estate but gradually fall when it increases beyond a critical limit. This nonlinear economic relationship is attributed to the per household share of common facilities, which does not increase sufficiently to match with the growing population density of the housing estates. The policy implication is that, to optimize housing supply, urban planning should not just focus on increasing the development bulk of housing but should also pay attention to the possible bottlenecks in the provision of shared amenities in the neighborhood. © 2021 ERP Environment and John Wiley & Sons Ltd.",density; housing; machine learning; threshold; urban planning,"Tang B.-S., Ho W.K.O., Wong S.W.",10.1002/sd.2168
95,1.0,2021,Article,Urban morphological feature extraction and multi-dimensional similarity analysis based on deep learning approaches,"The study of urban morphology contributes to the evolution of cities and sustainable development. Urban morphological feature extraction and similarity analysis represents a practical framework in many studies to interpret and introduce the current built environment to aid in proposing novel designs. In conventional methods, morphological features are represented based on qualitative descriptions, symbolical interpretation, or manually selected indicators. However, these methods could cause subjective bias and limit the generalizability. This study proposes a hybrid data-driven approach to support quantitative morphological descriptions and multi-dimensional similarity analysis for urban design decision-making and to further morphology-related studies using information abundance via a deep-learning approach. We constructed a dataset of 3817 residential plots with geometrical and related infrastructure information. A deep convolutional neural network, GoogLeNet, was implemented with the plots’ figure–ground images, by quantifying the morphological features into 2048-dimensional feature vectors. We conducted a similarity analysis of the plots by calculating the Euclidean distance between the high-dimensional feature vectors. Then, a comparison study was performed by retrieving cases based on the plot shape and plots with buildings separately. The proposed method considers the overall characteristics of the urban morphology and social infrastructure situations for similarity analysis. This method is flexible and effective. The proposed framework indicates the feasibility and potential of integrating task-oriented information to introduce custom and adequate references via deep learning methods, which could support decision making and association studies on morphology with urban consequences. This work could serve as a basis for further typo-morphology studies and other morphology-related ecological, social, and economic studies for sustainable built environments. © 2021 by the authors. Licensee MDPI, Basel, Switzerland.",Cluster analysis; Deep learning; Feature extraction; Similarity analysis; Urban morphology,"Cai C., Guo Z., Zhang B., Wang X., Li B., Tang P.",10.3390/su13126859
99,1.0,2021,Article,Identifying urban poverty using high-resolution satellite imagery and machine learning approaches: Implications for housing inequality,"Enriching Asian perspectives on the rapid identification of urban poverty and its implications for housing inequality, this paper contributes empirical evidence about the utility of image features derived from high-resolution satellite imagery and machine learning approaches for identifying urban poverty in China at the community level. For the case of the Jiangxia District and Huangpi District of Wuhan, image features, including perimeter, line segment detector (LSD), Hough transform, gray-level cooccurrence matrix (GLCM), histogram of oriented gradients (HoG), and local binary patterns (LBP), are calculated, and four machine learning approaches and 25 variables are applied to identify urban poverty and relatively important variables. The results show that image features and machine learning approaches can be used to identify urban poverty with the best model performance with a coefficient of determination, R2, of 0.5341 and 0.5324 for Jiangxia and Huangpi, respectively, although some differences exist among the approaches and study areas. The importance of each variable differs for each approach and study area; however, the relatively important variables are similar. In particular, four variables achieved relatively satisfactory prediction results for all models and presented obvious differences in varying communities with different poverty levels. Housing inequality within low-income neighborhoods, which is a response to gaps in wealth, income, and housing affordability among social groups, is an important manifestation of urban poverty. Policy makers can implement these findings to rapidly identify urban poverty, and the findings have potential applications for addressing housing inequality and proving the rationality of urban planning for building a sustainable society. © 2021 by the authors. Licensee MDPI, Basel, Switzerland.",China; High-resolution satellite imagery; Image features; Machine learning approaches; Urban poverty,"Li G., Cai Z., Qian Y., Chen F.",10.3390/land10060648
107,,2021,Article,Local and application-specific geodemographics for data-led urban decision making,"This work seeks to introduce improvements to the traditional variable selection procedures employed in the development of geodemographic classifications. It presents a proposal for shifting from a traditional approach for generating general-purpose one-size-fits-all geodemographic classifications to application-specific classifications. This proposal addresses the recent scepticism towards the utility of general-purpose applications by employing supervised machine learning techniques in order to identify contextually relevant input variables from which to develop geodemographic classifications with increased discriminatory power. A framework introducing such techniques in the variable selection phase of geodemographic classification development is presented via a practical use-case that is focused on generating a geodemographic classification with an increased capacity for discriminating the propensity for Library use in the UK city of Leeds. Two local classifications are generated for the city, one a general-purpose classification, and the other, an application-specific classification incorporating supervised Feature Selection methods in the selection of input variables. The discriminatory power of each classification is evaluated and compared, with the result successfully demonstrating the capacity for the application-specific approach to generate a more contextually relevant result, and thus underpins increasingly targeted public policy decision making, particularly in the context of urban planning. © 2021 by the authors. Licensee MDPI, Basel, Switzerland.",Feature selection; Geodemographic classifications; Libraries; Recursive feature elimination; Urban planning,"Otley A., Morris M., Newing A., Birkin M.",10.3390/su13094873
122,4.0,2021,Article,Safe cities in the new urban world: A comparative cluster dynamics analysis through machine learning,"Cities in the ‘New Urban World’ display an enormous diversity in appearance, growth and performance. The awareness is growing that the urban development potential (‘magnetism’) of cities is closely related to safety and security conditions in these cities. This paper develops a new analytical framework based on a wealth of empirical data on both safety/security and socio-economic magnetism achievements of many world cities, by combining two comprehensive relevant global urban data bases. The aim of the study is to offer a comparative analysis of the combined safety/security data and socio-economic performance data of 30 global cities, through the use of an advanced sequential cluster dynamics analysis that is (partly) inspired by a novel machine learning approach (using Python software). In this way, cities can be categorized according to their quantitative characteristic features represented by the relevant clusters. It appears that city safety/security features are an important predictor of the variability in overall urban performance regarding magnetism. This study allows also for drawing relevant policy lessons. © 2020",Cluster analysis; Global cities; Machine learning; Magnetism; New Urban World; Safety; Security,"Kourtit K., Marinescu Pele M.M., Nijkamp P., Traian Pele D.",10.1016/j.scs.2020.102665
126,2.0,2021,Article,Geosilhouettes: Geographical measures of cluster fit,"Regionalization, under various guises and descriptions, is a longstanding and pervasive interest of urban studies. With an increasingly large number of studies on urban place detection in language, behavior, pricing, and demography, recent critiques of longstanding regional science perspectives on place detection have focused on the arbitrariness and non-geographical nature of measures of best fit. In this paper, we develop new explicitly geographical measures of cluster fit. These hybrid spatial–social measures, called geosilhouettes, are demonstrated to capture the “core” of geographical clusters in racial data on census blocks in Brooklyn neighborhoods. These new geosilhouettes are also useful in a variety of boundary analysis and outlier detection problems. In this paper, the thinking behind geosilhouettes is presented, their mathematical form is defined, they are demonstrated, and new directions of research are discussed. © The Author(s) 2019.",clustering; Data science; segregation; unsupervised learning; urban sociology,"Wolf L.J., Knaap E., Rey S.",10.1177/2399808319875752
136,2.0,2021,Article,Delineation of an Urban Community Life Circle Based on a Machine-Learning Estimation of Spatiotemporal Behavioral Demand,"Delineating life circles is an essential prerequisite for urban community life circle planning. Recent studies combined the environmental contexts with residents’ global positioning system (GPS) data to delineate the life circles. This method, however, is constrained by GPS data, and it can only be applied in the GPS surveyed communities. To address this limitation, this study developed a generalizable delineation method without the constraint of behavioral data. According to previous research, the community life circle consists of the walking-accessible range and internal structure. The core task to develop the generalizable method was to estimate the spatiotemporal behavioral demand for each plot of land to acquire the internal structure of the life circle, as the range can be delineated primarily based on environmental data. Therefore, behavioral demand estimation models were established through logistic regression and machine learning techniques, including decision trees and ensemble learning. The model with the lowest error rate was chosen as the final estimation model for each type of land. Finally, we used a community without GPS data as an example to demonstrate the effectiveness of the estimation models and delineation method. This article extends the existing literature by introducing spatiotemporal behavioral demand estimation models, which learn the relationships between environmental contexts, population composition and the existing delineated results based on GPS data to delineate the internal structure of the community life circle without employing behavioral data. Furthermore, the proposed method and delineation results also contributes to facilities adjustments and location selections in life circle planning, people-oriented transformation in urban planning, and activity space estimation of the population in evaluating and improving the urban policies. © 2021, Science Press, Northeast Institute of Geography and Agroecology, CAS and Springer-Verlag GmbH Germany, part of Springer Nature.",community life circle; decision tree; demand estimation model; ensemble learning; spatiotemporal behavioral demand,"Li C., Xia W., Chai Y.",10.1007/s11769-021-1174-z
140,,2021,Article,A glimpse into the future of exposure and vulnerabilities in cities? Modelling of residential location choice of urban population with random forest,"The most common approach to assessing natural hazard risk is investigating the willingness to pay in the presence or absence of such risk. In this work, we propose a new, machine-learning-based, indirect approach to the problem, i.e. through residential-choice modelling. Especially in urban environments, exposure and vulnerability are highly dynamic risk components, both being shaped by a complex and continuous reorganization and redistribution of assets within the urban space, including the (re-)location of urban dwellers. By modelling residential-choice behaviour in the city of Leipzig, Germany, we seek to examine how exposure and vulnerabilities are shaped by the residential-location-choice process. The proposed approach reveals hot spots and cold spots of residential choice for distinct socioeconomic groups exhibiting heterogeneous preferences. We discuss the relationship between observed patterns and disaster risk through the lens of exposure and vulnerability, as well as links to urban planning, and explore how the proposed methodology may contribute to predicting future trends in exposure, vulnerability, and risk through this analytical focus. Avenues for future research include the operational strengthening of these linkages for more effective disaster risk management. © 2021 American Institute of Physics Inc.. All rights reserved.",,"Scheuer S., Haase D., Haase A., Wolff M., Wellmann T.",10.5194/nhess-21-203-2021
147,,2021,Article,Research on Urban Renewal Public Space Design Based on Convolutional Neural Network Model,"By establishing a database of urban space cases, machine learning algorithms and deep learning algorithms can be used to train computers to learn how to design urban spaces. Based on the basic concepts of machine learning and deep learning and their procedural logic, this paper explores the generation mode of traffic road network, neighborhood space form, and building function layout of urban space and uses the northern extension of the central green axis of the city as an application case to confirm its feasibility in order to seek a set of artificial intelligence-based urban space generation design method and provide a new idea for the innovative development of urban design methods. © 2021 Jixin Wan and Huosai Shi.",,"Wan J., Shi H.",10.1155/2021/9504188
