Cluster,DocId,Cited by,Title,Author Keywords,Abstract,Year,Source title,Authors,DOI,Document Type,x,y
4,8,,Automatic Target Detection from Satellite Imagery Using Machine Learning,Deep learning; Faster RCNN; Satellite images; SIMRDWN; SSD; YOLO,"Object detection is a vital step in satellite imagery-based computer vision applications such as precision agriculture, urban planning and defense applications. In satellite imagery, object detection is a very complicated task due to various reasons including low pixel resolution of objects and detection of small objects in the large scale (a single satellite image taken by Digital Globe com-prises over 240 million pixels) satellite images. Object detection in satellite images has many challenges such as class variations, multiple objects pose, high variance in object size, illumination and a dense background. This study aims to compare the performance of existing deep learning algorithms for object detection in satellite imagery. We created the dataset of satellite imagery to perform object detection using convolutional neural network-based frameworks such as faster RCNN (faster region-based convolutional neural network), YOLO (you only look once), SSD (single-shot detector) and SIMRDWN (satellite imagery multiscale rapid detection with windowed networks). In addition to that, we also performed an analysis of these approaches in terms of accuracy and speed using the developed dataset of satellite imagery. The results showed that SIMRDWN has an accuracy of 97% on high-resolution images, while Faster RCNN has an accuracy of 95.31% on the standard resolution (1000 × 600). YOLOv3 has an accuracy of 94.20% on standard resolution (416 416) while on the other hand SSD has an accuracy of 84.61% on standard resolution (300 × 300). When it comes to speed and efficiency, YOLO is the obvious leader. In real-time surveillance, SIMRDWN fails. When YOLO takes 170 to 190 milliseconds to perform a task, SIMRDWN takes 5 to 103 milliseconds. © 2022 by the authors. Licensee MDPI, Basel, Switzerland.",2022,Sensors,"Tahir A., Munawar H.S., Akram J., Adil M., Ali S., Kouzani A.Z., Pervez Mahmud M.A.",10.3390/s22031147,Article,9.5853223801,6.8900203705
4,9,,Comparison of DEM Super-Resolution Methods Based on Interpolation and Neural Networks,DEM; Neural network; Super-resolution process; Terrain features,"High-resolution digital elevation models (DEMs) play a critical role in geospatial databases, which can be applied to many terrain-related studies such as facility siting, hydrological analysis, and urban design. However, due to the limitation of precision of equipment, there are big gaps to collect high-resolution DEM data. A practical idea is to recover high-resolution DEMs from easily obtained low-resolution DEMs, and this process is termed DEM super-resolution (SR). However, traditional DEM SR methods (e.g., bicubic interpolation) tend to over-smooth high-frequency regions on account of the operation of averaging local variations. With the recent development of machine learning, image SR methods have made great progress. Nevertheless, due to the complexity of terrain characters (e.g., peak and valley) and the huge difference between elevation field and image RGB (Red, Green, and Blue) value field, there are few works that apply image SR methods to the task of DEM SR. Therefore, this paper investigates the question of whether the state-of-the-art image SR methods are appropriate for DEM SR. More specifically, the traditional interpolation method and three excellent SR methods based on neural networks are chosen for comparison. Experimental results suggest that SRGAN (Super-Resolution with Generative Adversarial Network) presents the best performance on accuracy evaluation over a series of DEM SR experiments. © 2022 by the authors. Licensee MDPI, Basel, Switzerland.",2022,Sensors,"Zhang Y., Yu W.",10.3390/s22030745,Article,9.4421443939,6.8250417709
4,16,,SNLRUX++ for Building Extraction from High-Resolution Remote Sensing Images,Building extraction; convolution neural network; deep learning; high-resolution image; remote sensing,"Building extraction plays an important role in high-resolution remote sensing image processing, which can be used as the basis for urban planning and demographic analysis. In recent years, many powerful general semantic segmentation models have emerged, but these models often perform poorly when transferred to remote sensing images because of the characteristics of remote sensing images. To this end, we propose a new deep learning network called Selective Nonlocal ResUNeXt++ (SNLRUX++) for building extraction. First, the cascaded multiscale feature fusion is proposed to transform the high-performance image classification network ResNeXt into the segmentation network ResUNeXt++. Second, selective nonlocal operation is designed to establish long-range dependencies while avoiding introducing excessive noise and computational effort. Finally, multiscale prediction is applied as deep supervision to accelerate training and convergence, and improves prediction performance of objects at different scales. The experimental results on two different remote sensing image datasets show the effectiveness and generalization ability of the proposed method. © 2008-2012 IEEE.",2022,IEEE Journal of Selected Topics in Applied Earth Observations and Remote Sensing,"Lei Y., Yu J., Chan S., Wu W., Liu X.",10.1109/JSTARS.2021.3135705,Article,9.4253940582,6.8759431839000005
4,23,,DSA-Net: A novel deeply supervised attention-guided network for building change detection in high-resolution remote sensing images,Building change detection; CLA-Con-SAM; Deep learning; Deep supervision; DSA-Net,"Building change detection (BCD) plays a crucial role in urban planning and development and has received extensive attention. However, existing deep learning-based change detection methods suffer from limited accuracy, mainly due to the information loss and inadequate capability in feature extraction. To overcome these shortcomings, we propose a novel deeply supervised attention-guided network (DSA-Net) for BCD tasks in high-resolution images. In the DSA-Net, we innovatively introduce a spatial attention mechanism-guided cross-layer addition and skip-connection (CLA-Con-SAM) module to aggregate multi-level contextual information, weaken the heterogeneity between raw image features and difference features, and direct the network's attention to changed regions. We also introduce an atrous spatial pyramid pooling (ASPP) module to extract multi-scale features. To further improve detection performance, we implement a new deep supervision module to enhance the ability of middle layers to extract more distinctive features. We conduct quantitative and qualitative experiments on the two publicly available datasets, i.e., the LEVIR-CD and the WHU Building datasets. Compared with the competing methods, the proposed DSA-Net achieves the best performance in all evaluation metrics. The efficiency analysis reveals that the proposed DSA-Net achieves a great balance between BCD performance and complexity/efficiency, with faster convergence and higher robustness. © 2021 The Authors",2021,International Journal of Applied Earth Observation and Geoinformation,"Ding Q., Shao Z., Huang X., Altan O.",10.1016/j.jag.2021.102591,Article,9.4062509537,6.8711285591
4,37,2.0,GAN-Based Semisupervised Scene Classification of Remote Sensing Image,Gating unit; generative adversarial nets (GANs); remote sensing image (RSI); self-attention gating (SAG) module; semisupervised image classification,"With the advent of a large number of remote sensing images (RSIs), scene classification of RSI is widely applied to many fields such as urban planning, natural disaster detection, and environmental monitoring. Compared with the natural image field, the lack of labeled RSI is a bottleneck of supervised scene classification methods based on deep learning. Meanwhile, unsupervised scene classification is difficult to meet actual needs. To this end, we propose a novel semisupervised scene classification method for RSI using generative adversarial nets (GANs), in which a gating unit, a self-attention gating (SAG) module, and a pretrained Inception V3 branch are introduced into discriminative network to enhance the feature representation capability for facilitating semisupervised classification. To be specific, the gating unit aims to learn the weights of each feature map and capture the dependence relationship between features. The SAG module aims to capture a long-range dependence for adaptively focusing on important scene regions. The Inception V3 branch aims to extract the high-level semantic representation of input images and further enhance the discriminant ability by gating unit and SAG module. Furthermore, a new optimization term is incorporated into the generator loss to indirectly drive discriminator to correctly classify scene images. To verify the effectiveness of the proposed method, extensive experimental results on UC Merced and EuroSAT data sets demonstrate that the method surpasses most of the state-of-the-art semisupervised image classification methods significantly, especially when only few samples are tagged. © 2004-2012 IEEE.",2021,IEEE Geoscience and Remote Sensing Letters,"Guo D., Xia Y., Luo X.",10.1109/LGRS.2020.3014108,Article,9.4263458252,6.8585152626
4,46,,GeoAI in terrain analysis: Enabling multi-source deep learning and data fusion for natural feature detection,Data enrichment; Deep Learning; GeoAI; Multi-source data fusion; Object detection,"In this paper we report on a new GeoAI research method which enables deep machine learning from multi-source geospatial data for natural feature detection. In particular, a multi-source, deep learning-based object detection pipeline was developed. This pipeline introduces three new features: First, strategies of both data-level fusion (i.e., channel expansion on convolutional neural networks) and feature-level fusion were integrated into the object detection model to allow simultaneous machine learning from multi-source data, including remote sensing imagery and Digital Elevation Model (DEM) data. Second, a new data fusion strategy was developed to blend DEM data and its derivatives to create a new, fused data source with enriched information content and image features. The model has also enabled deep learning by combining both the proposed data fusion and feature-level fusion strategies to yield a much-improved detection result. Third, two different sets of data augmentation techniques were applied to the multi-source training data to further improve the model performance. A series of experiments were conducted to verify the effectiveness of the proposed strategies in multi-source deep learning. © 2021 Elsevier Ltd",2021,"Computers, Environment and Urban Systems","Wang S., Li W.",10.1016/j.compenvurbsys.2021.101715,Article,9.53403759,6.8278551102
4,66,,Multi-class strategies for joint building footprint and road detection in remote sensing,Binary semantic segmentation; Building detection; Convolutional neural networks; Deep learning; Multi-class semantic segmentation; Multi-task semantic segmentation; Remote sensing; Road detection; Sentinel-1; Sentinel-2,"Building footprints and road networks are important inputs for a great deal of services. For instance, building maps are useful for urban planning, whereas road maps are essential for disaster response services. Traditionally, building and road maps are manually generated by remote sensing experts or land surveying, occasionally assisted by semi-automatic tools. In the last decade, deep learning-based approaches have demonstrated their capabilities to extract these elements automatically and accurately from remote sensing imagery. The building footprint and road network detection problem can be considered a multi-class semantic segmentation task, that is, a single model performs a pixel-wise classification on multiple classes, optimizing the overall performance. However, depending on the spatial resolution of the imagery used, both classes may coexist within the same pixel, drastically reducing their separability. In this regard, binary decomposition techniques, which have been widely studied in the machine learning literature, are proved useful for addressing multiclass problems. Accordingly, the multi-class problem can be split into multiple binary semantic segmentation sub-problems, specializing different models for each class. Nevertheless, in these cases, an aggregation step is required to obtain the final output labels. Additionally, other novel approaches, such as multi-task learning, may come in handy to further increase the performance of the binary semantic segmentation models. Since there is no certainty as to which strategy should be carried out to accurately tackle a multi-class remote sensing semantic segmentation problem, this paper performs an in-depth study to shed light on the issue. For this purpose, open-access Sentinel-1 and Sentinel-2 imagery (at 10 m) are considered for extracting buildings and roads, making use of the well-known U-Net convolutional neural network. It is worth stressing that building and road classes may coexist within the same pixel when working at such a low spatial resolution, setting a challenging problem scheme. Accordingly, a robust experimental study is developed to assess the benefits of the decomposition strategies and their combination with a multi-task learning scheme. The obtained results demonstrate that decomposing the considered multi-class remote sensing semantic segmentation problem into multiple binary ones using a One-vs-All binary decomposition technique leads to better results than the standard direct multi-class approach. Additionally, the benefits of using a multi-task learning scheme for pushing the performance of binary segmentation models are also shown. © 2021 by the authors. Licensee MDPI, Basel, Switzerland.",2021,Applied Sciences (Switzerland),"Ayala C., Aranda C., Galar M.",10.3390/app11188340,Article,9.4151000977,6.8969120979
4,72,,A novel approach for change detection analysis of land cover from multispectral FCC optical image using machine learning,Change Detection; Land Use Land Classification; Machine Learning; Multispectral; Remote Sensing,"Land covers refers to the physical land types such as vegetation, water, urban area, roads, and many more according to the geographical region. With the rapid change in land-use patterns, the land covers are varying drastically which requires immediate attention to have an eye at the impact of the land use planning and environmental changes is on the right track, or it needs to be modified. Hence utilizing the advancements in remote sensing technology for analyzing Land Use Land Cover (L ULC) classification maps using satellite images of the geographical region plays an important role in analyzing the present scenario of land covers. This paper proposes a novel approach for change detection analysis using the classification maps generated using Machine Learning (ML) classification techniques on a particular geographical region surrounding Nirma University, Ahmedabad, India. The highest classification accuracy of 98.48% was achieved using Support Vector Machine (SVM) for Near Infrared (NIR) band False Colour Composite (FCC) image obtained from Sentinel 2. © 2021 IEEE.",2021,"2nd International Conference on Range Technology, ICORT 2021","Patel K., Jain M., Patel M.I., Gajjar R.",10.1109/ICORT52730.2021.9582057,Conference Paper,9.9794282913,6.9321265221
4,73,1.0,Automatic detection of impervious surfaces from remotely sensed data using deep learning,Deep learning; Google Earth Engine; Impervious surfaces; Machine learning; Remote sensing,"The large scale quantification of impervious surfaces provides valuable information for urban planning and socioeconomic development. Remote sensing and GIS techniques provide spatial and temporal information of land surfaces and are widely used for modeling impervious surfaces. Traditionally, these surfaces are predicted by computing statistical indices derived from different bands available in remotely sensed data, such as the Landsat and Sentinel series. More recently, researchers have explored classification and regression techniques to model impervious surfaces. However, these modeling efforts are limited due to lack of labeled data for training and evaluation. This in turn requires significant effort for manual labeling of data and visual interpretation of results. In this paper, we train deep learning neural networks using TensorFlow to predict impervious surfaces from Landsat 8 images. We used OpenStreetMap (OSM), a crowd-sourced map of the world with manually interpreted impervious surfaces such as roads and buildings, to programmatically generate large amounts of training and evaluation data, thus overcoming the need for manual labeling. We conducted extensive experimentation to compare the performance of different deep learning neural network architectures, optimization methods, and the set of features used to train the networks. The four model configurations labeled U-Net_SGD_Bands, U-Net_Adam_Bands, U-Net_Adam_Bands+SI, and VGG-19_Adam_Bands+SI resulted in a root mean squared error (RMSE) of 0.1582, 0.1358, 0.1375, and 0.1582 and an accuracy of 90.87%, 92.28%, 92.46%, and 90.11%, respectively, on the test set. The U-Net_Adam_Bands+SI Model, similar to the others mentioned above, is a deep learning neural network that combines Landsat 8 bands with statistical indices. This model performs the best among all four on statistical accuracy and produces qualitatively sharper and brighter predictions of impervious surfaces as compared to the other models. © 2021 by the authors.",2021,Remote Sensing,"Parekh J.R., Poortinga A., Bhandari B., Mayer T., Saah D., Chishtie F.",10.3390/rs13163166,Article,9.819926261900001,6.8920173645
4,74,,Cloud detection using an ensemble of pixel-based machine learning models incorporating unsupervised classification,Cloud detection; Ensemble approaches; HOT; Landsat 8; Machine learning; NDSI; NDVI; Self organizing maps (SOM); Whitness,"Remote sensing imagery, such as that provided by the United States Geological Survey (USGS) Landsat satellites, has been widely used to study environmental protection, hazard analysis, and urban planning for decades. Clouds are a constant challenge for such imagery and, if not handled correctly, can cause a variety of issues for a wide range of remote sensing analyses. Typically, cloud mask algorithms use the entire image; in this study we present an ensemble of different pixel-based approaches to cloud pixel modeling. Based on four training subsets with a selection of different input features, 12 machine learning models were created. We evaluated these models using the cropped LC8-Biome cloud validation dataset. As a comparison, Fmask was also applied to the cropped scene Biome dataset. One goal of this research is to explore a machine learning modeling approach that uses as small a training data sample as possible but still provides an accurate model. Overall, the model trained on the sample subset (1.3% of the total training samples) that includes unsupervised Self-Organizing Map classification results as an input feature has the best performance. The approach achieves 98.57% overall accuracy, 1.18% cloud omission error, and 0.93% cloud commission error on the 88 cropped test images. By comparison to Fmask 4.0, this model improves the accuracy by 10.12% and reduces the cloud omission error by 6.39%. Furthermore, using an additional eight independent validation images that were not sampled in model training, the model trained on the second largest subset with an additional five features has the highest overall accuracy at 86.35%, with 12.48% cloud omission error and 7.96% cloud commission error. This model’s overall correctness increased by 3.26%, and the cloud omission error decreased by 1.28% compared to Fmask 4.0. The machine learning cloud classification models discussed in this paper could achieve very good performance utilizing only a small portion of the total training pixels available. We showed that a pixel-based cloud classification model, and that as each scene obviously has unique spectral characteristics, and having a small portion of example pixels from each of the sub-regions in a scene can improve the model accuracy significantly. © 2021 by the authors. Licensee MDPI, Basel, Switzerland.",2021,Remote Sensing,"Yu X., Lary D.J.",10.3390/rs13163289,Article,9.9029722214,6.9216961861
4,87,,Comparing three machine learning techniques for building extraction from a digital surface model,Automated building extraction; Deep learning (DL); Digital surface model (DSM); Extreme learning machine (ELM); Fully convolutional network (FCN); Histogram of oriented gradients (HOG); Machine learning (ML); Support vector machine (SVM),"Automatic building extraction from high-resolution remotely sensed data is a major area of interest for an extensive range of fields (e.g., urban planning, environmental risk management) but challenging due to urban morphology complexity. Among the different methods proposed, the approaches based on supervised machine learning (ML) achieve the best results. This paper aims to investigate building footprint extraction using only high-resolution raster digital surface model (DSM) data by comparing the performance of three different popular supervised ML models on a benchmark dataset. The first two methods rely on a histogram of oriented gradients (HOG) feature descriptor and a classical ML (support vector machine (SVM)) or a shallow neural network (extreme learning machine (ELM)) classifier, and the third model is a fully convolutional network (FCN) based on deep learning with transfer learning. Used data were obtained from the International Society for Photogrammetry and Remote Sensing (ISPRS) and cover the urban areas of Vaihingen an der Enz, Potsdam, and Toronto. The results indicated that performances of models based on shallow ML (feature extraction and classifier training) are affected by the urban context investigated (F1 scores from 0.49 to 0.81), whereas the FCN-based model proved to be the most robust and best-performing method for building extraction from a high-resolution raster DSM (F1 scores from 0.80 to 0.86). © 2021 by the authors. Licensee MDPI, Basel, Switzerland.",2021,Applied Sciences (Switzerland),"Notarangelo N.M., Mazzariello A., Albano R., Sole A.",10.3390/app11136072,Article,9.5793132782,6.8844351768
4,89,1.0,Building Roof Superstructures Classification from Imbalanced and Low Density Airborne LiDAR Point Cloud,3D classification; imbalanced data; light detection and ranging (LiDAR); Low-density point cloud; roof superstructures,"Light Detection and Ranging (LiDAR), an active remote sensing technology, is becoming an essential tool for geoinformation extraction and urban planning. Airborne Laser Scanning (ALS) point clouds segmentation and accurate classification are challenging and crucial to produce different geo-information products like three-dimensional (3D) city designs. This paper introduces an effective data-driven approach to build roof superstructures classification for airborne LiDAR point clouds with very low density and imbalanced classes, covering an urban area. Notably, it focuses on building roof superstructures (especially dormers and chimneys) and mitigating nonplanar objects' problems. Also, the imbalanced class problem of LiDAR data, to the best of our knowledge, is not yet addressed in the literature; it is considered in this study. The major advantage of the proposed approach is using only raw data without assumptions on the distribution underlying data. The main methodological novelties of this work are summarized in the following key elements. (i) At first, an adapted connected component analysis for 3D points cloud is proposed. (ii) Twelve geometry-based features are extracted for each component. (iii) A Support Vector Machine (SVM)-driven procedure is applied to classify the 3D components. (iv) Furthermore, a new component size-based sampling (CSBS) method is proposed to treat the imbalanced data problem and has been compared with several existing resampling strategies. In this study, components are classified into five classes: shed and gable dormers, chimneys, ground, and others. The results of this investigation show the satisfying classification performance of the proposed approach. Results also showed that the proposed approach outperformed machine learning methods, including SVM, Random Forest, Decision Tree, and Adaboost. © 2001-2012 IEEE.",2021,IEEE Sensors Journal,"Aissou B.E., Aissa A.B., Dairi A., Harrou F., Wichmann A., Kada M.",10.1109/JSEN.2021.3073535,Article,9.4246015549,6.8989453316
