Cluster,DocId,Cited by,Title,Author Keywords,Abstract,Year,Source title,Authors,DOI,Document Type,x,y
4,92,,"Assessment of combining convolutional neural networks and object based image analysis to land cover classification using sentinel 2 satellite imagery (Tenes Region, Algeria)",Convolutional neural networks (CNN); Land cover; Machine learning; Object based image analysis (OBIA); Sentinel-2; Ténès,"Land cover maps can provide valuable information for various applications, such as territorial monitoring, environmental protection, urban planning and climate change prevention. In this purpose, remote sensing based on image classification approaches undergoing a high revolution can be dedicated to land cover mapping tasks. Similarly, deep learning models are considerably applied in remote sensing applications; which can automatically learn features from large amounts of data. Prevalently, the Convolutional Neural Network (CNN), have been increasingly performed in image classification. The aim of this study is to apply a new approach to analyse land cover, and extract its features. Experiments carried out on a coastal town located in north-western Algeria (Ténès region). The study area is chosen because of its importance as a part of the national strategy to combat natural hazards, specifically floods. As well as, a simple CNN model with two hidden layers was constructed, combined with an Object-Based Image Analysis (OBIA). In this regard, a Sentinel-2 image was used, to perform the classification, using spectral index combinations. Furthermore, to compare the performance of the proposed approach, an OBIA based on machines learning algorithms mainly Random Forest (RF) and Support Vector Machine (SVM), was provided. Results of accuracy assessment of classification showed good values in terms of Overall accuracy and Kappa Index, which reach to 93.1% and 0.91, respectively. As a comparison, CNN-OBIA approach outperformed OBIA based on RF algorithm. Therefore, Final land cover maps can be used as a support tool in regional and national decisions. © 2021 International Archives of the Photogrammetry, Remote Sensing and Spatial Information Sciences - ISPRS Archives. All rights reserved.",2021,"International Archives of the Photogrammetry, Remote Sensing and Spatial Information Sciences - ISPRS Archives","Zaabar N., Niculescu S., Mihoubi M.K.",10.5194/isprs-archives-XLIII-B3-2021-383-2021,Conference Paper,9.8809900284,6.9079732895
4,93,,3D urban change detection with point cloud siamese networks,3D Change Detection; Deep Learning; Kernel Point Convolution; Point Clouds; Siamese Network; Urban Monitoring,"As the majority of the earth population is living in urban environments, cities are continuously evolving and efficient monitoring tools are needed to retrieve and classify their evolution. In this context, analysing changes between two dates is a crucial point. In urban environments, most changes occur along the vertical axis (with new construction or demolition of buildings) and the use of 3D data is therefore mandatory. Among them, LiDAR constitutes a valuable source of information. However, With the difficulty of processing sparse and unordered 3D point clouds, most of existing methods start by rasterizing point clouds (for example to Digital Surface Models) before using more conventional image processing tools. This implies a significant loss of information. Among existing studies dealing directly with point clouds, and to the best of our knowledge, no deep neural network-based method has been explored yet. Thus, in order to fill this gap and to test the ability of deep methods to deal with change detection and characterization of 3D point clouds, we propose a Siamese network with Kernel Point Convolution inspired by Siamese architectures that have already shown their performances on change detection in 2D images and on KPConv network which achieves high-quality results for semantic segmentation of raw 3D point clouds. We show quantitatively and qualitatively that our method outperforms by more than 25% (in terms of average Intersection over Union for classes of change) existing machine learning methods based on hand-crafted features. © 2021 International Archives of the Photogrammetry, Remote Sensing and Spatial Information Sciences - ISPRS Archives. All rights reserved.",2021,"International Archives of the Photogrammetry, Remote Sensing and Spatial Information Sciences - ISPRS Archives","De Gélis I., Lefèvre S., Corpetti T.",10.5194/isprs-archives-XLIII-B3-2021-879-2021,Conference Paper,9.4039316177,6.8622941971
4,96,2.0,Assessment of deep learning techniques for land use land cover classification in southern new caledonia,Deep learning: XGBoost; Land cover; Land use; Neo-channels; Neural network; New Caledonia; Remote sensing,"Land use (LU) and land cover (LC) are two complementary pieces of cartographic information used for urban planning and environmental monitoring. In the context of New Caledonia, a biodiversity hotspot, the availability of up-to-date LULC maps is essential to monitor the impact of extreme events such as cyclones and human activities on the environment. With the democratization of satellite data and the development of high-performance deep learning techniques, it is possible to create these data automatically. This work aims at determining the best current deep learning configuration (pixel-wise vs. semantic labelling architectures, data augmentation, image prepos-sessing, … ), to perform LULC mapping in a complex, subtropical environment. For this purpose, a specific data set based on SPOT6 satellite data was created and made available for the scientific community as an LULC benchmark in a tropical, complex environment using five representative areas of New Caledonia labelled by a human operator: four used as training sets, and the fifth as a test set. Several architectures were trained and the resulting classification was compared with a state-of-the-art machine learning technique: XGboost. We also assessed the relevance of popular neo-channels derived from the raw observations in the context of deep learning. The deep learning approach showed comparable results to XGboost for LC detection and over-performed it on the LU detection task (61.45% vs. 51.56% of overall accuracy). Finally, adding LC classification output of the dedicated deep learning architecture to the raw channels input significantly improved the overall accuracy of the deep learning LU classification task (63.61% of overall accuracy). All the data used in this study are available on line for the remote sensing community and for assessing other LULC detection techniques. © 2021 by the authors. Licensee MDPI, Basel, Switzerland.",2021,Remote Sensing,"Rousset G., Despinoy M., Schindler K., Mangeas M.",10.3390/rs13122257,Article,9.8515024185,6.9103755951
4,106,,"Machine learning approach to extract building footprint from high-resolution images: The case study of Makkah, Saudi Arabia",extract building footprint; high-resolution images; machine learning; Makkah,"Extracting and identifying building boundaries from high-resolution images have been a hot topic in the field of remote sensing for years. Various methods including geometric, radiometric, object based and edge detection were previously deliberated and implemented in different studies in the context of building extraction. Nevertheless, the reliability of extraction process is mainly subject to user intervention. The current study proposes a new automatic morphology-based approach for extracting buildings using high-resolution satellite images of Al-Hudaybiyah region in the city of Makkah as a case study. The proposed technique integrates the support vector machine for extracting buildings that have bright and dark roofs. The appropriateness of this method has been examined by means of various indicators for example completeness, correctness and quality. Preliminary findings will illustrate the precision and accuracy of the used machine learning algorithm. Research results can provide a generic indicator to assist the planning authorities in achieving better urban planning processes taking into account all potential environmental, social and urban demands and requirements. © 2021 The Author(s) 2021. Published by Oxford University Press.",2021,International Journal of Low-Carbon Technologies,"Faisal K., Imam A., Majrashi A., Hegazy I.",10.1093/ijlct/ctaa099,Article,9.5063152313,6.8975768089
4,118,1.0,Machine Learning Methods for Road Edge Detection on Fused Airborne Hyperspectral and LIDAR Data,data fusion; Hyperspectral; LiDAR; machine learning; remote sensing; road edge detection,"In the last decades, remote sensing sensors, such as hyperspectral systems or LiDAR scanners, have been used for urban mapping. However, an analysis in the urban environment is very complex in applications, e.g., road detection, city management, and urban planning. One of the important urban features is the detection of the road edges. In this study, an approach on multisensory hyperspectral and LiDAR data fusion (HL-Fusion) is introduced for road edge detection using different machine learning algorithms, such as Support Vector Machines, Random Forests, and Convolutional Neural Networks. The first results show that the Random Forest algorithm outperformed in the experiments on the study area at Oslo's surroundings in Norway. This study opens a window for further investigation on machine learning algorithms and a better understanding of HL-Fusion capabilities. © 2021 IEEE.",2021,"Workshop on Hyperspectral Image and Signal Processing, Evolution in Remote Sensing","Senchuri R., Kuras A., Burud I.",10.1109/WHISPERS52202.2021.9484007,Conference Paper,9.4069461823,6.8894996643
4,128,1.0,"A study on vehicle detection through aerial images: Various challenges, issues and applications",Aerial Images; Machine Learning; Security; Vehicle,"Nowadays vehicle detection and counting at the border of countries, as well as states/cities, has become popular through aerial images because of security concerns. It will play a vital role to reduce the various crimes i.e. (children kidnapping, drug/alcohol smuggling, traffic misconduct, weapons smuggling, sexual misconduct and mission of country-related crime, etc.) at the border of the cities as well as countries. Vehicle detection and counting have various other applications like traffic management, parking allotment, tracking the rescue vehicle in hill areas, digital watermarking, vehicle tracking at the toll plaza and urban planning, etc. However, vehicle detection and counting task are very challenging and difficult because of the complex background, the small size of the vehicle, other similar visual appearance objects, distance, etc. Till now, traditional methodology introduced several robust algorithms which has limitations while extracting the features from aerial images. Recently, deep learning-based algorithms introduced and the outcomes of these algorithms are robust for such kind of applications in the area of computer vision. But accuracy of these algorithms is not optimized in aerial images because the deep learning algorithm required a huge amount of data to train the machine and the size of the object in aerial images is also too small. All these factors affecting the efficiency of the real-time device. This paper provides a brief description of traditional algorithms as well as machine learning and deep learning concepts to identifying the object through aerial images. The study has shown the comprehensive analysis of benchmark datasets and their parameters and corresponding challenges used by researchers and scientists in the area of object detection/tracking through aerial images. © 2021 IEEE.",2021,"Proceedings - IEEE 2021 International Conference on Computing, Communication, and Intelligent Systems, ICCCIS 2021","Kumar S., Rajan E.G., Rani S.",10.1109/ICCCIS51004.2021.9397116,Conference Paper,9.2946386337,6.8558034897
4,129,3.0,Fusion of airborne lidar point clouds and aerial images for heterogeneous land-use urban mapping,Bootstrap aggregation; K-fold cross-validation; LiDAR classification; LiDAR-aerial geo-registration; LiDAR-aerial integration; Maximum likelihood; Neural networks; Supervised machine learning; Support vector machines; Urban land-use,"The World Health Organization has reported that the number of worldwide urban residents is expected to reach 70% of the total world population by 2050. In the face of challenges brought about by the demographic transition, there is an urgent need to improve the accuracy of urban land-use mappings to more efficiently inform about urban planning processes. Decision-makers rely on accurate urban mappings to properly assess current plans and to develop new ones. This study investigates the effects of including conventional spectral signatures acquired by different sensors on the classification of airborne LiDAR (Light Detection and Ranging) point clouds using multiple feature spaces. The proposed method applied three machine learning algorithms—ML (Maximum Likelihood), SVM (Support Vector Machines), and MLP (Multilayer Perceptron Neural Network)—to classify LiDAR point clouds of a residential urban area after being geo-registered to aerial photos. The overall classification accuracy passed 97%, with height as the only geometric feature in the classifying space. Misclassifications occurred among different classes due to independent acquisition of aerial and LiDAR data as well as shadow and orthorectification problems from aerial images. Nevertheless, the outcomes are promising as they surpassed those achieved with large geometric feature spaces and are encouraging since the approach is computationally reasonable and integrates radiometric properties from affordable sensors. © 2021 by the authors. Licensee MDPI, Basel, Switzerland.",2021,Remote Sensing,"Megahed Y., Shaker A., Yan W.Y.",10.3390/rs13040814,Article,9.5106458664,6.9043588638
4,137,2.0,Use of deep learning models in street-level images to classify one-story unreinforced masonry buildings based on roof diaphragms,Convolutional neural networks; Deep learning; Diaphragm; Risk assessment; Seismic risk; Unreinforced masonry; Urban planning,"In this paper, we explore the potential of convolutional neural networks to classify street-level imagery of one-story unreinforced masonry buildings (MURs) according to the flexibility of the roof diaphragm (rigid or flexible). This information is critical for vulnerability studies, disaster risk assessments, disaster management strategies, etc., and is of great relevance in cities where unreinforced masonry is the most common building typology or where the majority of the population resides in such buildings. Our contribution could be useful for local governments of cities in developing countries seeking to significantly reduce the number of deaths caused by disasters. Our research results indicate that VGG19 is the convolutional neural network architecture with the best performance, with an accuracy of 0.80, a precision of 0.88, and a recall of 0.84. The results are encouraging and could be used to reduce the amount of resources (both human and economic) for the development of detailed exposure models for unreinforced masonry buildings. © 2020 Elsevier Ltd",2021,Building and Environment,"Rueda-Plata D., González D., Acevedo A.B., Duque J.C., Ramos-Pollán R.",10.1016/j.buildenv.2020.107517,Article,9.4925069809,6.8512134552
4,141,10.0,Deep learning-based multi-feature semantic segmentation in building extraction from images of UAV photogrammetry,,"Building information is an essential part of geographic information system (GIS) applications in urban planning and management. However, it changes rapidly with economic growth. Unmanned aerial vehicles (UAV)-based photogrammetry works well in this situation with its advantages of quick and high-resolution data updating. In this paper, in order to improve building extraction accuracy in complex areas where buildings are characterized by various patterns, complex structures, and unique styles, we present a framework which applies deep learning (DL) semantic segmentation to UAV images with digital surface model (DSM) and visible-band difference vegetation index (VDVI). The results show that extraction accuracy improves. The combination of red, green, blue (RGB) and VDVI bands (RGBVI) can effectively distinguish the building area and vegetation. The application of RGB with DSM bands (RGBD) helps separate buildings from ground objects. The combination of RGB, DSM, and VDVI bands (RGBDVI) can identify small buildings which are usually not high and covered partly by tree branches. The proposed method is further applied to an open standard dataset to evaluate its robustness and results indicate an increased overall accuracy from RGB only (93%) to RGBD (97%). © 2020 Informa UK Limited, trading as Taylor & Francis Group.",2021,International Journal of Remote Sensing,"Boonpook W., Tan Y., Xu B.",10.1080/01431161.2020.1788742,Article,9.4015388489,6.8872241974
4,144,,Transfer Learning Models for Land Cover and Land Use Classification in Remote Sensing Image,,"Land Cover or Land Use (LCLU) classification is an important, challenging problem in remote sensing (RS) images. RS image classification is a recent technology used to extract hidden information from remotely sensed images in the observed earth environment. This classification is essential for sustainable development in agricultural decisions and urban planning using deep learning (DL) methods. DL gets more attention for accuracy and performance improvements in large datasets. This paper is aimed to apply one of the DL methods called transfer learning (TL). TL is the recent research problem in machine learning and DL approaches for image classification. DL consumes much time for training when starting from scratch. This problem could be overcome in the TL modeling technique, which uses pre-trained models to build deep TL models efficiently. We applied the TL model using bottleneck feature extraction from the pre-trained models: InceptionV3, Resnet50V2, and VGG19 to LCLU classification in the UC Merced dataset. With these experiments, the TL model has been built the outdate performance of 92.46, 94.38, and 99.64 in Resnet50V2, InceptionV3, and VGG19, respectively. © 2021 The Author(s). Published with license by Taylor & Francis Group, LLC.",2021,Applied Artificial Intelligence,"Alem A., Kumar S.",10.1080/08839514.2021.2014192,Article,9.7649936676,6.9060354233000005
4,153,,Assessment of approaches for the extraction of building footprints from pléiades images,Backpropagation; Ensemble classifiers; Image classification; Machine learning; Maximum likelihood; Random forest; Support vector machines,"The Marina area represents an official new gateway of entry to Egypt and the development of infrastructure is proceeding rapidly in this region. The objective of this research is to obtain building data by means of automated extraction from Pléiades satellite images. This is due to the need for efficient mapping and updating of geodatabases for urban planning and touristic development. It compares the performance of random forest algorithm to other classifiers like maximum likelihood, support vector machines, and backpropagation neural networks over the well-organized buildings which appeared in the satellite images. Images were subsequently classified into two classes: buildings and non-buildings. In addition, basic morphological operations such as opening and closing were used to enhance the smoothness and connectedness of the classified imagery. The overall accuracy for random forest, maximum likelihood, support vector machines, and backpropagation were 97%, 95%, 93% and 92% respectively. It was found that random forest was the best option, followed by maximum likelihood, while the least effective was the backpropagation neural network. The completeness and correctness of the detected buildings were evaluated. Experiments confirmed that the four classification methods can effectively and accurately detect 100% of buildings from very high-resolution images. It is encouraged to use machine learning algorithms for object detection and extraction from very high-resolution images. © 2021 Author.",2021,Geomatics and Environmental Engineering,"Taha L.G.E.-D., Ibrahim R.E.",10.7494/geom.2021.15.4.101,Article,9.601146698,6.9170780182
4,161,3.0,Scale-Robust Deep-Supervision Network for Mapping Building Footprints from High-Resolution Remote Sensing Images,Building footprint extraction; convolutional neural network; deep learning; remote sensing image,"Building footprint information is one of the key factors for sustainable urban planning and environmental monitoring. Mapping building footprints from remote sensing images is an important and challenging task in the earth observation field. Over the years, convolutional neural networks have shown outstanding improvements in the building extraction field due to their ability to automatically extract hierarchical features and make building predictions. However, as buildings are various in different sizes, scenes, and roofing materials, it is hard to precisely depict buildings of varied sizes, especially in large areas (e.g., nationwide). To tackle these limitations, we propose a novel deep-supervision convolutional neural network (denoted as DS-Net) for extracting building footprints from high-resolution remote sensing images. In the proposed network, we applied deep supervision with an extra lightweight encoder, which enables the network to learn representative building features of different scales. Furthermore, a scale attention module is designed to aggregate multiscale features and generate the final building prediction. Experiments on two publicly available building datasets, including the WHU Building Dataset and the Massachusetts Building Dataset, show the effectiveness of the proposed method. With only a 0.22-M increment of parameters compared with U-Net, the proposed DS-Net achieved an IoU of 90.4% on the WHU Building Dataset and 73.8% on the Massachusetts Dataset. DS-Net also outperforms the state-of-the-art building extraction methods on the two datasets, indicating the effectiveness of the proposed deep supervision and scale attention. © 2008-2012 IEEE.",2021,IEEE Journal of Selected Topics in Applied Earth Observations and Remote Sensing,"Guo H., Su X., Tang S., Du B., Zhang L.",10.1109/JSTARS.2021.3109237,Article,9.4401359558,6.8785638809
4,162,2.0,Urban tree species classification using UAV-based multi-sensor data fusion and machine learning,Random Forest; Remote Sensing; Support Vector Machine; Tree Species Detection,"Urban tree species classification is a challenging task due to spectral and spatial diversity within an urban environment. Unmanned aerial vehicle (UAV) platforms and small-sensor technology are rapidly evolving, presenting the opportunity for a comprehensive multi-sensor remote sensing approach for urban tree classification. The objectives of this paper were to develop a multi-sensor data fusion technique for urban tree species classification with limited training samples. To that end, UAV-based multispectral, hyperspectral, LiDAR, and thermal infrared imagery was collected over an urban study area to test the classification of 96 individual trees from seven species using a data fusion approach. Two supervised machine learning classifiers, Random Forest (RF) and Support Vector Machine (SVM), were investigated for their capacity to incorporate highly dimensional and diverse datasets from multiple sensors. When using hyperspectral-derived spectral features with RF, the fusion of all features extracted from all sensor types (spectral, LiDAR, thermal) achieved the highest overall classification accuracy (OA) of 83.3% and kappa of 0.80. Despite multispectral reflectance bands alone producing significantly lower OA of 55.2% compared to 70.2% with minimum noise fraction (MNF) transformed hyperspectral reflectance bands, the full dataset combination (spectral, LiDAR, thermal) with multispectral-derived spectral features achieved an OA of 81.3% and kappa of 0.77 using RF. Comparison of the features extracted from individual sensors for each species highlight the ability for each sensor to identify distinguishable characteristics between species to aid classification. The results demonstrate the potential for a high-resolution multi-sensor data fusion approach for classifying individual trees by species in a complex urban environment under limited sampling requirements. © 2021 Informa UK Limited, trading as Taylor & Francis Group.",2021,GIScience and Remote Sensing,"Hartling S., Sagan V., Maimaitijiang M.",10.1080/15481603.2021.1974275,Article,9.6959848404,6.8890390396
