Cluster,DocId,Cited by,Title,Author Keywords,Abstract,Year,Source title,Authors,DOI,Document Type,x,y
4,437,12.0,Ultra-Light aircraft-based hyperspectral and colour-infrared imaging to identify deciduous tree species in an urban environment,Classification; Colour infrared; Hyperspectral; Ultra-light aircraft; Urban trees,"One may consider the application of remote sensing as a trade-off between the imaging platforms, sensors, and data gathering and processing techniques. This study addresses the potential of hyperspectral imaging using ultra-light aircraft for vegetation species mapping in an urban environment, exploring both the engineering and scientific aspects related to imaging platform design and image classification methods. An imaging system based on simultaneous use of Rikola frame format hyperspectral and Nikon D800E adopted colour infrared cameras installed onboard a Bekas X32 manned ultra-light aircraft is introduced. Two test imaging flight missions were conducted in July of 2015 and September of 2016 over a 4000 ha area in Kaunas City, Lithuania. Sixteen and 64 spectral bands in 2015 and 2016, respectively, in a spectral range of 500-900 nm were recorded with colour infrared images. Three research questions were explored assessing the identification of six deciduous tree species: (1) Pre-treatment of spectral features for classification, (2) testing five conventional machine learning classifiers, and (3) fusion of hyperspectral and colour infrared images. Classification performance was assessed by applying leave-one-out cross-validation at the individual crown level and using as a reference at least 100 field inventoried trees for each species. The best-performing classification algorithm-multilayer perceptron, using all spectral properties extracted from the hyperspectral images-resulted in a moderate classification accuracy. The overall classification accuracy was 63%, Cohen's Kappa was 0.54, and the species-specific classification accuracies were in the range of 51-72%. Hyperspectral images resulted in significantly better tree species classification ability than the colour infrared images and simultaneous use of spectral properties extracted from hyperspectral and colour infrared images improved slightly the accuracy over the 2015 image. Even though classifications using hyperspectral data cubes of 64 bands resulted in relatively larger accuracies than with 16 bands, classification error matrices were not statistically different. Alternative imaging platforms (like an unmanned aerial vehicle and a Cessna 172 aircraft) and settings of the flights were discussed using simulated imaging projects assuming the same study area and field of application. Ultra-light aircraft-based hyperspectral and colour-infrared imaging was considered to be a technically and economically sound solution for urban green space inventories to facilitate tree mapping, characterization, and monitoring. © 2018 by the authors.",2018,Remote Sensing,"Mozgeris G., Juodkiene V., Jonikavičius D., Straigyte L., Gadal S., Ouerghemmi W.",10.3390/rs10101668,Article,9.7139120102,6.8773212433
4,443,18.0,Road centerline extraction from very-high-resolution aerial image and LiDAR data based on road connectivity,LiDAR data; Object recognition; Road centerline; Road connectivity; Very-high-resolution image,"The road networks provide key information for a broad range of applications such as urban planning, urban management, and navigation. The fast-developing technology of remote sensing that acquires high-resolution observational data of the land surface offers opportunities for automatic extraction of road networks. However, the road networks extracted from remote sensing images are likely affected by shadows and trees, making the road map irregular and inaccurate. This research aims to improve the extraction of road centerlines using both very-high-resolution (VHR) aerial images and light detection and ranging (LiDAR) by accounting for road connectivity. The proposed method first applies the fractal net evolution approach (FNEA) to segment remote sensing images into image objects and then classifies image objects using the machine learning classifier, random forest. A post-processing approach based on the minimum area bounding rectangle (MABR) is proposed and a structure feature index is adopted to obtain the complete road networks. Finally, a multistep approach, that is, morphology thinning, Harris corner detection, and least square fitting (MHL) approach, is designed to accurately extract the road centerlines from the complex road networks. The proposed method is applied to three datasets, including the New York dataset obtained from the object identification dataset, the Vaihingen dataset obtained from the International Society for Photogrammetry and Remote Sensing (ISPRS) 2D semantic labelling benchmark and Guangzhou dataset. Compared with two state-of-the-art methods, the proposed method can obtain the highest completeness, correctness, and quality for the three datasets. The experiment results show that the proposed method is an efficient solution for extracting road centerlines in complex scenes from VHR aerial images and light detection and ranging (LiDAR) data. © 2018 by the authors.",2018,Remote Sensing,"Zhang Z., Zhang X., Sun Y., Zhang P.",10.3390/rs10081284,Article,9.3894233704,6.8451924324
4,444,7.0,Context-Based Filtering of Noisy Labels for Automatic Basemap Updating from UAV Data,Basemap updating; image classification; informal settlements; label noise; random forests; unmanned aerial vehicles (UAVs); urban planning,"Unmanned aerial vehicles (UAVs) have the potential to obtain high-resolution aerial imagery at frequent intervals, making them a valuable tool for urban planners who require up-to-date basemaps. Supervised classification methods can be exploited to translate the UAV data into such basemaps. However, these methods require labeled training samples, the collection of which may be complex and time consuming. Existing spatial datasets can be exploited to provide the training labels, but these often contain errors due to differences in the date or resolution of the dataset from which these outdated labels were obtained. In this paper, we propose an approach for updating basemaps using global and local contextual cues to automatically remove unreliable samples from the training set, and thereby, improve the classification accuracy. Using UAV datasets over Kigali, Rwanda, and Dar es Salaam, Tanzania, we demonstrate how the amount of mislabeled training samples can be reduced by 44.1% and 35.5%, respectively, leading to a classification accuracy of 92.1% in Kigali and 91.3% in Dar es Salaam. To achieve the same accuracy in Dar es Salaam, between 50000 and 60000 manually labeled image segments would be needed. This demonstrates that the proposed approach of using outdated spatial data to provide labels and iteratively removing unreliable samples is a viable method for obtaining high classification accuracies while reducing the costly step of acquiring labeled training samples. © 2008-2012 IEEE.",2018,IEEE Journal of Selected Topics in Applied Earth Observations and Remote Sensing,"Gevaert C.M., Persello C., Elberink S.O., Vosselman G., Sliuzas R.",10.1109/JSTARS.2017.2762905,Article,9.6894254684,6.9090723991
4,460,12.0,Object-based detection of vehicles using combined optical and elevation data,Cluster analysis; Data fusion; Elevation data; Feature extraction; High-resolution; Object-based classification; Random forest; Vehicle detection,"The detection of vehicles is an important and challenging topic that is relevant for many applications. In this work, we present a workflow that utilizes optical and elevation data to detect vehicles in remotely sensed urban data. This workflow consists of three consecutive stages: candidate identification, classification, and single vehicle extraction. Unlike in most previous approaches, fusion of both data sources is strongly pursued at all stages. While the first stage utilizes the fact that most man-made objects are rectangular in shape, the second and third stages employ machine learning techniques combined with specific features. The stages are designed to handle multiple sensor input, which results in a significant improvement. A detailed evaluation shows the benefits of our workflow, which includes hand-tailored features; even in comparison with classification approaches based on Convolutional Neural Networks, which are state of the art in computer vision, we could obtain a comparable or superior performance (F1 score of 0.96–0.94). © 2017 International Society for Photogrammetry and Remote Sensing, Inc. (ISPRS)",2018,ISPRS Journal of Photogrammetry and Remote Sensing,"Schilling H., Bulatov D., Middelmann W.",10.1016/j.isprsjprs.2017.11.023,Article,9.3467168808,6.8480095863
4,462,458.0,Spectral-Spatial Residual Network for Hyperspectral Image Classification: A 3-D Deep Learning Framework,3-D deep learning; hyperspectral image classification; spectral-spatial feature extraction; spectral-spatial residual network (SSRN),"In this paper, we designed an end-to-end spectral-spatial residual network (SSRN) that takes raw 3-D cubes as input data without feature engineering for hyperspectral image classification. In this network, the spectral and spatial residual blocks consecutively learn discriminative features from abundant spectral signatures and spatial contexts in hyperspectral imagery (HSI). The proposed SSRN is a supervised deep learning framework that alleviates the declining-accuracy phenomenon of other deep learning models. Specifically, the residual blocks connect every other 3-D convolutional layer through identity mapping, which facilitates the backpropagation of gradients. Furthermore, we impose batch normalization on every convolutional layer to regularize the learning process and improve the classification performance of trained models. Quantitative and qualitative results demonstrate that the SSRN achieved the state-of-the-art HSI classification accuracy in agricultural, rural-urban, and urban data sets: Indian Pines, Kennedy Space Center, and University of Pavia. © 1980-2012 IEEE.",2018,IEEE Transactions on Geoscience and Remote Sensing,"Zhong Z., Li J., Luo Z., Chapman M.",10.1109/TGRS.2017.2755542,Article,9.5603132248,6.8504638672
4,463,1.0,Building detection from orthophotos using binary feature classification,Building detection; Classifier; Descriptor; Local feature; Machine learning,"Building detection in orthophotos is crucial for various applications, such as urban planning and real-estate management. In order to realize accurate and fast building detection, a non-interactive approach based on binary feature classification is brought forward in this paper. The proposed approach includes two major stages, i.e., building area detection and building contours extraction. In the first stage, a sequence of intersections is obtained by superpixel segmentation in the subsampled orthophoto, and then building area is reserved roughly according to the classification of intersections. In the second stage, the sequence of intersections is updated by superpixel segmentation in the building area from original orthophoto, and then building contours is extracted in accordance with the classification of intersections likewise. The local feature of the intersections is descripted employing our extremely compact binary descriptor, and is classified using binary bag-of-features. Experiments show that benefiting from binary description and making full use of texture details and color channels, the proposed descriptor is not only computationally frugal, but also accurate. Experiments are also conducted on orthophotos with different roof colors, textures, shapes, sizes and orientations, and demonstrate that the proposed approach are capable of achieving desirable results. © 2017, Springer Science+Business Media, LLC.",2018,Multimedia Tools and Applications,"Hu Y., Hu X., Li P., Ding Y.",10.1007/s11042-017-5093-z,Article,9.396900177,6.8638391495
4,469,2.0,Understanding Historical Cityscapes from Aerial Imagery Through Machine Learning,Building detection; Machine learning; Point cloud; Shadow compensation; Shadow detection,"Understanding cityscapes using remote sensing data has been an active research field for more than two decades. Meanwhile, machine learning provides generalization capabilities compared to hierarchical and rule-based methods. This paper evaluates several machine learning algorithms in order to fuse shadow detection and shadow compensation methods for building detection using high resolution aerial imagery. Three complex and real-life urban study areas were used as test datasets with various: (i) kinds of buildings structures of special architecture, (ii) pixel resolutions and, (iii) types of data. Objective evaluation metrics have been used for assessing the compared algorithms such recall, precision and F1-score as well as rates of completeness, correctness and quality. For both approaches, i.e., shadow detection and building detection, the computational complexity of each machine learning algorithm was examined. The results indicate that deep learning schemes, such a Convolutional Neural Network (CNN), provides the best classification performance in terms of shadow detection and building detection. © 2018, Springer Nature Switzerland AG.",2018,Lecture Notes in Computer Science (including subseries Lecture Notes in Artificial Intelligence and Lecture Notes in Bioinformatics),"Maltezos E., Protopapadakis E., Doulamis N., Doulamis A., Ioannidis C.",10.1007/978-3-030-01762-0_17,Conference Paper,9.5178565979,6.8609166145
4,473,,Automatic semantic segmentation for change detection in remote sensing images,Change detection; Deep learning; Multispectral; Remote sensing,"Change detection (CD) mainly focuses on the extraction of change information from multispectral remote sensing images of the same geographical location for environmental monitoring, natural disaster evaluation, urban studies, and deforestation monitoring. While capturing the Landsat imagery, there may occur data missing issues such as occlusion of cloud, camera sensor, and aperture artifacts. The existing machine learning approaches do not provide significant results. This paper proposes a DeepLab Dilated convolutional neural network (DL-DCNN) for semantic segmentation with the goal to occur the change map for earth observation applications. Experimental results reveal that the accuracy of the proposed change detection results provides improved results as compared with the existing algorithms and maps the semantic objects within the predefined class as change or no change. © Springer Nature Singapore Pte Ltd. 2018.",2018,Advances in Intelligent Systems and Computing,"Kulkarni T., Venugopal N.",10.1007/978-981-10-8569-7_34,Conference Paper,9.6479387283,6.8642406464
4,476,61.0,Exploring the optimal integration levels between SAR and optical data for better urban land cover mapping in the Pearl River Delta,Fusion level; Fusion strategies; Optical and SAR fusion; Urban land cover,"Integrating synthetic aperture radar (SAR) and optical data to improve urban land cover classification has been identified as a promising approach. However, which integration level is the most suitable remains unclear but important to many researchers and engineers. This study aimed to compare different integration levels for providing a scientific reference for a wide range of studies using optical and SAR data. SAR data from TerraSAR-X and ENVISAT ASAR in both WSM and IMP modes were used to be combined with optical data at pixel level, feature level and decision levels using four typical machine learning methods. The experimental results indicated that: 1) feature level that used both the original images and extracted features achieved a significant improvement of up to 10% compared to that using optical data alone; 2) different levels of fusion required different suitable methods depending on the data distribution and data resolution. For instance, support vector machine was the most stable at both the feature and decision levels, while random forest was suitable at the pixel level but not suitable at the decision level. 3) By examining the distribution of SAR features, some features (e.g., homogeneity) exhibited a close-to-normal distribution, explaining the improvement from the maximum likelihood method at the feature and decision levels. This indicated the benefits of using texture features from SAR data when being combined with optical data for land cover classification. Additionally, the research also shown that combining optical and SAR data does not guarantee improvement compared with using single data source for urban land cover classification, depending on the selection of appropriate fusion levels and fusion methods. © 2017 Elsevier B.V.",2018,International Journal of Applied Earth Observation and Geoinformation,"Zhang H., Xu R.",10.1016/j.jag.2017.08.013,Article,9.782479286200001,6.8480024338
4,478,5.0,3D shape descriptor for objects recognition,3D Feature Extraction; Object Classification; Pattern Recognition,"3D point cloud classification is an important task in applications for many areas such as robotics, urban planning and augmented reality. 3D sensors measure a high amount of points in the 3D scene objects' surface at a high collect rate, so robust techniques are needed to process all input data and also deal with some imprecision. A common solution for these tasks is the use of robust features extraction techniques to gather representative scene information at the lowest computational cost possible. This paper presents a new approach for object recognition in 3D scenes, using a novel 3D shape descriptor which is used as input for a supervised machine learning method. Proposed robust 3D feature is invariant to translation and scale and provides a very simplified object representation for pattern recognition input. Experiments were performed using an Artificial Neural Network to recognize six different object shapes, and obtained results showed that the proposed method is a promising approach for object recognition in 3D scenes. © 2017 IEEE.",2017,"Proceedings - 2017 LARS 14th Latin American Robotics Symposium and 2017 5th SBR Brazilian Symposium on Robotics, LARS-SBR 2017 - Part of the Robotics Conference 2017","Sales D.O., Amaro J., Osório F.S.",10.1109/SBR-LARS-R.2017.8215285,Conference Paper,9.3507709503,6.8474411964
4,479,7.0,Deep highway unit network for land cover type classification with GF-3 SAR imagery,Deep highway unit networks; Deep learning; GaoFen-3; Land cover type classification,"The fully polarized synthetic aperture radar (SAR) is an advanced earth observation system with day and night imaging capability, which can obtain rich information of terrain and has a wide range of applications in environmental protection, urban planning and resource investigation. As the first selfdeveloped C-band multi-polarized SAR image, the acquisition of massive data and operational operation of Chinese SAR remote sensing has entered the era of big data. Under the era of remote sensing large data, however, SAR image interpretation is a great challenge for scientific applications. At present, big data-based intelligent methods such as computer vision technology have achieved great success. Deep learning such as deep highway unit networks has revolutionized the computer vision area. However, due to the characteristics of SAR microwave band imaging and phase coherence processing, SAR images are very different from ordinary optical images in terms of band, projection direction, data composition and so on. Therefore, deep learning can not be directly used for quad-pol SAR image classification. In this paper, deep learning is applied to land cover type classification with GF-3 quad-pol SAR imagery. A deep highway unit network is employed to automatically extract a hierarchic feature representation from the data, based on which the land cover type classification can be conducted. Our classification model is trained on limited training data from forest resource inventory and planning data, and tested on a Radarsat-2 quad-pol images, which is the image of the same area acquired at different times. We also employ the machine learning such as SVM, Random Forest on the same samples for comparison. The deep highway unit network trained by the GF-3 images, which can reduce speckle, fully excavate the regularity of SAR images in time and space. © 2017 IEEE.",2017,"Proceedings of 2017 SAR in Big Data Era: Models, Methods and Applications, BIGSARDATA 2017","Guo Y., Chen E., Guo Y., Li Z., Li C., Xu K.",10.1109/BIGSARDATA.2017.8124926,Conference Paper,9.65974617,6.853372097
4,507,,A support vector machine approach on object based image analysis for feature extraction from high resolution images,Feature Extraction; Grey-Level Co-occurrence textures; Object Based Image Analysis (OBIA); Support Vector Machine (SVM),"Satellite images are the most important available data sources for generation and updating of available maps. They have highly improved in terms of spatial, spectral and temporal resolutions and by the sheer volume of collected images, the necessity of simplification of automation in feature extraction. Road data play a key role in urban planning, traffic management, military applications, and vehicle navigation as well as for decision making in numerous applications. The faster updation of road infrastructure is a need because the technology has brought map in the hands of people in the form of mobile phones and tablets. Road detection is one of the major issues of the road infrastructure extraction. Its accuracy depends on the type of methodology used. An attempt is made here to analyse the first order, the co-occurrence texture features and image transforms useful for discriminating roads from other features specially the buildings. The identified dataset forms high dimension feature space and the Support Vector Machine is a theoretically superior machine learning methodology with great results in classification of high dimensional datasets. In the past, SVMs have been tested and evaluated only as pixel-based image classifiers. Moving from pixel-based techniques towards object-based representation, the dimensions of remote sensing imagery feature space increases significantly. An SVM approach for classification was followed, based on primitive image objects produces by a multi-resolution segmentation algorithm. The SVM procedure produced the final object classification results which were compared to the Nearest Neighbor classifier results and were found to give better results in OBIA domain. © 2017 ACRS. All rights reserved.",2017,"38th Asian Conference on Remote Sensing - Space Applications: Touching Human Lives, ACRS 2017","Kumar M., Srivastav S.K., Garg P.K.",,Conference Paper,9.3601331711,6.855509758
4,525,34.0,Building detection from orthophotos using a machine learning approach: An empirical study on image segmentation and descriptors,Automatic building detection and delineation; Classifier; Image descriptors; Image segmentation; Orthophotos; Supervised learning,"Building detection from aerial images has many applications in fields like urban planning, real-estate management, and disaster relief. In the last two decades, a large variety of methods on automatic building detection have been proposed in the remote sensing literature. Many of these approaches make use of local features to classify each pixel or segment to an object label, therefore involving an extra step to fuse pixelwise decisions. This paper presents a generic framework that exploits recent advances in image segmentation and region descriptors extraction for the automatic and accurate detection of buildings on aerial orthophotos. The proposed solution is supervised in the sense that appearances of buildings are learnt from examples. For the first time in the context of building detection, we use the matrix covariance descriptor, which proves to be very informative and compact. Moreover, we introduce a principled evaluation that allows selecting the best pair segmentation algorithm-region descriptor for the task of building detection. Finally, we provide a performance evaluation at pixel level using different classifiers. This evaluation is conducted over 200 buildings using different segmentation algorithms and descriptors. The performance analysis quantifies the quality of both the image segmentation and the descriptor used. The proposed approach presents several advantages in terms of scalability, suitability and simplicity with respect to the existing methods. Furthermore, the proposed scheme (detection chain and evaluation) can be deployed for detecting multiple object categories that are present in images and can be used by intelligent systems requiring scene perception and parsing such as intelligent unmanned aerial vehicle navigation and automatic 3D city modeling. © 2016 Elsevier Ltd. All rights reserved.",2016,Expert Systems with Applications,"Dornaika F., Moujahid A., El Merabet Y., Ruichek Y.",10.1016/j.eswa.2016.03.024,Article,9.4164514542,6.8852286339
