Cluster,DocId,Cited by,Title,Author Keywords,Abstract,Year,Source title,Authors,DOI,Document Type,x,y
4,165,,Using 3-D Convolution and Multimodal Architecture for Earthquake Damage Detection Based on Satellite Imagery and Digital Urban Data,3-D convolution; earthquake damage detection; multimodal learning; satellite imagery; spatiotemporal data,"When a large earthquake occurs, it is quite important to quickly figure out the damage distribution of housing structures for disaster prevention measures. Currently, the information is confirmed manually by local public organizations, which takes a lot of time. Therefore, a method is required for gathering the information more swiftly and objectively. In this work, a novel method for detecting damage to single buildings from a set of multitemporal satellite images is developed by applying a recent machine learning approach. The damage detection system is designed as a deep learning model that uses multimodal data, consisting of optical satellite images and structural attributes. The proposed method achieved over 90% detection accuracy on damaged housing in the affected area of 2016 Kumamoto earthquake, Japan from satellite images taken by Pleiades as well as digital urban data. © 2008-2012 IEEE.",2021,IEEE Journal of Selected Topics in Applied Earth Observations and Remote Sensing,"Miyamoto T., Yamamoto Y.",10.1109/JSTARS.2021.3102701,Article,9.5726804733,6.8733839989
4,169,3.0,Satellite derived bathymetry using deep learning,Deep learning; Earth observation; Machine learning; Regression; Satellite-derived bathymetry,"Coastal development and urban planning are facing different issues including natural disasters and extreme storm events. The ability to track and forecast the evolution of the physical characteristics of coastal areas over time is an important factor in coastal development, risk mitigation and overall coastal zone management. Traditional bathymetry measurements are obtained using echo-sounding techniques which are considered expensive and not always possible due to various complexities. Remote sensing tools such as satellite imagery can be used to estimate bathymetry using incident wave signatures and inversion models such as physical models of waves. In this work, we present two novel approaches to bathymetry estimation using deep learning and we compare the two proposed methods in terms of accuracy, computational costs, and applicability to real data. We show that deep learning is capable of accurately estimating ocean depth in a variety of simulated cases which offers a new approach for bathymetry estimation and a novel application for deep learning. © 2021, The Author(s), under exclusive licence to Springer Science+Business Media LLC, part of Springer Nature.",2021,Machine Learning,"Al Najar M., Thoumyre G., Bergsma E.W.J., Almar R., Benshila R., Wilson D.G.",10.1007/s10994-021-05977-w,Article,9.6683778763,6.8569645882
4,183,4.0,UVid-Net: Enhanced Semantic Segmentation of UAV Aerial Videos by Embedding Temporal Information,Deep learning; semantic segmentation; transfer learning; U-Net; unmanned aerial vehicle (UAV) video,"Semantic segmentation of aerial videos has been extensively used for decision making in monitoring environmental changes, urban planning, and disaster management. The reliability of these decision support systems is dependent on the accuracy of the video semantic segmentation algorithms. The existing CNN-based video semantic segmentation methods have enhanced the image semantic segmentation methods by incorporating an additional module such as LSTM or optical flow for computing temporal dynamics of the video which is a computational overhead. The proposed research work modifies the CNN architecture by incorporating temporal information to improve the efficiency of video semantic segmentation. In this work, an enhanced encoder-decoder based CNN architecture (UVid-Net) is proposed for unmanned aerial vehicle (UAV) video semantic segmentation. The encoder of the proposed architecture embeds temporal information for temporally consistent labeling. The decoder is enhanced by introducing the feature-refiner module, which aids in accurate localization of the class labels. The proposed UVid-Net architecture for UAV video semantic segmentation is quantitatively evaluated on extended ManipalUAVid dataset. The performance metric mean Intersection over Union of 0.79 has been observed which is significantly greater than the other state-of-the-art algorithms. Further, the proposed work produced promising results even for the pretrained model of UVid-Net on urban street scene by fine tuning the final layer on UAV aerial videos. © 2008-2012 IEEE.",2021,IEEE Journal of Selected Topics in Applied Earth Observations and Remote Sensing,"Girisha S., Verma U., Manohara Pai M.M., Pai R.M.",10.1109/JSTARS.2021.3069909,Article,9.360909462,6.8668956757
4,188,11.0,Attention-Gate-Based Encoder-Decoder Network for Automatical Building Extraction,Attention gate (AG); building extraction; deep learning; fully convolutional networks (FCNs); semantic segmentation,"Rapidly developing remote sensing technology provides massive data for urban planning, mapping, and disaster management. As a carrier of human productive activities, buildings are essential to both urban dynamic monitoring and suburban construction inspection. Fully-convolutional-network-based methods have provided a paradigm for automatically extracting buildings from high-resolution imagery. However, high intraclass variance and complexity are two problems in building extraction. It is hard to identify different scales of buildings by using a single receptive field. For this purpose, in this article, we use the stable encoder- decoder architecture, combined with a grid-based attention gate and atrous spatial pyramid pooling module, to capture and restore features progressively and effectively. A modified ResNet50 encoder is also applied to extract features. The proposed method could learn gated features and distinguish buildings from complex surroundings such as trees. We evaluate our model on two building datasets, WHU aerial building dataset and our DB UAV rural building dataset. Experiments show that our model outperforms other five most recent models. The results also exhibit great potential for extracting buildings with different scales and validate the effectiveness of deep learning in practical scenarios. © 2008-2012 IEEE.",2021,IEEE Journal of Selected Topics in Applied Earth Observations and Remote Sensing,"Deng W., Shi Q., Li J.",10.1109/JSTARS.2021.3058097,Article,9.3810186386,6.882748127
4,226,4.0,Precise object detection using adversarially augmented local/global feature fusion,Data augmentation; Geospatial object detection; High spatial resolution (HSR) remote sensing imagery; Local/global feature fusion; Super resolution generative adversarial network,"Object detection, which aims at recognizing or locating the objects of interest in remote sensing imagery with high spatial resolutions (HSR), plays a significant role in many real-world scenarios, e.g., environment monitoring, urban planning, civil infrastructure construction, disaster rescuing, and geographic image retrieval. As a long-lasting challenging problem in both machine learning and geoinformatics communities, many approaches have been proposed to tackle it. However, previous methods always overlook the abundant information embedded in the HSR remote sensing images. The effectiveness of these methods, e.g., accuracy of detection, is therefore limited to some extent. To overcome the mentioned challenge, in this paper, we propose a novel two-phase deep framework, dubbed GLGOD-Net, to effectively detect meaningful objects in HSR images. GLGOD-Net firstly attempts to learn the enhanced deep representations from super-resolution image data. Fully utilizing the augmented image representations, GLGOD-Net then learns the fused representations into which both local and global latent features are implanted. Such fused representations learned by GLGOD-Net can be used to precisely detect different objects in remote sensing images. The proposed framework has been extensively tested on a real-world HSR image dataset for object detection and has been compared with several strong baselines. The remarkable experimental results validate the effectiveness of GLGOD-Net. The success of GLGOD-Net not only advances the cutting-edge of image data analytics, but also promotes the corresponding applicability of deep learning in remote sensing imagery. © 2020",2020,Engineering Applications of Artificial Intelligence,"Han X., He T., Ong Y.-S., Zhong Y.",10.1016/j.engappai.2020.103710,Article,9.4129552841,6.839597702
4,231,,A NOVEL SELF-TAUGHT LEARNING FRAMEWORK USING SPATIAL PYRAMID MATCHING for SCENE CLASSIFICATION,High Resolution Imagery; Remote Sensing; Scene Classification; Self-taught Learning; Spatial Pyramid Matching,"Remote sensing earth observation images have a wide range of applications in areas like urban planning, agriculture, environment monitoring, etc. While the industrial world benefits from availability of high resolution earth observation images since recent years, interpreting such images has become more challenging than ever. Among many machine learning based methods that have worked out successfully in remote sensing scene classification, spatial pyramid matching using sparse coding (ScSPM) is a classical model that has achieved promising classification accuracy on many benchmark data sets. ScSPM is a three-stage algorithm, composed of dictionary learning, sparse representation and classification. It is generally believed that in the dictionary learning stage, although unsupervised, one should use the same data set as classification stage to get good results. However, recent studies in transfer learning suggest that it might be a better strategy to train the dictionary on a larger data set different from the one to classify. In our work, we propose an algorithm that combines ScSPM with self-taught learning, a transfer learning framework that trains a dictionary on an unlabeled data set and uses it for multiple classification tasks. In the experiments, we learn the dictionary on Caltech-101 data set, and classify two remote sensing scene image data sets: UC Merced LandUse data set and Changping data set. Experimental results show that the classification accuracy of proposed method is compatible to that of ScSPM. Our work thus provides a new way to reduce resource cost in learning a remote sensing scene image classifier. © 2020 International Archives of the Photogrammetry, Remote Sensing and Spatial Information Sciences - ISPRS Archives.",2020,"International Archives of the Photogrammetry, Remote Sensing and Spatial Information Sciences - ISPRS Archives","Yang Y., Zhu D., Ren F., Cheng C.",10.5194/isprs-archives-XLIII-B2-2020-725-2020,Conference Paper,9.6744613647,6.8901157379
4,234,6.0,A generalized multi-task learning approach to stereo DSM filtering in urban areas,3D city models; Deep learning; Multi-task learning; Roof type segmentation; Stereo DSM filtering,"City models and height maps of urban areas serve as a valuable data source for numerous applications, such as disaster management or city planning. While this information is not globally available, it can be substituted by digital surface models (DSMs), automatically produced from inexpensive satellite imagery. However, stereo DSMs often suffer from noise and blur. Furthermore, they are heavily distorted by vegetation, which is of lesser relevance for most applications. Such basic models can be filtered by convolutional neural networks (CNNs), trained on labels derived from digital elevation models (DEMs) and 3D city models, in order to obtain a refined DSM. We propose a modular multi-task learning concept that consolidates existing approaches into a generalized framework. Our encoder-decoder models with shared encoders and multiple task-specific decoders leverage roof type classification as a secondary task and multiple objectives including a conditional adversarial term. The contributing single-objective losses are automatically weighted in the final multi-task loss function based on learned uncertainty estimates. We evaluated the performance of specific instances of this family of network architectures. Our method consistently outperforms the state of the art on common data, both quantitatively and qualitatively, and generalizes well to a new dataset of an independent study area. © 2020 International Society for Photogrammetry and Remote Sensing, Inc. (ISPRS)",2020,ISPRS Journal of Photogrammetry and Remote Sensing,"Liebel L., Bittner K., Körner M.",10.1016/j.isprsjprs.2020.03.005,Article,9.5313920975,6.8471393585
4,236,12.0,A robust segmentation framework for closely packed buildings from airborne LiDAR point clouds,,"Urban villages (UVs) are commonly found in many Asian cities. These villages contain many closely packed buildings constructed decades ago without proper urban planning. There is a need for those buildings to be identified and put into statistics. In this paper, we present a segmentation framework that invokes multiple machine learning techniques and point cloud/image processing algorithms to segment individual closely packed buildings from large urban scenes. The presented framework consists of two major segmentation processes. The framework first filters out the non-ground objects from the point cloud, then it classified them by using the Random Forest classifier to isolate buildings from the entire scene. After that, the building point clouds will be segmented based on several building attribute analysis methods. This is followed by using the Random Sample Consensus (RANSAC) plane filtering method to expand the space between two closely packed buildings, so that the Density-Based Spatial Clustering of Applications with Noise (DBSCAN) clustering technique can be used to more accurately segment each individual building from the closely packed building areas. Two airborne Light Detection and Ranging (LiDAR) datasets collected in two different cities with some typical closely packed buildings were used to verify the proposed framework. The results show that the framework can effectively identify the closely packed buildings with unified structures from large airborne LiDAR datasets. The overall segmentation accuracy reaches 84% for the two datasets. The proposed framework can serve as a basis for analysis and segmentation of closely packed buildings with a more complicated structure. © 2020, © 2020 Informa UK Limited, trading as Taylor & Francis Group.",2020,International Journal of Remote Sensing,"Wang X., Chan T.O., Liu K., Pan J., Luo M., Li W., Wei C.",10.1080/01431161.2020.1727053,Article,9.3932104111,6.8810739517
4,237,,Object detection of aerial image using mask-region convolutional neural network (mask R-CNN),,"The most fundamental task in remote sensing data processing and analysis is object detection. It plays an important role in classification and very useful for various applications such as forestry, urban planning, agriculture, land use and land cover mapping, etc. However, it has many challenges to find an appropriate method due to many variations in the appearance of the object in image. The object may have occlusion, illumination, viewpoint variation, shadow, etc. Many object detection method has been researched and developed. Recently, the development of various machine learning-based methods for object detection has been increasing. Among of them are methods based on artificial neural network, deep learning and its derivatives. In this research, object detection method of aerial image by using mask-region convolutional neural network (mask-R CNN) is developed. The result shows that this method gives a significant accuracy by increasing the image training and epoch time. © 2020 IOP Publishing Ltd. All rights reserved.",2020,IOP Conference Series: Earth and Environmental Science,"Musyarofah, Schmidt V., Kada M.",10.1088/1755-1315/500/1/012090,Conference Paper,9.5111713409,6.8623781204
4,252,22.0,Comparative assessment of machine learning methods for urban vegetation mapping using multitemporal Sentinel-1 imagery,Land-cover classification; Multitemporal; Sentinel-1; Speckle filtering; Synthetic aperture radar (SAR); Urban vegetation,"Mapping of green vegetation in urban areas using remote sensing techniques can be used as a tool for integrated spatial planning to deal with urban challenges. In this context, multitemporal (MT) synthetic aperture radar (SAR) data have not been equally investigated, as compared to optical satellite data. This research compared various machine learning methods using single-date and MT Sentinel-1 (S1) imagery. The research was focused on vegetation mapping in urban areas across Europe. Urban vegetation was classified using six classifiers-random forests (RF), support vector machine (SVM), extreme gradient boosting (XGB), multi-layer perceptron (MLP), AdaBoost. M1 (AB), and extreme learning machine (ELM). Whereas, SVM showed the best performance in the single-date image analysis, the MLP classifier yielded the highest overall accuracy in the MT classification scenario. Mean overall accuracy (OA) values for all machine learning methods increased from 57% to 77% with speckle filtering. Using MT SAR data, i.e., three and five S1 imagery, an additional increase in the OA of 8.59% and 13.66% occurred, respectively. Additionally, using three and five S1 imagery for classification, the F1 measure for forest and low vegetation land-cover class exceeded 90%. This research allowed us to confirm the possibility of MT C-band SAR imagery for urban vegetation mapping. © 2020 by the authors.",2020,Remote Sensing,"Gašparović M., Dobrinić D.",10.3390/rs12121952,Article,9.7939682007,6.8886890411
4,259,10.0,A locally-constrained YOLO framework for detecting small and densely-distributed building footprints,Building detection; deep learning; locally constrained; remote sensing; YOLO,"Building footprints are among the most predominant features in urban areas, and provide valuable information for urban planning, solar energy suitability analysis, etc. We aim to automatically and rapidly identify building footprints by leveraging deep learning techniques and the increased availability of remote sensing datasets at high spatial resolution. The task is computationally challenging due to the use of large training datasets and large number of parameters. In related work, You-Only-Look-Once (YOLO) is a state-of-the-art deep learning framework for object detection. However, YOLO is limited in its capacity to identify small objects that appear in groups, which is the case for building footprints. We propose a LOcally-COnstrained (LOCO) You-Only-Look-Once framework to detect small and densely-distributed building footprints. LOCO is a variant of YOLO. Its layer architecture is determined by the spatial characteristics of building footprints and it uses a constrained regression modeling to improve the robustness of building size predictions. We also present an invariant augmentation based voting scheme to further improve the precision in the prediction phase. Experiments show that LOCO can greatly improve the solution quality of building detection compared to related work. © 2019, © 2019 Informa UK Limited, trading as Taylor & Francis Group.",2020,International Journal of Geographical Information Science,"Xie Y., Cai J., Bhojwani R., Shekhar S., Knight J.",10.1080/13658816.2019.1624761,Article,9.4030780792,6.8743925095
4,282,2.0,Land cover classification based on machine learning using UAV multi-spectral images,Image classification; Machine learning; UAV remote sensing,"Land cover classification using UAV multi-spectral images is of great significance in precision agriculture, urban planning, land use and other fields. However, traditional remote sensing image classification methods cannot meet the classification accuracy requirements of UAV multi-spectral images. This paper aims to propose an object-based machine learning classification method to improve the land over classification accuracy of UAV multi-spectral images. The experimental area is a standard test field located in the Jilin Province of China. The experimental data was captured by a UAV equipped with a multi-spectral camera which includes four bands from 550 nm to 790 nm. First, the original images were preprocessed and the spectral curves of land cover were analyzed, thus four kinds of land cover with large differences were selected as categories. Then pixel-based, boosting-based and object-based machine learning methods were used for classification. The object-based classification method could make full use of the spatial and spectral information, and eliminate the noise problem caused by the high resolution of the UAV image to a certain extent. Finally, accuracy analysis using the verification image showed that the RF-O method achieved the highest classification accuracy of 92.2419%, and the kappa coefficient was 0.8904. All results indicate that the object-based machine learning classification method proposed in this paper is more suitable for the research of land cover classification, comparing with the traditional remote sensing image classification methods, and performs well on the land cover classification of UAV multi-spectral images. © 2020 SPIE.",2020,Proceedings of SPIE - The International Society for Optical Engineering,"Pan L., Gu L., Ren R., Yang S.",10.1117/12.2566128,Conference Paper,9.8150110245,6.887403965
4,289,4.0,A Self-Supervised Learning Framework for Road Centerline Extraction from High-Resolution Remote Sensing Images,High-resolution remote sensing image; one-class classifier; road centerline; road extraction; self-supervised learning,"Road extraction from the high-resolution remote sensing image is significant for the land planning, vehicle navigation, etc. The existing road extraction methods normally need many preprocessing and subsequent optimization steps. Therefore, an automatic road centerline extraction method based on the self-supervised learning framework for high-resolution remote sensing image is proposed. This proposed method does not need to manually select training samples and other optimization steps, such as the nonroad area removing. First, the positive sample selection method combining the spectral and shape features is proposed to extract the road sample. Then, the one-class classifier framework is introduced and the random forest positive unlabeled learning classifier is constructed to get the posterior probability of the pixel belonging to road. The shape feature and the posterior probability are combined to form the final road network in the object-oriented way. Finally, the road centerline is obtained through the tensor voting algorithm. In order to verify the effectiveness of the proposed algorithm, high-resolution remote sensing images and benchmark datasets are used to do experiments. The indexes of the completeness ratio, the correctness ratio, and the detection quality are used for the quantitative accuracy evaluation. Compared with the supervised, the unsupervised, and the one-class classification road extraction algorithms, this proposed algorithm achieves high accuracy and efficiency. For the deep learning method comparison, the deep learning method performs well in most cases especially in the complex urban area. However, the deep learning method needs a large number of samples and a long training time, and our self-supervised learning framework does not need the training samples. © 2008-2012 IEEE.",2020,IEEE Journal of Selected Topics in Applied Earth Observations and Remote Sensing,"Guo Q., Wang Z.",10.1109/JSTARS.2020.3014242,Article,9.3599033356,6.8489737511
4,301,1.0,Application of satellite image segmentation for urban planning optimization,Aerial image segmentation; Building detection; Machine learning,"This article presents research results of a convolution neural network for building detection on high-resolution aerial images of Planet database. Jaccard index was used for analysis of the quality of machine learning algorithm. This index of similarity compares results of algorithms with real masks. The masks were sliced on smaller parts together with images before training of developed model. The convolution neural network was launched on NVIDIA DGX-1 supercomputer, which was provided by AI-center of P.G Demidov Yaroslavl State University. The problem of building detection on satellite images can be put into practice for urban planning, building control, search of the best locations for outlets etc. © WCSE 2019. All rights reserved.",2020,"Proceedings of 2019 the 9th International Workshop on Computer Science and Engineering, WCSE 2019","Khryashchev V., Ivanovsky L., Ostrovskaya A., Semenov A.",,Conference Paper,9.5504169464,6.8779840469
