DocId,Cited by,Year,Document Type,Title,Abstract,Author Keywords,Authors,DOI
184,,2021,Conference Review,"AVI 2020 Workshop on Road Mapping Infrastructures for Artificial Intelligence Supporting Advanced Visual Big Data Analysis, AVI-BDA 2020 and 2nd Italian Workshop on Visualization and Visual Analytics, ITAVIS 2020",The proceedings contain 14 papers. The special focus in this conference is on Road Mapping Infrastructures for Artificial Intelligence Supporting Advanced Visual Big Data Analysis. The topics include: An Experience on Cooperative Development of Interactive Visualizations for the Analysis of Urban Data; Explaining AI Through Critical Reflection Artifacts: On the Role of Communication Design Within XAI; Information Visualization and Visual Analytics at IVU Lab; visual Analytics for Financial Crime Detection at the University of Perugia; a Visual Analytics Technique to Compare the Performance of Predictive Models; affective Analytics and Visualization for Ensemble Event-Driven Stock Market Forecasting; understanding the Role of (Advanced) Machine Learning in Metagenomic Workflows; intelligent Advanced User Interfaces for Monitoring Mental Health Wellbeing; Towards Explainable Artificial Intelligence and Explanation User Interfaces to Open the ‘Black Box’ of Automated ECG Interpretation; recognition and Visualization of Facial Expression and Emotion in Healthcare; machine Learning in Healthcare: Breast Cancer and Diabetes Cases; AI2VIS4BigData: Qualitative Evaluation of an AI-Based Big Data Analysis and Visualization Reference Model.,,[No author name available],
210,,2020,Conference Paper,From PIace2Vec to Multi-Scale Built-Environment Representation: A General-Purpose Distributional Embedding for Urban Data Analysis,"Built environments like cities, roads, communities are rich sources of urban data. Many downstream applications require comprehensive analysis like geographic information retrieval, recommender systems, geographic knowledge graphs, and in general, understanding urban spaces [28]. Points of Interests (POI), as one of the most researched aspects of urban data, has been successfully modeled using concepts borrowed from Machine Learning (ML) and Natural Language Processing (NLP). In the work of Place2Vec [28], a Word2Vec-like statistical model is proposed to represent spatial adjacency with a continuous embedding space. This method successfully models the functional semantics of POIs with regard to several human-assessment based evaluations. However, though the Place2Vec model addresses the distributional heterogeneity within a given spatial context with ITDL augmentation, it does not address the spatial heterogeneity among different regions. To solve this problem, we propose to introduce a hierarchical, density-based, self-adjusting clustering mechanism. The boundary of relatedness and unrelatedness is learned from the given context, where denser areas have tighter bounds while sparser areas have looser ones. We train our model on both the baseline Yelp hierarchical dataset [28] and our OpenStreetMap dataset. We demonstrate that 1) our model significantly improves the performance on 2 of the 3 baseline tasks and the stability of training, and 2) our model generalizes excellently across 112 cities of radically different scales (minimum 1725 POIs, maximum 2694070 POIs), regions (North America, Europe, Asia, Africa) and types (commercial, touristy, industrial, etc.) without the need of adjusting or tuning any hyperparameters. We also demonstrate that our model can be used to discover interesting facts about cities like inter-city semantic analogy and intra-city connectivity, which can be very useful in urban planning, social computing and public policy making. © 2020 ACM.",Geo-Semantics; Machine Learning; Points of Interest; Similarity,"Wang Z., Moosavi V.",10.1145/3423334.3431450
211,7.0,2020,Article,Machine learning technologies for sustainability in smart cities in the post-covid era,"The unprecedented urban growth of recent years requires improved urban planning and management to make urban spaces more inclusive, safe, resilient and sustainable. Additionally, humanity faces the COVID pandemic, which especially complicates the management of Smart Cities. A possible solution to address these two problems (environmental and health) in Smart Cities may be the use of Machine Learning techniques. One of the objectives of our work is to thoroughly analyze the link between the concepts of Smart Cities, Machine Learning techniques and their applicability. In this work, an exhaustive study of the relationship between Smart Cities and the applicability of Machine Learning (ML) techniques is carried out with the aim of optimizing sustainability. For this, the ML models, analyzed from the point of view of the models, techniques and applications, are studied. The areas and dimensions of sustainability addressed are analyzed, and the Sustainable Development Goals (SDGs) are discussed. The main objective is to propose a model (EARLY) that allows us to tackle these problems in the future. An inclusive perspective on applicability, sustainability scopes and dimensions, SDGs, tools, data types and Machine Learning techniques is provided. Finally, a case study applied to an Andalusian city is presented. © 2020 by the authors. Licensee MDPI, Basel, Switzerland.",Machine learning; SGDs; Smart cities; Sustainability,"Heras A.L., Luque-Sendra A., Zamora-Polo F.",10.3390/su12229320
257,7.0,2020,Article,Identifying the Structure of Cities by Clustering Using a New Similarity Measure Based on Smart Card Data,"Identifying the structure of cities has long been studied in urban planning and traffic modeling. This study presents a reliable method that reveals the structure of cities mainly based on clustering analysis using a new similarity measure. Several previous studies have used well-known clustering algorithms in machine learning fields, such as k-means clustering based on temporal mobility patterns of regions, whereas other studies have applied community detection algorithms on networks that depict traffic flows. However, the former does not reflect spatial interactions among places or areas, and the latter groups' places or areas with different land uses into the same cluster. To address these issues in existing approaches, this study proposes a new similarity method that considers not only temporal mobility patterns of areas but also spatial interactions with other areas. Moreover, the study combines spectral clustering repeated several times with hierarchical clustering to obtain a reliable structure that keeps the contiguity of clusters and determine the hierarchy of different areal units. The application of the proposed method to the data for Seoul, South Korea, reveals that the proposed clustering process divides a city into relatively homogeneous areas in terms of land uses. The flow maps based on the clustering results also revealed the spatial interactions between different areas and identify the polycentric structure of Seoul. © 2000-2011 IEEE.",city structure; clustering analysis; data mining; public transportation; Smart cards,Kim K.,10.1109/TITS.2019.2910548
272,1.0,2020,Article,Smart urban futures: Outlining the smart city planning project,"Cities are constantly evolving complex systems, and ongoing digitalization is making them even more complex. The toolkit for urban scientists is expanding with computational methods from AI to machine learning, data mining and advanced spatial analyses. Together with vast amount of data of urban phenomena and new lifestyles emerging from virtuality and cybernetic systems, this ‘smartification’ makes the planning and analyses more challenging while providing new tools to respond to them. In this article I propose a project for better understanding and guiding the future smart city based on dynamic urban theories such as those studying complex adaptive systems, urban morphology, urban economy and mobility systems. I argue that we need to carry out empirical research on ongoing change to learn about novel, becoming spatial and functional patterns in the city, and apply both theories and imaginary visions to be able to grasp the likely qualitative transition in humans’ life following the ubiquitous use of technology. The project is built around three coupled modules, urban space, mobility and urban economics, and it will be carried out in the city of Tallinn, Estonia. The expected results would help planners, decision makers, urban scientists and developers to better understand the transition we are facing, to be able to support the change and steer it towards better social and economic outcomes. © 2020 Ben Gurion University of the Negev. All rights reserved.",Complexity; Models; Smart city; Spatial analytics; Uncertainty; Urban planning,Partanen J.,
273,5.0,2020,Conference Paper,Learning geo-contextual embeddings for commuting flow prediction,"Predicting commuting flows based on infrastructure and land-use information is critical for urban planning and public policy development. However, it is a challenging task given the complex patterns of commuting flows. Conventional models, such as gravity model, are mainly derived from physics principles and limited by their predictive power in real-world scenarios where many factors need to be considered. Meanwhile, most existing machine learning-based methods ignore the spatial correlations and fail to model the influence of nearby regions. To address these issues, we propose Geocontextual Multitask Embedding Learner (GMEL), a model that captures the spatial correlations from geographic contextual information for commuting flow prediction. Specifically, we first construct a geo-adjacency network containing the geographic contextual information. Then, an attention mechanism is proposed based on the framework of graph attention network (GAT) to capture the spatial correlations and encode geographic contextual information to embedding space. Two separate GATs are used to model supply and demand characteristics. To enhance the effectiveness of the embedding representation, a multitask learning framework is used to introduce stronger restrictions, forcing the embeddings to encapsulate effective representation for flow prediction. Finally, a gradient boosting machine is trained based on the learned embeddings to predict commuting flows. We evaluate our model using real-world dataset from New York City and the experimental results demonstrate the effectiveness of our proposed method against the state of the art. Copyright © 2020, Association for the Advancement of Artificial Intelligence (www.aaai.org). All rights reserved.",,"Liu Z., Miranda F., Xiong W., Yang J., Wang Q., Silva C.T.",
281,1.0,2020,Conference Paper,Recognition of implicit geographic movement in text,"Analyzing the geographic movement of humans, animals, and other phenomena is a growing field of research. This research has benefited urban planning, logistics, animal migration understanding, and much more. Typically, the movement is captured as precise geographic coordinates and time stamps with Global Positioning Systems (GPS). Although some research uses computational techniques to take advantage of implicit movement in descriptions of route directions, hiking paths, and historical exploration routes, innovation would accelerate with a large and diverse corpus. We created a corpus of sentences labeled as describing geographic movement or not and including the type of entity moving. Creating this corpus proved difficult without any comparable corpora to start with, high human labeling costs, and since movement can at times be interpreted differently. To overcome these challenges, we developed an iterative process employing hand labeling, crowd voting for confirmation, and machine learning to predict more labels. By merging advances in word embeddings with traditional machine learning models and model ensembling, prediction accuracy is at an acceptable level to produce a large silver-standard corpus despite the small gold-standard corpus training set. Our corpus will likely benefit computational processing of geography in text and spatial cognition, in addition to detection of movement. © European Language Resources Association (ELRA), licensed under CC-BY-NC",Corpus; Crowdsourcing; Embeddings; Geographic movement; Machine learning; Spatial cognition; Text classification,"Pezanowski S., Mitra P.",
295,1.0,2020,Conference Paper,Harnessing Social Interactions on Twitter for Smart Transportation Using Machine Learning,"Twitter is generating a large amount of real-time data in the form of microblogs that has potential knowledge for various applications like traffic incident analysis and urban planning. Social media data represents the unbiased actual insights of citizens’ concerns that may be mined in making cities smarter. In this study, a computational framework has been proposed using word embedding and machine learning model to detect traffic incidents using social media data. The study includes the feasibility of using machine learning algorithms with different feature extraction and representation models for the identification of traffic incidents from the Twitter interactions. The comprehensive proposed approach is the combination of following four steps. In the first phase, a dictionary of traffic-related keywords is formed. Secondly, real-time Twitter data has been collected using the dictionary of identified traffic related keywords. In the third step, collected tweets have been pre-processed, and the feature generation model is applied to convert the dataset eligible for a machine learning classifier. Further, a machine learning model is trained and tested to identify the tweets containing traffic incidents. The results of the study show that machine learning models built on top of right feature extraction strategy is very promising to identify the tweets containing traffic incidents from micro-blogs. © 2020, IFIP International Federation for Information Processing.",Machine learning; Traffic incident detection; Twitter data analysis,"Chaturvedi N., Toshniwal D., Parida M.",10.1007/978-3-030-49186-4_24
309,,2020,Conference Review,"4th Future Technologies Conference, FTC 2019","The proceedings contain 73 papers. The special focus in this conference is on Future Technologies. The topics include: Efficient Bayesian Expert Models for Fever in Neutropenia and Fever in Neutropenia with Bacteremia; preventing Overfitting by Training Derivatives; machine Learning for the Identification and Classification of Key Phrases from Clinical Documents in Spanish; automatic Grasping Using Tactile Sensing and Deep Calibration; an Emotion-Based Search Engine; internet Memes: A Novel Approach to Distinguish Humans and Bots for Authentication; estimating the Ground Temperature Around Energy Piles Using Artificial Neural Networks; emerging Technology of Man’s Life-Long Partnership with Artificial Intelligence; making Food with the Mind: Integrating Brain-Computer Interface and 3D Food Fabrication; AI Embedded Transparent Health and Medicine System; neuroscience of Creativity in Human Computer Interaction; optimal Mapping Function for Predictions of the Subjective Quality Evaluation Using Artificial Intelligence; negative Log Likelihood Ratio Loss for Deep Neural Network Classification; when Inclusion Means Smart City: Urban Planning Against Poverty; AntiOD: A Smart City Initiative to Fight the Opioid Crisis; common Data Format in Visual Assembling Guidance Using Augmented Reality; determining a Framework for the Generation and Evaluation of Ambient Intelligent Agent System Designs; virtual Reality Rendered Video Precognition with Deep Learning for Crowd Management; Food, Energy and Water (FEW) Nexus Modeling Framework; End-to-End Drive By-Wire PID Lateral Control of an Autonomous Vehicle; image Segmentation Based on Cumulative Residual Entropy; cryptography in Quantum Computing; a Stealth Migration Approach to Moving Target Defense in Cloud Computing; low Power High Performance Computing on Arm System-on-Chip in Astrophysics.",,[No author name available],
311,8.0,2019,Article,Automatic identification of the social functions of areas of interest (AOIS) using the standard hour-day-spectrum approach,"The social function of areas of interest (AOIs) is crucial to the identification of urban functional zoning and land use classification, which has been a hot topic in various fields such as urban planning and smart city fields. Most existing studies on urban functional zoning and land use classification either largely rely on low-frequency remote sensing images, which are constrained to the block level due to their spatial scale limitation, or suffer from low accuracy and high uncertainty when using dynamic data, such as social media and traffic data. This paper proposes an hour-day-spectrum (HDS) approach for generating six types of distribution waveforms of taxi pick-up and drop-off points which serve as interpretation indicators of the social functions of AOIs. To achieve this goal, we first performed fine-grained cleaning of the drop-off points to eliminate the spatial errors caused by taxi drivers. Next, buffer and spatial clustering were integrated to explore the associations between travel behavior and AOIs. Third, the identification of AOI types was made by using the standard HDS method combined with the k-nearest neighbor (KNN) algorithm. Finally, some matching tests were carried out by similarity indexes of a standard HDS and sample HDS, i.e., the Gaussian kernel function and Pearson coefficient, to ensure matching accuracy. The experiment was conducted in the Chongchuan and Gangzha Districts, Nantong, Jiangsu Province, China. By training 50 AOI samples, six types of standard HDS of residential districts, schools, hospitals, and shopping malls were obtained. Then, 108 AOI samples were tested, and the overall accuracy was found to be 90.74%. This approach generates value-added services of the taxi trajectory and provides a continuous update and fine-grained supplementary method for the identification of land use types. In addition, the approach is object-oriented and based on AOIs, and can be combined with image interpretation and other methods to improve the identification effect. © 2019 by the authors.",AOI; Land use type; Machine learning; Social function; Urban functional zoning,"Zhou T., Liu X., Qian Z., Chen H., Tao F.",10.3390/ijgi9010007
343,3.0,2019,Conference Paper,Utilizing Big Data for Enhancing Passenger Safety in Railway Stations,"In light of the increasing demand and capacity in the railway industry, it is imperative to maintain safety in relation to the complexities of the substantial railway stations. Thus, it is important to take note of the time where investments in new technologies directed at the safety of the railway enable safety and protection in this area. Novel technological techniques such as big data analysis (BDA), data mining or machine learning (ML) have been developed and applied in many areas such as sales, banking and healthcare. The development of such methods has important benefits within the context of railway safety, however, these new methods need to be implemented and developed with consideration of whether these operational models can help to solve the various difficulties that currently exist in the risk analysis of railway stations. Moreover, as the adoption of the Internet of thing (IoT) grows, it is expected that analytical needs for handling data will also increase. It has been shown that the progression towards automation and applying such innovative new technologies such as BDA may be a powerful tool for integration in the future of transportation in general and the railway industry in particular, whereby analytical predictions can aid in the development of safer railway stations which have greater potential for ensuring the safety of passengers. In this paper a Bow Tie (BT) framework model has been created to combine BDA into the risk assessment process. The BDA can be beneficial to the risk assessment, support the decision makers in real time, and reduce human errors. This method can be fully integrated into passenger data and the business model for the railway station. Employing the existing safety records utilizing BDA is expected to mitigate risks, predict hazards, raise safety and security efficiency and reduce the cost. © Published under licence by IOP Publishing Ltd.",,"Alawad H., Kaewunruen S., Min A.",10.1088/1757-899X/603/5/052031
345,1.0,2019,Article,Combining design patterns and topic modeling to discover regions that support particular functionality,"The problem of discovering regions that support particular functionalities in an urban setting has been approached in literature using two general methodologies: top-down, encoding expert knowledge on urban planning and design and discovering regions that conform to that knowledge; and bottom-up, using data to train machine learning models, which can discover similar regions. Both methodologies face limitations, with knowledge-based approaches being criticized for scalability and transferability issues and data-driven approaches for lacking interpretability and depending heavily on data quality. To mitigate these disadvantages, we propose a novel framework that fuses a knowledge-based approach using design patterns and a data-driven approach using latent Dirichlet allocation (LDA) topic modeling in three different ways: Functional regions discovered using either approach are evaluated against each other to identify cases of significant agreement or disagreement; knowledge from patterns is used to adjust topic probabilities in the learning model; and topic probabilities are used to adjust pattern-based results. The proposed methodologies are demonstrated through the use case of identifying shopping-related regions in the Los Angeles metropolitan area. Results show that the combination of pattern-based discovery and topic modeling extraction helps uncover discrepancies between the two approaches and smooth inaccuracies caused by the limitations of each approach. © 2019 by the authors.",Functional region; Patterns; Place; Topic modeling; Urban planning; Volunteered Geographic Information (VGI),"Papadakis E., Gao S., Baryannis G.",10.3390/ijgi8090385
384,3.0,2019,Conference Paper,Unveiling Topics from Scientific Literature on the Subject of Self-driving Cars using Latent Dirichlet Allocation,"Self-driving cars are becoming popular topics in academia. Consumers of self-driving cars and vehicles have different concerns, for example, safety and security, to name a few. Also, the public sector has interests in self-driving cars such as amending policies to enable the management of self-driving vehicles in cities, urban planning, traffic management and, etc. In this paper, more than 2700 corpus are extracted from literature from several subject areas to identify latent (hidden) topics of self-driving cars. Latent Dirichlet Allocation (LDA) is used for topic identification. The result of this study shows that topics identified are valid research areas such as urban planning, driver car (computer) interaction, self-driving control and system design, ethics in self-driving cars, safety and risk assessment, training dataset quality and machine learning in self-driving cars are among the topics identified. Furthermore, the network visualization of association graph of terms shows that the most frequently discussed concepts reveal that control of self-driving cars is based on algorithms, data, design, method, and model. The methods used in this study and the results can be used as decision tools, if carefully applied, in diverse disciplines that are disrupted by the introduction of self-driving cars. For future study, we plan to extend this study with a larger dataset and other data mining techniques. © 2018 IEEE.",self-driving cars; topic modeling; unsupervised topic modeling; unveiling hidden topics,"Ayele W.Y., Juell-Skielse G.",10.1109/IEMCON.2018.8615056
388,12.0,2019,Conference Paper,"Multi-GCN: Graph convolutional networks for multi-view networks, with applications to global poverty","With the rapid expansion of mobile phone networks in developing countries, large-scale graph machine learning has gained sudden relevance in the study of global poverty. Recent applications range from humanitarian response and poverty estimation to urban planning and epidemic containment. Yet the vast majority of computational tools and algorithms used in these applications do not account for the multi-view nature of social networks: people are related in myriad ways, but most graph learning models treat relations as binary. In this paper, we develop a graph-based convolutional network for learning on multi-view networks. We show that this method outperforms state-of-the-art semi-supervised learning algorithms on three different prediction tasks using mobile phone datasets from three different developing countries. We also show that, while designed specifically for use in poverty research, the algorithm also outperforms existing benchmarks on a broader set of learning tasks on multi-view networks, including node labelling in citation networks. © 2019, Association for the Advancement of Artificial Intelligence (www.aaai.org). All rights reserved.",,"Khan M.R., Blumenstock J.E.",
