DocId,Cited by,Year,Document Type,Title,Abstract,Author Keywords,Authors,DOI
430,26.0,2018,Article,Mining large-scale human mobility data for long-term crime prediction,"Traditional crime prediction models based on census data are limited, as they fail to capture the complexity and dynamics of human activity. With the rise of ubiquitous computing, there is the opportunity to improve such models with data that make for better proxies of human presence in cities. In this paper, we leverage large human mobility data to craft an extensive set of features for crime prediction, as informed by theories in criminology and urban studies. We employ averaging and boosting ensemble techniques from machine learning, to investigate their power in predicting yearly counts for different types of crimes occurring in New York City at census tract level. Our study shows that spatial and spatio-temporal features derived from Foursquare venues and checkins, subway rides, and taxi rides, improve the baseline models relying on census and POI data. The proposed models achieve absolute R2 metrics of up to 65% (on a geographical out-of-sample test set) and up to 89% (on a temporal out-of-sample test set). This proves that, next to the residential population of an area, the ambient population there is strongly predictive of the area’s crime levels. We deep-dive into the main crime categories, and find that the predictive gain of the human dynamics features varies across crime types: such features bring the biggest boost in case of grand larcenies, whereas assaults are already well predicted by the census features. Furthermore, we identify and discuss top predictive features for the main crime categories. These results offer valuable insights for those responsible for urban policy or law enforcement. © 2018, The Author(s).",Applied machine learning; Crime prediction; Human mobility; Location-based social networks; Spatio-temporal data; Urban computing,"Kadar C., Pletikosa I.",10.1140/epjds/s13688-018-0150-z
468,1.0,2018,Book Chapter,Data mining techniques for smart mobility—a survey,"With the rapid increase in urbanization, there is essence for making urban areas smart. There are assorted fields of computer science liable for development of a city to make it smart and intelligent. Some of these fields include data mining, sensor networks, Internet of things, web of things, cloud computing techniques and machine learning. Smart city is an umbrella term that encompasses smart mobility, smart governance, smart planning, smart environment and others. Smart mobility is one of the crucial aspects of smart city addressing efficient movement of people and goods from one place to another. This work is an extensive survey of research works related to application of data mining techniques for smart mobility. A comparative study of major works done in the aforementioned field is outlined in this paper. © Springer Nature Singapore Pte Ltd. 2018",Data mining; Smart city; Smart mobility; Urban computing,"Aggarwal A., Toshniwal D.",10.1007/978-981-10-8633-5_25
503,1.0,2017,Conference Paper,Multiscale spatio-temporal data aggregation and mapping for urban data exploration,"Maps seem the most intuitive way to visualize massive urban data but they also raise some well-known graphical problems (such as visual clutter, etc.). This paper focuses on processing massive spatiotemporal data in order to ease multi-scale exploration. To this end, we describe a preprocessing tool that enables the automatic creation of a multi-resolution grid from a high resolution grid of spatio-temporal data in a format compatible with webmapping applications (vector tiles). The use of this tool is exemplified through a prototype that offers the possibility to navigate into a massive itinerary request dataset collected in the Ile-de- France region. © ESANN 2017 - Proceedings, 25th European Symposium on Artificial Neural Networks, Computational Intelligence and Machine Learning. All rights reserved.",,"Côme E., Remy A.",
516,1.0,2017,Conference Paper,Data mining tourism patterns,"In this study we show how Call Detail Record (CDR) can be used to better understand the travel patterns of visitors. We show how Origin-Destination (OD) Interactive Maps can provide transportation information through CDR. We then use aggregation of CDR to show the differences between the travel patterns of visitors from different countries and of different lengths of stay. We also show that visitors move differently during event periods and non-event periods, reflecting the importance of real-time data available by CDR. From CDR, we can gain more detailed and complete information about how tourists move compared to traditional surveys, which can be used to aid smarter transportation systems and urban resource planning. © 2017, The Association for Computer-Aided Architectural Design Research in Asia (CAADRIA), Hong Kong.",Call detail record; Machine learning; Original- destination matrix; Urban design tool,"Chen N.C., Xie J., Tinn P., Alonso L., Nagakura T., Larson K.",
522,17.0,2016,Article,Automated urban travel interpretation: A bottom-up approach for trajectory segmentation,"Understanding travel behavior is critical for an effective urban planning as well as for enabling various context-aware service provisions to support mobility as a service (MaaS). Both applications rely on the sensor traces generated by travellers’ smartphones. These traces can be used to interpret travel modes, both for generating automated travel diaries as well as for real-time travel mode detection. Current approaches segment a trajectory by certain criteria, e.g., drop in speed. However, these criteria are heuristic, and, thus, existing approaches are subjective and involve significant vagueness and uncertainty in activity transitions in space and time. Also, segmentation approaches are not suited for real time interpretation of open-ended segments, and cannot cope with the frequent gaps in the location traces. In order to address all these challenges a novel, state based bottom-up approach is proposed. This approach assumes a fixed atomic segment of a homogeneous state, instead of an event-based segment, and a progressive iteration until a new state is found. The research investigates how an atomic state-based approach can be developed in such a way that can work in real time, near-real time and offline mode and in different environmental conditions with their varying quality of sensor traces. The results show the proposed bottom-up model outperforms the existing event-based segmentation models in terms of adaptivity, flexibility, accuracy and richness in information delivery pertinent to automated travel behavior interpretation. © 2016 by the authors; licensee MDPI, Basel, Switzerland.",Activity; Context; GPS; IMU; MaaS; Machine learning; Temporal calculi; Trajectory; Trip,"Das R.D., Winter S.",10.3390/s16111962
537,13.0,2016,Conference Paper,Using abstractions to solve opportunistic crime security games at scale,"In this paper, we aim to deter urban crime by recommending optimal police patrol strategies against opportunistic criminals in large scale urban problems. While previous work has tried to learn criminals' behavior from real world data and generate patrol strategies against opportunistic crimes, it cannot scale up to large-scale urban problems. Our first contribution is a game abstraction framework that can handle opportunistic crimes in large-scale urban areas. In this game abstraction framework, we model the interaction between officers and opportunistic criminals as a game with discrete targets. By merging similar targets, we obtain an abstract game with fewer total targets. We use real world data to learn and plan against opportunistic criminals in this abstract game, and then propagate the results of this abstract game back to the original game. Our second contribution is the layer-generating algorithm used to merge targets as described in the framework above. This algorithm applies a mixed integer linear program (MILP) to merge similar and geographically neighboring targets in the large scale problem. As our third contribution, we propose a planning algorithm that recommends a mixed strategy against opportunistic criminals. Finally, our fourth contribution is a heuristic propagation model to handle the problem of limited data we occasionally encounter in large-scale problems. As part of our collaboration with local police departments, we apply our model in two large scale urban problems: a university campus and a city. Our approach provides high prediction accuracy in the real datasets; furthermore, we project significant crime rate reduction using our planning strategy compared to current police strategy. Copyright © 2016, International Foundation for Autonomous Agents and Multiagent Systems (www.ifaamas.org). All rights reserved.",Abstraction; Machine learning; Security games,"Zhang C., Bucarey V., Mukhopadhyay A., Sinha A., Qian Y., Vorobeychik Y., Tambe M.",
543,,2016,Conference Review,"European Conference on Machine Learning and Knowledge Discovery in Databases, ECML PKDD 2016","The proceedings contain 39 papers. The special focus in this conference is on Demo Track Contributions, Industrial Track Contributions and Nectar Track Contributions. The topics include: A tool for subjective and interactive visual data exploration; a web-based visualization tool for biclustering of multivariate time series; dynamic trafficmanagement using heterogeneous urban data; coordinate transformations for characterization and cluster analysis of spatial configurations in football; leveraging spatial abstraction in traffic analysis and forecasting with visual analytics; the SPMF open-source data mining library version 2; dynamic attributed network with community structure generator; real-time story tracking via social tags; learning language models from images with ReGLL; exploratory analysis of text collections through visualization and hybrid biclustering; pattern-based mining of satellite image time series; finding incident-related social media messages for emergency awareness; exploratory monitoring of twitter streams for the 2016 U.S. presidential election cycle; using social media to promote STEM education; a real time system for crowd flow prediction at metropolitan subway stations; finding dynamic co-evolving zones in spatial-temporal time series data; ECG monitoring in wearable devices by sparse models; intelligent urban data monitoring for smart cities; automatic detection of non-biological artifacts in ECGs acquired during cardiac computed tomography; active learning with rationales for identifying operationally significant anomalies in aviation; engine misfire detection with pervasive mobile audio; a KDD process for discrimination discovery; personality-based user modeling for music recommender systems and resource-aware steel production through data mining.",,[No author name available],
561,2.0,2014,Conference Paper,A reasoning approach for modelling and predicting terroristic attacks in urban environments,"During the last decade the world has witnessed a number of terroristic attacks and security incidents exposing numerous vulnerabilities of the urban environment. Hence the ability to proactively detect and even predict potential threats related to terrorist attacks is crucial for supporting government agencies in order to timely react (pro-act) to potentially alarming terrorist attacks. The work described in this paper is part of an overall larger effort in developing a framework for early identification and prediction of terrorist actions (the PROACTIVE project-http://www.fp7-proactive.eu/). The paper focuses on a near real-time reasoning layer designed around a number of reasoning capabilities for transforming raw and symbolic events into meaningful alerts. The reasoning layer was designed to process information sources at different abstraction levels (e.g. sensor information, police patrol inputs, external semantic crafted data sources) and simulates various expert user roles indicated as crucial in the intelligence analyst work flow (i.e. operational, tactical and strategic user roles). Additionally a special focus was given to support functional requirements of the overall terrorist attack prediction system, as producing near real-time detection of threat events by relying on reliable models regarding terrorist actions and predicting sensitive threat events. Hence the overall designed builds on top of approaches as event driven architecture, complex event processing systems, and machine learning techniques. A prototype implementation of layer is presented in a simulated validation scenario. The prototype allows an expert user to monitor threat probabilities for different physical environments, and influence the sensitivity of these environments in real-time as well as and provide feedback for adapting the machine learning models. © 2014 IEEE.",predictive reasoning; stream processing; urban terrorist indicators,"Archetti F., Djordjevic D., Giordani I., Sormani R., Tisato F.",10.1109/CCST.2014.6987009
