cluster,min_samples,min_cluster_size,epsilon,total_groups,outlier_count,outlier_key_phrase,group_0_count,group_0_key_phrase,group_1_count,group_1_key_phrase,group_2_count,group_2_key_phrase,group_3_count,group_3_key_phrase,group_4_count,group_4_key_phrase,group_5_count,group_5_key_phrase,group_6_count,group_6_key_phrase,group_7_count,group_7_key_phrase,group_8_count,group_8_key_phrase,group_9_count,group_9_key_phrase,group_10_count,group_10_key_phrase,group_11_count,group_11_key_phrase,group_12_count,group_12_key_phrase,group_13_count,group_13_key_phrase,group_14_count,group_14_key_phrase,group_15_count,group_15_key_phrase,group_16_count,group_16_key_phrase,group_17_count,group_17_key_phrase,group_18_count,group_18_key_phrase,group_19_count,group_19_key_phrase,group_20_count,group_20_key_phrase,group_21_count,group_21_key_phrase
#6,None,5,0.0,4,83,"urban valuation estimation, architectural color icon, architectural color, emotional computing, convolutional variational autoencoders, Spatial network, common wild bee, building reconstruction, Holistic visual data, city safety security, visual quality, perceived visual quality, human emotion recognition, tree planting policy, property assessment, land value, color icon creation, Visual Exploration, cluster dynamic analysis, visual analytics, multisensory laboratory, place sentiment, public transportation demand, tree location data, sociodemographics, spatial evaluation, habitat selection, tree planting, Sonic environment, immigrant assimilation, tree placement, solitary bee, Towards sustainable transit, bee, predicted ridership, cultural ecosystem service, morphological feature, crowdsourcing game, environmental evaluation, cultural ecosystem, nature photograph, decision tree, visual image interpretation, quantitative morphological description, street renewal, visitor experience, ecosystem service assessment, historical preservation, Random Forest model, efficient street renewal, environmental sensor, Digital excavation, life circle planning, mapping, color icon, interactive visual analytics, elevation data, tree location, social medium photograph, public space management, human physiological change, height data, google map, semantic information, location selection, big data, image recognition, height prediction, signal processing, novel semantic model, activity space estimation, transit node, classification, assimilation, sentiment, level semantic information, historical site, tourism, Feature extraction, public place, Shanghai city, clustering, data",9.0,"autoencoders, deep convolutional network, deep learning model, deep learning, machine learning model, machine learning, feature selection, machine learning technique, machine learning method",218.0,"urban sound recognition, soundscape classification model, soundscape recognition, soundscape classification, urban emotion measurement, urban public space, soundscape assessment, urban soundscape evaluation, urban environment perception, urban segregation, urban landscape perception, comprehensive urban soundscape, residential urban environment, urban soundscapes, soundscape recognition aim, artificial urban modeling, historical urban landscape, streetscape perception, urban soundscape mapping, Urban morphological feature, Urban multisensory laboratory, Transit urban design, Public transportation accessibility, artificial urban environment, urban perception datasets, soundscape mapping, residential segregation, urban vitality feature, urban valuation, generative urban network, crowdsourced street view, Urban multisensory, proposed urban modeling, visible street greenery, urban morphology contributes, urban greenery, urban street vitality, urban space quality, urban modeling technique, pedestrian accessibility level, accessed street greenery, emotional computing technics, urban perception assessment, urban soundscape, soundscapes, City safety perception, sound recognition, Urban emotion, urban modeling, urban sensory lab, multidimensional livability, Ethnoracial residential segregation, Pedestrian accessibility, urban sensory, soundscape, audio descriptor, conventional urban data, land use mapping, urban morphology, emotion information, future soundscape mapping, urban visual experience, urban scene quality, automatic sound recognizer, street greenery, Automatic sound recognition, urban analysis, transportation accessibility, greenway planning, spatial segregation, land use information, emotional computing concept, livability management, urban analytics, multidimensional livability index, sound recognition task, landscape design, landscape architecture system, urban modelling, urban street landscape, human emotion, urban landscape, urban greening, optimized greenway suitability, urban greenway network, urban greening policy, landscape architecture, livability index, street image evaluation, city safety, Urban land use, emotion measurement, pedestrian landscape, streetscape view, auditory perception map, streetscape improvement, urban data source, urban policy, pedestrian environment, urban scene data, Land use map, urban planning, greenway suitability analysis, streetscape view index, Street design, street walkability, geospatial data, urban infrastructure, urbanising city, people safety perception, urban environment, mediatized urban heritage, geospatial data collection, reduced residential segregation, urban perception derivation, street view pattern, landscape architecture art, emotion measurement tool, city planning, perceived walkability, good pedestrian landscape, city appearance, auditory perception, Street View imagery, global urban data, urban amenity, Urban land, urban perception, safety perception model, urban infrastructure investment, Safety perception measurement, urban identity, auditory data, street quality, city life, Urban form, urban design quality, complex urban feature, new urban pattern, urban design dimension, urban pattern, urban space, urban heritage, urban community life, urban design theory, city modelling, participatory planning, environment perception, local urban perception, livability, urban habitat, street space image, segregation, urban plan, streetscapes, public transit ridership, Urban data, urban research method, urban community, garden landscape, participatory planning process, complex urban environment, walkability, crowdsourced street, transit ridership, city image, urban design, urban data framework, auditory landscape, pedestrian space, perception map, urban planning policy, urban sociology, Safe city, urban research, street imagery data, streetscape, street imagery, city planning process, urban scene, street image, inclusive planning, intricate urban matrix, street space, urbanity, satellite image, street accessibility, urban area, established urban research, urban location, urban feature, human perception, large street imagery, street view, street view image, streetlife intensity, new urban data, experienced urban designer, urban context, city planning professional, urban public life, different urban location, urban planning practice, open urban area, architectural beauty, heterogeneous perception, safety perception, public space, spatial data, street, subjective perception, city census, landscape, city, urban design strategy, perception, city census information, perceptual variable",5.0,"gaze analysis system, Visual gaze analysis, gaze analysis, gaze vector, Visual gaze",,,,,,,,,,,,,,,,,,,,,,,,,,,,,,,,,,,,,,
#6,None,6,0.0,3,80,"gaze analysis system, architectural color icon, Visual gaze analysis, gaze analysis, autoencoders, architectural color, multidimensional livability index, convolutional variational autoencoders, Spatial network, livability index, deep convolutional network, common wild bee, people safety perception, gaze vector, building reconstruction, safety perception model, Holistic visual data, Safety perception measurement, visual quality, perceived visual quality, tree planting policy, property assessment, land value, color icon creation, Visual Exploration, cluster dynamic analysis, visual analytics, multisensory laboratory, place sentiment, tree location data, sociodemographics, spatial evaluation, habitat selection, tree planting, immigrant assimilation, tree placement, solitary bee, bee, deep learning model, predicted ridership, cultural ecosystem service, morphological feature, crowdsourcing game, environmental evaluation, cultural ecosystem, nature photograph, visual image interpretation, quantitative morphological description, visitor experience, ecosystem service assessment, historical preservation, Random Forest model, environmental sensor, Digital excavation, life circle planning, color icon, interactive visual analytics, elevation data, tree location, social medium photograph, human physiological change, height data, safety perception, semantic information, location selection, big data, height prediction, signal processing, novel semantic model, activity space estimation, transit node, classification, assimilation, sentiment, level semantic information, historical site, tourism, public place, Shanghai city, data",225.0,"urban sound recognition, soundscape classification model, soundscape recognition, soundscape classification, urban emotion measurement, urban public space, soundscape assessment, urban soundscape evaluation, urban environment perception, urban segregation, urban landscape perception, comprehensive urban soundscape, residential urban environment, urban soundscapes, soundscape recognition aim, artificial urban modeling, historical urban landscape, streetscape perception, urban soundscape mapping, Urban morphological feature, Urban multisensory laboratory, Transit urban design, Public transportation accessibility, artificial urban environment, urban perception datasets, soundscape mapping, residential segregation, urban valuation estimation, urban vitality feature, urban valuation, generative urban network, crowdsourced street view, Urban multisensory, proposed urban modeling, visible street greenery, urban morphology contributes, urban greenery, urban street vitality, urban space quality, urban modeling technique, pedestrian accessibility level, accessed street greenery, emotional computing technics, urban perception assessment, urban soundscape, soundscapes, City safety perception, sound recognition, Urban emotion, urban modeling, urban sensory lab, multidimensional livability, Ethnoracial residential segregation, Pedestrian accessibility, urban sensory, soundscape, audio descriptor, conventional urban data, land use mapping, urban morphology, emotion information, future soundscape mapping, urban visual experience, urban scene quality, automatic sound recognizer, street greenery, Automatic sound recognition, urban analysis, transportation accessibility, greenway planning, spatial segregation, land use information, emotional computing concept, livability management, urban analytics, sound recognition task, landscape design, landscape architecture system, urban modelling, urban street landscape, emotional computing, human emotion, urban landscape, urban greening, optimized greenway suitability, urban greenway network, urban greening policy, landscape architecture, street image evaluation, city safety, Urban land use, emotion measurement, pedestrian landscape, streetscape view, auditory perception map, streetscape improvement, urban data source, urban policy, pedestrian environment, urban scene data, Land use map, urban planning, greenway suitability analysis, streetscape view index, Street design, street walkability, geospatial data, urban infrastructure, urbanising city, urban environment, mediatized urban heritage, geospatial data collection, reduced residential segregation, urban perception derivation, street view pattern, landscape architecture art, emotion measurement tool, city planning, perceived walkability, good pedestrian landscape, city appearance, auditory perception, Street View imagery, global urban data, urban amenity, Urban land, urban perception, urban infrastructure investment, urban identity, city safety security, auditory data, street quality, city life, Urban form, Visual gaze, urban design quality, complex urban feature, new urban pattern, urban design dimension, urban pattern, human emotion recognition, urban space, urban heritage, urban community life, urban design theory, city modelling, participatory planning, environment perception, local urban perception, livability, urban habitat, street space image, segregation, urban plan, streetscapes, public transit ridership, Urban data, urban research method, urban community, garden landscape, participatory planning process, complex urban environment, walkability, crowdsourced street, transit ridership, public transportation demand, city image, urban design, urban data framework, auditory landscape, pedestrian space, perception map, urban planning policy, urban sociology, Safe city, urban research, Sonic environment, Towards sustainable transit, street imagery data, streetscape, street imagery, city planning process, urban scene, street image, inclusive planning, intricate urban matrix, street space, urbanity, satellite image, street accessibility, street renewal, urban area, established urban research, urban location, urban feature, human perception, efficient street renewal, large street imagery, street view, street view image, streetlife intensity, new urban data, mapping, experienced urban designer, urban context, city planning professional, urban public life, different urban location, urban planning practice, public space management, open urban area, architectural beauty, heterogeneous perception, google map, public space, spatial data, street, subjective perception, city census, landscape, city, urban design strategy, perception, city census information, perceptual variable",10.0,"deep learning, decision tree, machine learning model, machine learning, image recognition, feature selection, machine learning technique, machine learning method, Feature extraction, clustering",,,,,,,,,,,,,,,,,,,,,,,,,,,,,,,,,,,,,,,,
#6,None,7,0.0,3,263,"urban sound recognition, soundscape classification model, urban emotion measurement, urban public space, urban segregation, residential urban environment, soundscape recognition aim, historical urban landscape, Urban morphological feature, Urban multisensory laboratory, Transit urban design, Public transportation accessibility, artificial urban environment, urban perception datasets, residential segregation, urban valuation estimation, urban vitality feature, urban valuation, generative urban network, crowdsourced street view, Urban multisensory, visible street greenery, urban morphology contributes, urban greenery, urban street vitality, urban space quality, pedestrian accessibility level, gaze analysis system, architectural color icon, accessed street greenery, Visual gaze analysis, emotional computing technics, City safety perception, sound recognition, Urban emotion, urban sensory lab, multidimensional livability, Ethnoracial residential segregation, Pedestrian accessibility, urban sensory, gaze analysis, autoencoders, audio descriptor, conventional urban data, land use mapping, urban morphology, emotion information, future soundscape mapping, urban visual experience, urban scene quality, automatic sound recognizer, street greenery, Automatic sound recognition, architectural color, transportation accessibility, greenway planning, spatial segregation, land use information, emotional computing concept, livability management, urban analytics, multidimensional livability index, sound recognition task, landscape design, landscape architecture system, emotional computing, human emotion, urban greening, convolutional variational autoencoders, optimized greenway suitability, urban greenway network, urban greening policy, Spatial network, livability index, street image evaluation, city safety, Urban land use, emotion measurement, pedestrian landscape, auditory perception map, deep convolutional network, streetscape improvement, urban data source, urban policy, pedestrian environment, urban scene data, Land use map, greenway suitability analysis, streetscape view index, Street design, street walkability, common wild bee, geospatial data, urban infrastructure, urbanising city, people safety perception, mediatized urban heritage, geospatial data collection, reduced residential segregation, urban perception derivation, gaze vector, street view pattern, landscape architecture art, emotion measurement tool, perceived walkability, building reconstruction, good pedestrian landscape, city appearance, auditory perception, global urban data, safety perception model, Holistic visual data, urban infrastructure investment, Safety perception measurement, urban identity, city safety security, auditory data, street quality, city life, Urban form, Visual gaze, urban design quality, complex urban feature, new urban pattern, urban design dimension, visual quality, perceived visual quality, human emotion recognition, urban heritage, urban community life, tree planting policy, property assessment, land value, urban design theory, participatory planning, environment perception, color icon creation, livability, urban habitat, Visual Exploration, segregation, cluster dynamic analysis, public transit ridership, visual analytics, urban research method, multisensory laboratory, urban community, garden landscape, place sentiment, participatory planning process, walkability, crowdsourced street, transit ridership, public transportation demand, city image, tree location data, urban data framework, auditory landscape, pedestrian space, perception map, sociodemographics, urban sociology, Safe city, spatial evaluation, habitat selection, tree planting, urban research, Sonic environment, immigrant assimilation, tree placement, solitary bee, Towards sustainable transit, street imagery data, streetscape, bee, deep learning model, predicted ridership, cultural ecosystem service, morphological feature, crowdsourcing game, deep learning, environmental evaluation, urban scene, cultural ecosystem, inclusive planning, nature photograph, intricate urban matrix, street space, decision tree, satellite image, street accessibility, visual image interpretation, quantitative morphological description, street renewal, visitor experience, ecosystem service assessment, established urban research, urban location, historical preservation, urban feature, Random Forest model, human perception, efficient street renewal, environmental sensor, large street imagery, Digital excavation, streetlife intensity, life circle planning, new urban data, mapping, color icon, experienced urban designer, urban context, city planning professional, interactive visual analytics, urban public life, elevation data, tree location, different urban location, social medium photograph, machine learning model, public space management, human physiological change, height data, architectural beauty, machine learning, heterogeneous perception, safety perception, google map, semantic information, public space, location selection, spatial data, big data, image recognition, height prediction, signal processing, feature selection, novel semantic model, activity space estimation, street, subjective perception, transit node, classification, city census, landscape, city, urban design strategy, assimilation, sentiment, level semantic information, machine learning technique, machine learning method, historical site, tourism, Feature extraction, perception, city census information, perceptual variable, public place, Shanghai city, clustering, data",41.0,"urban environment perception, urban landscape perception, artificial urban modeling, streetscape perception, proposed urban modeling, urban modeling technique, urban perception assessment, urban modeling, urban analysis, urban modelling, urban street landscape, urban landscape, landscape architecture, streetscape view, urban planning, urban environment, city planning, Street View imagery, urban amenity, Urban land, urban perception, urban pattern, urban space, city modelling, local urban perception, street space image, urban plan, streetscapes, Urban data, complex urban environment, urban design, urban planning policy, street imagery, city planning process, street image, urbanity, urban area, street view, street view image, urban planning practice, open urban area",11.0,"soundscape recognition, soundscape classification, soundscape assessment, urban soundscape evaluation, comprehensive urban soundscape, urban soundscapes, urban soundscape mapping, soundscape mapping, urban soundscape, soundscapes, soundscape",,,,,,,,,,,,,,,,,,,,,,,,,,,,,,,,,,,,,,,,
