group,count,key-phrase
-1,83,"optimal police, restaurant data, urban traffic gravity, implicit geographic movement, trajectory segmentation, traffic incident analysis, police strategy, population map, community detection algorithm, retail store placement, traffic gravity model, social medium data, Graph input representation, city image dimension, foursquare, leisure ontology, logistics service network, activity prediction, commute, Foursquare place category, traffic crash location, census feature, itinerary request dataset, redevelopment, timely socioeconomic data, safer parking, building information, driver survey data, leisure activity potential, community detection, socioeconomic indicator, logistics service, socioeconomic status, district discovery framework, Twitter interaction, dimensionality reduction, route recommendation, Yelp hierarchical dataset, principal component analysis, urban ground sensing, bike flow, available crowdsensed datasets, neighborhood scale, citation network, topological connectivity, mobile crowdsensing, popular place, latent semantic relationship, store placement, word embedding, word embeddings, geolocated dataset, corpus training, learned embeddings, natural language processing, animal migration, embeddings, collaborative heterogeneous information, crowdsensing, store placement problem, prospective retail store, placement recommendation, region extraction, flow prediction, thematic analytics framework, Twitter, social activity, contextual information, social recommendation, interface network consist, similarity computation, several subject area, corporate network, chain store, urban stakeholder, new store, smart meter, recommendation, learning model, workshop, overview, conjunction, paper"
0,5,"graph machine learning, Graph convolutional network, graph convolution network, graph attention network, graph machine"
1,5,"tensor factorization, matrix tensor factorization, nonnegative matrix factorization, matrix factorization, joint matrix factorization"
2,8,"topic modeling, latent Dirichlet allocation, topic modeling extraction, topic identification, Dirichlet allocation, probabilistic topic, probabilistic topic model, topic probability"
3,243,"Data mining tourism, Spatial crime simulation, human mobility analysis, mobility data mining, crime prediction, business zone recommender, urban data exploration, human mobility prediction, human mobility data, crime simulation, Urban computing, crime simulation contribute, urban activity inference, Traditional crime prediction, crime prediction model, location semantic predicting, crime security game, Urban placeness, urban location annotation, urban mobility structure, geographical cluster, impact pedestrian activity, mobility prediction model, Urban human mobility, zone recommender system, massive urban data, mobility prediction, location annotation, transit mobility structure, mobility data, opportunistic crime security, Human mobility pattern, meaningful transit mobility, mobility data set, Extracting leisure activity, Inferring urban performance, urban network analysis, spatiotemporal pattern mining, smart city, mobility pattern discovery, zone recommender, big transit data, local pedestrian activity, zone recommendation system, city region partitioning, human urban behavior, travel behavior interpretation, urban health, transit mobility pattern, geovisual analytics, street functionality prediction, massive urban datasets, influence pedestrian activity, Geographical measure, pedestrian behavior modeling, land use detection, mining tourism pattern, urban space, urban walkability, mobility analysis, urban mobility, Semantic location, Automated urban travel, street functionality classification, tourism pattern, crime pattern, modern smart city, human mobility, transit network data, Spatial crime, urban datasets, discrete urban space, various urban feature, public transportation data, urban design, urban morphology, urban network path, placeness, bike trajectory data, massive spatiotemporal data, city region partition, urban land use, urban travel interpretation, urban redevelopment, urban environment, urban human activity, mobile phone activity, urban street functionality, street context distribution, urban planning, travel activity pattern, urban leisure, Twitter data, geographic knowledge graph, Semantic location name, understanding urban space, individual travel behavior, geographic information retrieval, commercial district discovery, urban science, urban system, heterogeneous urban data, many urban planning, urban functional region, intercity corporate network, travel pattern, taxi journey dataset, transit mobility, geographic movement, travel mode choice, local urban context, city spatiotemporal pattern, clustering process, urban behavior, clustering, travel mode detection, urban crime, city image, location category, urban population distribution, urban street network, urban study, socioeconomic data, specific urban activity, street context type, transportation data, unsupervised commercial district, crime data, spatiotemporal data, urban location, urban data analysis, distinctive activity pattern, transportation information, urban land, random forest, distinguish geographical proximity, city experience, big data, urban activity, urban data, big data mining, urban region, Support vector machine, urban population, urban functional zoning, urban science framework, text mining, urban place detection, travel behavior, business zone, clustering result, intercity network, mobile phone trajectory, geographic knowledge, crowdsensed datasets, urban neighborhood, Support vector, phone activity, urban function, GPS trajectory data, city branding, geographic contextual information, urban place, modern city, place detection, location data, semantic proximity, thematic analytics, city region, visual analytics, different street context, geospatial information, urban network, bike flow pattern, neighborhood level, tourism research, data exploration, flow pattern discovery, land use algorithm, public transport commuter, network analysis, mobile phone dataset, land use classification, trajectory data, hierarchical clustering, neighborhood disorder, urban road, bike activity, accessible urban data, geographic context problem, transport commuter, phone data, urban infrastructure, geodemographic classification, various urban task, mobility pattern, travel type, mobile phone data, geotagging, geographical space, transportation, land use type, spatial clustering, travel mode, mobility information, smart city field, network big data, complex network analysis, decision tree, complex network, geographic context, data mining technology, connectivity cluster, place, locational model, machine learning algorithm, urban planner, geographical proximity, transportation system, social network, traffic data, Travel mode likelihood, city, geography, taxi trajectory, network model, population movement pattern, urban decision, taxicab platform, social medium, urban area, data, mobility flow, trajectory, traffic, intelligent taxi, city level, data mining technique, data mining, geospatial feature, machine learning, metropolitan area, urban setting"
4,5,"predictive feature, predictive model, prediction challenging, prediction, prediction capability"
