Cluster,DocId,Cited by,Title,Author Keywords,Abstract,Year,Source title,Authors,DOI,Document Type,x,y
4,71,,"Evaluation of the environmental impacts of urbanization from the viewpoint of increased skin temperatures: a case study from Istanbul, Turkey",Istanbul; LST; Random Forest; Urban development; Urban heat island,"Urbanization is an inevitable process all around the world especially in developing countries like Turkey. Istanbul has been experiencing rapid urban expansion for the past 60 years. This urban expansion is leading to the replacement of forests by various artificial surfaces. This situation has a critical impact on the natural surfaces due to the alteration of heat energy balance. In this study, the authors tried to investigate the extent of urbanization of Istanbul within the past decades to unearth its impacts on the urban heat island (UHI) severity and the level of its ecological consequences in terms of decreased thermal comfort. To this end, land use/cover (LULC) and land surface temperature (LST) maps were generated using Landsat imageries based on random forest (RF) classifier (as a machine learning tool) and radiometric image processing algorithms, respectively, for four different dates from 1989 to 2019. The statistical and spectral indicators were calculated for the study area to evaluate the association between urban development and UHI. Results indicate that Istanbul has suffered a continuous land transformation from forest to urban and croplands so that the area of forest has diminished by 373.3 km2, and the artificial surfaces have increased by 260 km2. Skin temperatures over all the LULC classes show an increase during the study period with the highest values estimated over artificial surfaces. The statistical analysis of urbanization indicators (ULI, PD, UGSI, NDVI, and NDBI) and UHI indicator (UTFVI) resulted in good correlation coefficients with the best agreement found between NDBI and UTFVI which stresses the strong link between the expansion of built-up areas as a result of urbanization and the severity of UHI and its ecological impacts in Istanbul. Thus, it is a must for policy-makers and officials of the city to take accurate measures regarding the urban planning to mitigate the harsh environmental impacts of growing urbanization of Istanbul in upcoming years. © 2021, Società Italiana di Fotogrammetria e Topografia (SIFET).",2021,Applied Geomatics,"Khorrami B., Heidarlou H.B., Feizizadeh B.",10.1007/s12518-020-00350-3,Article,5.1210231781,6.2203783989
4,75,,Ai augmented approach to identify shared ideas from large format public consultation,City; Data analysis; Natural language processing; Public participation; Urban planning,"Public data, contributed by citizens, stakeholders and other potentially affected parties, are becoming increasingly used to collect the shared ideas of a wider community. Having collected large quantities of text data from public consultation, the challenge is often how to interpret the dataset without resorting to lengthy time-consuming manual analysis. One approach gaining ground is the use of Natural Language Processing (NLP) technologies. Based on machine learning technology applied to analysis of human natural languages, NLP provides the opportunity to automate data analysis for large volumes of texts at a scale that would be virtually impossible to analyse manually. Using NLP toolkits, this paper presents a novel approach for identifying and visualising shared ideas from large format public consultation. The approach analyses grammatical structures of public texts to discover shared ideas from sentences comprising subject + verb + object and verb + object that express public options. In particular, the shared ideas are identified by extracting noun, verb, adjective phrases and clauses from subjects and objects, which are then categorised by urban infrastructure categories and terms. The results are visualised in a hierarchy chart and a word tree using cascade and tree views. The approach is illustrated using data collected from a public consultation exercise called “Share an Idea” undertaken in Christchurch, New Zealand, after the 2011 earthquake. The approach has the potential to upscale public participation to identify shared design values and associated qualities for a wide range of public initiatives including urban planning. © 2021 by the authors. Licensee MDPI, Basel, Switzerland.",2021,Sustainability (Switzerland),"Weng M.-H., Wu S., Dyer M.",10.3390/su13169310,Article,4.9755988121,6.1593332291
4,76,11.0,IoT for smart cities: Machine learning approaches in smart healthcare—A review,Artificial intelligence; Healthcare; IoT; Machine learning; Sensor networks; Smart cities,"Smart city is a collective term for technologies and concepts that are directed toward making cities efficient, technologically more advanced, greener and more socially inclusive. These concepts include technical, economic and social innovations. This term has been tossed around by various actors in politics, business, administration and urban planning since the 2000s to establish tech-based changes and innovations in urban areas. The idea of the smart city is used in conjunction with the utilization of digital technologies and at the same time represents a reaction to the economic, social and political challenges that post-industrial societies are confronted with at the start of the new millennium. The key focus is on dealing with challenges faced by urban society, such as environ-mental pollution, demographic change, population growth, healthcare, the financial crisis or scarcity of resources. In a broader sense, the term also includes non-technical innovations that make urban life more sustainable. So far, the idea of using IoT-based sensor networks for healthcare applications is a promising one with the potential of minimizing inefficiencies in the existing infrastructure. A machine learning approach is key to successful implementation of the IoT-powered wireless sensor networks for this purpose since there is large amount of data to be handled intelligently. Throughout this paper, it will be discussed in detail how AI-powered IoT and WSNs are applied in the healthcare sector. This research will be a baseline study for understanding the role of the IoT in smart cities, in particular in the healthcare sector, for future research works. © 2021 by the authors. Licensee MDPI, Basel, Switzerland.",2021,Future Internet,"Ghazal T.M., Hasan M.K., Alshurideh M.T., Alzoubi H.M., Ahmad M., Akbar S.S., Al Kurdi B., Akour I.A.",10.3390/fi13080218,Review,4.8804111481,6.3538217545
4,78,3.0,Mapping essential urban land use categories with open big data: Results for five metropolitan areas in the United States of America,Block-level mapping; Ensemble learning; Geospatial big data; Land use classification; NAIP; Sentinel-1/2,"Urban land-use maps outlining the distribution, pattern, and composition of various land use types are critically important for urban planning, environmental management, disaster control, health protection, and biodiversity conservation. Recent advances in remote sensing and social sensing data and methods have shown great potentials in mapping urban land use categories, but they are still constrained by mixed land uses, limited predictors, non-localized models, and often relatively low accuracies. To inform these issues, we proposed a robust and cost-effective framework for mapping urban land use categories using openly available multi-source geospatial “big data”. With street blocks generated from OpenStreetMap (OSM) data as the minimum classification unit, we integrated an expansive set of multi-scale spatially explicit information on land surface, vertical height, socio-economic attributes, social media, demography, and topography. We further proposed to apply the automatic ensemble learning that leverages a bunch of machine learning algorithms in deriving optimal urban land use classification maps. Results of block-level urban land use classification in five metropolitan areas of the United States found the overall accuracies of major-class (Level-I) and minor-class (Level-II) classification could be high as 91% and 86%, respectively. A multi-model comparison revealed that for urban land use classification with high-dimensional features, the multi-layer stacking ensemble models achieved better performance than base models such as random forest, extremely randomized trees, LightGBM, CatBoost, and neural networks. We found without very-high-resolution National Agriculture Imagery Program imagery, the classification results derived from Sentinel-1, Sentinel-2, and other open big data based features could achieve plausible overall accuracies of Level-I and Level-II classification at 88% and 81%, respectively. We also found that model transferability depended highly on the heterogeneity in characteristics of different regions. The methods and findings in this study systematically elucidate the role of data sources, classification methods, and feature transferability in block-level land use classifications, which have important implications for mapping multi-scale essential urban land use categories. © 2021 International Society for Photogrammetry and Remote Sensing, Inc. (ISPRS)",2021,ISPRS Journal of Photogrammetry and Remote Sensing,"Chen B., Tu Y., Song Y., Theobald D.M., Zhang T., Ren Z., Li X., Yang J., Wang J., Wang X., Gong P., Bai Y., Xu B.",10.1016/j.isprsjprs.2021.06.010,Article,5.0820560455,6.4494166374
4,80,7.0,Effective task scheduling algorithm with deep learning for Internet of Health Things (IoHT) in sustainable smart cities,Deep learning; Fog computing; Health data analysis; Internet of Health Thing (IoHT); Sustainable; Task scheduling,"In the recent years, important key factor for urban planning is to analyze the sustainability and its functionality towards smart cities. Presently, many researchers employ the conservative machine learning based analysis but those are not appropriate for IoT based health data analysis because of their physical feature extraction and low accuracy. In this paper, we propose remote health monitoring and data analysis by integrating IoT and deep learning concepts. We proposed novel IoT based FoG assisted cloud network architecture that accumulates real-time health care data from patients via several medical IoT sensor networks, these data are analyzed using a deep learning algorithm deployed at Fog based Healthcare Platform. Furthermore, the proposed methodology is applied to the sustainable smart cities to evaluate the process for real-time. The proposed framework not only analyses the healthcare data but also provides immediate relief measures to the patient facing critical conditions and needs immediate consultancy of doctor. Performance is measure in terms of accuracy, precision and sensitivity of the proposed DHNN with task scheduling algorithm and it is obtained 97.6%, 97.9%, and 94.9%. While accuracy, precision and sensitivity for deep CNN is 96.5%, 97.5% and 94% and for Deep auto-encoder is 92%, 91%, and 82.5%. © 2021 Elsevier Ltd",2021,Sustainable Cities and Society,"Nagarajan S.M., Deverajan G.G., Chatterjee P., Alnumay W., Ghosh U.",10.1016/j.scs.2021.102945,Article,4.9747099876,6.4290418625
4,81,5.0,"GIS-based comparative study of Bayes network, Hoeffding tree and logistic model tree for landslide susceptibility modeling",Frequency Ratio; Landslide susceptibility assessment; Machine learning; Muchuan County,"Landslides, one of the most common hazards around the world, have brought about severe damage to life and property of human. To prevent and mitigate landslides, various models have been introduced to assess landslide susceptibility. In this paper, Hoeffding Tree (HT), a prevailing data stream mining algorithm, was employed to predict landslide susceptibility in Muchuan County, China for the first time. Meanwhile, Logistic Model Tree (LMT) and Bayes Network (BN) were applied to produce landslide susceptibility maps for comparison. The model performances were evaluated by Receiver Operating Characteristic (ROC) curves and areas under the curves (AUC). To obtain landslide inventory map, 279 landslides data was collected, and training and validation datasets were randomly divided with a proportion of 70% to 30%. Furthermore, twelve conditioning factors (altitude, slope angle, profile curvature, plan curvature, slope aspect, distance to roads, distance to rivers, TWI, NDVI, soil, land use and lithology) were selected to construct landslide susceptibility models. Moreover, correlations between conditioning factors and landslides were analyzed using Frequency Ratio (FR). The results showed landslides are prone to occur in areas where human activities concentrate, and all three models exhibited satisfying performances. Concretely, for training dataset, LMT model showed the highest AUC (0.854), followed by HT (0.726) and BN (0.709). However, for validation dataset, LMT and BN models generated similar AUC values (0.761 and 0.764 respectively), and the highest AUC value belonged to HT (0.802). The distributions of landslide susceptibility zones revealed that the interior of county town is mainly seated in low and very low susceptibility zones, whereas regions close to the border suffer high and very high landslide risk. The results acquired in this paper are significant to landslide prevention and urban planning in Muchuan, China. Additionally, this study proved that HT model is a promising classifier for landslide susceptibility modeling. © 2021 Elsevier B.V.",2021,Catena,"Chen W., Zhang S.",10.1016/j.catena.2021.105344,Article,5.3988389969,6.4485816956
4,83,,A Novel Methodology for Automating Spatio-Temporal Data Classification in Basketball Using Active Learning,Active Learning; Basketball; Machine Learning; Spatio-temporal Data,"The use of machine learning on spatio-temporal datasets has generated significant interest in a range of applications, including vehicular traffic modelling and urban planning. One of the most prolific application domains is sports analytics due to the availability of real-world multi-agent datasets, where such techniques are used to recognize and predict offensive and defensive strategies in a range of team sports. However, the use of advanced machine learning techniques requires the large datasets to be annotated by domain experts, which is a time-consuming task. Active learning is a methodology that significantly cuts down the data-annotation time on large datasets. In this paper, we investigate active learning strategies to annotate spatio-temporal datasets for the purpose of classification model building. The proposed algorithms are demonstrated on a dataset obtained from professional basketball games to classify an offensive strategy known as 'Pick-and-Roll'. Several neural network architectures are investigated for the classification of more than 900 segments of basketball plays. The results obtained suggest that the proposed, preferred, methodology is well suited for annotating large spatio-temporal datasets and has the potential to be applicable across a range of team sports and non-sports usage scenarios. © 2021 IEEE.",2021,"2021 IEEE 2nd International Conference on Pattern Recognition and Machine Learning, PRML 2021","Ai S., Na J., Silva V.D., Caine M.",10.1109/PRML52754.2021.9520715,Conference Paper,4.9858183861,6.2619748116
4,84,,Urban trip generation forecasting based on gradient boosting algorithm,Four-step model; Gradient boosting decision tree; Linear regression; Trip generation,"The four-step transportation model plays an important role in urban planning. The quality of the first phase, i.e. trip generation, determines the performance of the global course. The majority of trip generation forecasting models highly rely on mathematical derivation and have many predictor variables during the prediction, which leads to low accuracy of results and requires laboriously hand-crafted design of input vectors. This paper is the first to introduce the gradient boosting decision tree (GBDT) algorithm for trip generation prediction, and harmonizes such a powerful machine learning method with traditional urban planning requirements to achieve better prediction performance. Unlike the commonly used linear regression method, GBDT can automatically perform feature selection and model the non-linear relationships between input and output variables. Experimental results on real-world residential travel census in Beijing prove that the GBDT model significantly outperforms the baseline and can forecast the trip generation more accurately. © 2021 IEEE.",2021,"Proceedings 2021 IEEE 1st International Conference on Digital Twins and Parallel Intelligence, DTPI 2021","Li Z., Xiong G., Zhang Y., Zheng M., Dong X., Lv Y.",10.1109/DTPI52967.2021.9540082,Conference Paper,5.0954480171,6.4758620262
4,86,,"Panoramic street-level imagery in data-driven urban research: A comprehensive global review of applications, techniques, and practical considerations",Baidu; Computer vision; Google Street View; Panoramic; Street View; Street-level; Tencent; Urban data; Virtual audit; Visual analytics,"The release of Google Street View in 2007 inspired several new panoramic street-level imagery platforms including Apple Look Around, Bing StreetSide, Baidu Total View, Tencent Street View, Naver Street View, and Yandex Panorama. The ever-increasing global capture of cities in 360◦ provides considerable new opportunities for data-driven urban research. This paper provides the first comprehensive, state-of-the-art review on the use of street-level imagery for urban analysis in five research areas: built environment and land use; health and wellbeing; natural environment; urban modelling and demographic surveillance; and area quality and reputation. Panoramic street-level imagery provides advantages in comparison to remotely sensed imagery and conventional urban data sources, whether manual, automated, or machine learning data extraction techniques are applied. Key advantages include low-cost, rapid, high-resolution, and wide-scale data capture, enhanced safety through remote presence, and a unique pedestrian/vehicle point of view for analyzing cities at the scale and perspective in which they are experienced. However, several limitations are evident, including limited ability to capture attribute information, unreliability for temporal analyses, limited use for depth and distance analyses, and the role of corporations as image-data gatekeepers. Findings provide detailed insight for those interested in using panoramic street-level imagery for urban research. © 2021 by the authors. Licensee MDPI, Basel, Switzerland.",2021,ISPRS International Journal of Geo-Information,"Cinnamon J., Jahiu L.",10.3390/ijgi10070471,Review,4.9043531418,6.2566814423
4,91,,Sustainable development scale of housing estates: An economic assessment using machine learning approach,density; housing; machine learning; threshold; urban planning,"Economic sustainability is often addressed from the perspective of economic growth and at the national level. In contrast, this research attempts to examine the question of economic sustainability of human settlement at a local project level. Urban planners need to strike a balance between dispersal and over-concentration of population in cities. The existing theories suggest that either excessively low or extremely high levels of household concentration is undesirable to a neighborhood. In this study, an economic assessment using machine learning (ML) techniques is used to identify the threshold scale of a housing estate, which comprises many privately owned residential units (like condos) with shared amenities. Using two decades of property transaction data in Hong Kong as our evidence, this study has found that a tipping point exists in the development scale of these housing estates. Housing values initially rise with the number of residential units in a housing estate but gradually fall when it increases beyond a critical limit. This nonlinear economic relationship is attributed to the per household share of common facilities, which does not increase sufficiently to match with the growing population density of the housing estates. The policy implication is that, to optimize housing supply, urban planning should not just focus on increasing the development bulk of housing but should also pay attention to the possible bottlenecks in the provision of shared amenities in the neighborhood. © 2021 ERP Environment and John Wiley & Sons Ltd.",2021,Sustainable Development,"Tang B.-S., Ho W.K.O., Wong S.W.",10.1002/sd.2168,Article,5.0760655403,6.2218308449
4,97,,MetaStore: A task-adaptative meta-learning model for optimal store placement with multi-city knowledge transfer,Knowledge transfer; Machine learning; Meta-learning; Optimal store placement; Urban computing,"Optimal store placement aims to identify the optimal location for a new brick-and-mortar store that can maximize its sale by analyzing and mining users' preferences from large-scale urban data. In recent years, the expansion of chain enterprises in new cities brings some challenges because of two aspects: (1) data scarcity in new cities, so most existing models tend to not work (i.e., overfitting), because the superior performance of these works is conditioned on large-scale training samples; (2) data distribution discrepancy among different cities, so knowledge learned from other cities cannot be utilized directly in new cities. In this article, we propose a task-adaptative model-agnostic meta-learning framework, namely, MetaStore, to tackle these two challenges and improve the prediction performance in new cities with insufficient data for optimal store placement, by transferring prior knowledge learned from multiple data-rich cities. Specifically, we develop a task-adaptative meta-learning algorithm to learn city-specific prior initializations from multiple cities, which is capable of handling the multimodal data distribution and accelerating the adaptation in new cities compared to other methods. In addition, we design an effective learning strategy for MetaStore to promote faster convergence and optimization by sampling high-quality data for each training batch in view of noisy data in practical applications. The extensive experimental results demonstrate that our proposed method leads to state-of-the-art performance compared with various baselines. © 2021 Association for Computing Machinery.",2021,ACM Transactions on Intelligent Systems and Technology,"Liu Y., Guo B., Zhang D., Zeghlache D., Chen J., Zhang S., Zhou D., Shi X., Yu Z.",10.1145/3447271,Article,5.0047740936,6.4172201157
