Cluster,DocId,Cited by,Title,Author Keywords,Abstract,Year,Source title,Authors,DOI,Document Type,x,y
4,2,,"Subjective or objective measures of street environment, which are more effective in explaining housing prices?",Human Perception; Property value; Street design qualities; Street view imagery; Subjective measures,"Houses with better street design are found to relate to a price premium. Prior studies mainly present the street quality using objective indicators like tree counts and distance to parks with land use data, or most recently using the greenery view index extracted from street view imagery (SVI). We argue objective indicators cannot completely describe people's sense of a place, as perception is a highly subjective process. We hypothesize that subjective measures using visual surveys could capture more subtle human perceptions, thus providing stronger predictive power to housing prices. However, the role of subjectively measured street design qualities is less known due to the lack of large-scale perception data. To test our hypothesis, we first collected designers’ perceptions on five urban design qualities from pairwise SVIs rankings in Shanghai with an online visual survey. Unlike the mainstream of using generic image features, we followed urban design theory and used rule-based features, i.e., about thirty streetscape elements extracted from SVIs to train machine learning (ML) models to predict subjective perceptions. The predictive power of five qualities versus ten selected individual streetscapes on housing price were compared using the hedonic price model. Besides the standard ordinary least squares (OLS), spatial regression and geographical weighted regression (GWR) were also developed to account for the spatial dependence and heterogeneity effects. We found both subjectively measured design qualities and objective indicators outperformed housing structural attributes in explaining housing price. While the objective view indexes collectively explained more price variances, the five perceptions individually exhibited stronger strength. Third, less-studied perceptions like “human scale” showed stronger strength than commonly studied “safety” and “enclosure”. Fourth, less-studied view indexes like “person” and “fence” outperformed ubiquitous features like trees and buildings. Lastly, prior studies might have resulted in biased estimations due to ignoring the multicollinear issues between the sky, tree and building views. Our study addressed the effectiveness of incorporating subjective perceptions at a micro level to infer housing prices. correlations between subjective perceptions were strong while that of objective indicators were negligible, therefore subjective perceptions can complement the objective indicators. The findings provide important reference to decision makers when selecting street quality indicators to infer urban design, city planning and community and housing development plans. © 2022 Elsevier B.V.",2022,Landscape and Urban Planning,"Qiu W., Zhang Z., Liu X., Li W., Li X., Xu X., Huang X.",10.1016/j.landurbplan.2022.104358,Article,5.0234732628,6.3696346283
4,10,,Reconceptualizing urban heat island: Beyond the urban-rural dichotomy,Complex urban system; Environmental sustainability; Mitigation and adaptation; Networks; Urban heat island,"Past decades have seen drastically increasing research effort and progress on the study of the phenomenon of urban heat island (UHI). Despite its simplicity, this convenient concept has promoted significant advances in scientific research and policy making processes in the urban environmental community. Nevertheless, the oversimplification and inadequacy of the urban-rural dichotomy, inherited in the UHI concept, is increasingly manifest today in the continuously urbanized world. In this study, we conduct a holistic and in-depth survey of the inadequacy of the urban-rural dichotomy intrinsic to the definition of UHI, from theoretical, technical, and practical perspectives. In addition, in the light of recent research advances, we urge to radically reconceptualize UHI by proposing a novel paradigm by treating the total urban environment as a complex dynamic system. The new framework broadens the frontier of conventional urban environmental study by utilizing advanced techniques of complex systems and data sciences, including complex network theory, machine learning techniques, causal inference, etc. The reconceptualization of UHI is also expected to foster decision making and urban planning, and to avoid the one-sidedness of the singular and often too exclusive aim of heat mitigation. © 2021 Elsevier Ltd",2022,Sustainable Cities and Society,Wang Z.-H.,10.1016/j.scs.2021.103581,Review,5.0026631355,6.1771674156
4,11,,Urban Catchment-Scale Blue-Green-Gray Infrastructure Classification with Unmanned Aerial Vehicle Images and Machine Learning Algorithms,blue infrastructure; classification; green infrastructure; machine learning; unmanned aerial vehicle images,"Green infrastructure (GI), such as green roofs, is now widely used in sustainable urban development. An accurate mapping of GI is important to provide surface parameterization for model development. However, the accuracy and precision of mapping GI is still a challenge in identifying GI at the small catchment scale. We proposed a framework for blue-green-gray infrastructure classification using machine learning algorithms and unmanned aerial vehicle (UAV) images that contained digital surface model (DSM) information. We used the campus of the Southern University of Science and Technology in Shenzhen, China, as a study case for our classification method. The UAV was a DJI Phantom 4 Multispectral, which measures the blue, green, red, red-edge, and near-infrared bands and DSM information. Six machine learning algorithms, i.e., fuzzy classifier, k-nearest neighbor classifier, Bayes classifier, classification and regression tree, support vector machine (SVM), and random forest (RF), were used to classify blue (including water), green (including green roofs, grass, trees (shrubs), bare land), and gray (including buildings, roads) infrastructure. The highest kappa coefficient was observed for RF and the lowest was observed for SVM, with coefficients of 0.807 and 0.381, respectively. We optimized the sampling method based on a chessboard grid and got the optimal sampling interval of 11.6 m to increase the classification efficiency. We also analyzed the effects of weather conditions, seasons, and different image layers, and found that images in overcast days or winter days could improve the classification accuracy. In particular, the DSM layer was crucial for distinguishing green roofs and grass, and buildings and roads. Our study demonstrates the feasibility of using UAV images in urban blue-green-gray infrastructure classification, and our infrastructure classification framework based on machine learning algorithms is effective. Our results could provide the basis for the future urban stormwater management model development and aid sustainable urban planning. Copyright © 2022 Jia, Cui and Liu.",2022,Frontiers in Environmental Science,"Jia J., Cui W., Liu J.",10.3389/fenvs.2021.778598,Article,5.4300980568,6.1511502266
4,12,,Investigation of Airflow around Buildings using Large-Eddy Simulations for Unmanned Aircraft Systems Applications,,"The ever-increasing demand for Unmanned Aircraft Systems (UAS) has led to the desire for integrating them into spaces in close proximity of humans like dense urban spaces, a reality previously thought of as inconceivable. One of the main concerns to be addressed before its widespread adoption is safety, especially in areas of operation adjacent to structures like buildings. This work investigates the effect of building geometries on the flow field in a simplified urban setup consisting of an isolated building to predict their potential impacts on UAS operations. Unanticipated wind gusts or turbulent flow conditions prevalent around various structures constitute a significant challenge for UAS operations in urban environments. We use Large-Eddy Simulation to better understand the unsteady and highly coherent turbulent flow structures produced by buildings in neutral atmospheric boundary layer flow. Furthermore, we also demonstrate a non-intrusive machine learning methodology to predict flow fields to augment safe wind-aware navigation systems for Unmanned Aerial Vehicles as a first step towards safely integrating UAS into existing aerial infrastructure. © 2022, American Institute of Aeronautics and Astronautics Inc.. All rights reserved.",2022,"AIAA Science and Technology Forum and Exposition, AIAA SciTech Forum 2022","Landua T.R., Vuppala R.K.S.S., Kara K.",10.2514/6.2022-1688,Conference Paper,5.414958477,6.3152351379
4,14,,"A hybrid Daily PM2.5 concentration prediction model based on secondary decomposition algorithm, mode recombination technique and deep learning",Adaptive variational mode decomposition; Complete ensemble empirical mode decomposition with adaptive noise; Long short-term memory network; PM2.5 concentration prediction; Sample entropy,"Accurate and effective PM2.5 concentration prediction has important implications for public health and the ecological environment. To provide more accurate early warnings for haze prevention, urban planning, and people's travel planning, this paper proposes a new combined PM2.5 concentration prediction model. Firstly, the original sequence is decomposed by complete ensemble empirical mode decomposition with adaptive noise (CEEMDAN), followed by decomposition and reconstruction of the data by adaptive variational mode decomposition (AVMD) and sample entropy (SE), and then the reconstructed subseries are predicted by long and short-term memory networks (LSTM). The empirical analysis was carried out with three datasets from Beijing, Tianjin, and Baoding, and the following conclusions can be drawn: (1) The validity and robustness of the proposed model were verified, with R2 (0.982), RMSE (2.792), and MAPE (9.088%) being optimal in all comparison experiments. (2) The incorporation of secondary decomposition and pattern reorganization algorithms can effectively handle data with high volatility and non-linearity. (3) Compared with traditional machine learning models, the long and short-term memory network is more suitable for time series prediction. The model provides a novel and effective PM2.5 concentration prediction tool for the government and the public. © 2022, The Author(s), under exclusive licence to Springer-Verlag GmbH Germany, part of Springer Nature.",2022,Stochastic Environmental Research and Risk Assessment,"Sun W., Xu Z.",10.1007/s00477-021-02100-2,Article,5.0015206337,6.7183980942
4,15,,Automatic identification of addresses: A systematic literature review,Address geocoding; Address matching; Address parsing; Deep learning; Machine learning; Natural language processing,"Address matching continues to play a central role at various levels, through geocoding and data integration from different sources, with a view to promote activities such as urban planning, location-based services, and the construction of databases like those used in census operations. However, the task of address matching continues to face several challenges, such as non-standard or incomplete address records or addresses written in more complex languages. In order to better understand how current limitations can be overcome, this paper conducted a systematic literature review focused on automated approaches to address matching and their evolution across time. The Preferred Reporting Items for Systematic Reviews and Meta-Analyses (PRISMA) guidelines were followed, resulting in a final set of 41 papers published between 2002 and 2021, the great majority of which are after 2017, with Chinese authors leading the way. The main findings revealed a consistent move from more traditional approaches to deep learning methods based on semantics, encoder-decoder architectures, and attention mechanisms, as well as the very recent adoption of hybrid approaches making an increased use of spatial constraints and entities. The adoption of evolutionary-based approaches and privacy preserving methods stand as some of the research gaps to address in future studies. © 2021 by the authors. Licensee MDPI, Basel, Switzerland.",2022,ISPRS International Journal of Geo-Information,"Cruz P., Vanneschi L., Painho M., Rita P.",10.3390/ijgi11010011,Review,5.0684146881,6.0965156555
4,18,,Towards a Multi-agents Model for Automatic Big Data Processing to Support Urban Planning,Automation; Big data; Big data analytics; Decision-making; Machine learning; Multi-agent system; Smart data; Urban planning,"The objective of this paper was to propose a multi-agents model for automating big data processing, to improve the process of decision-making and urban planning. The huge amounts of collected data from different domains, such as urban management and remote sensing, are characterized as big data with a spatial component. Smart data is the approach to deal with big data characteristics and challenges by focusing on the Value aspect. The focus on smart data on the relevant data and the mechanism of automation and collaboration of the agents, will contribute to the efficient automating for big data analytics and processing. The proposed approach is based on a collection of agents, and adopt the concept of smart data, this paradigm focus on the aspect value from the big data and help to retrieve the useful information from the large volumes of data by intelligent processing. The proposed model describes the functionalities of the agents. The agents receive data in real time, perform the operations of storing data, pre-processing, streaming processing and batch processing and finally transfer the results of analysis to the services and applications. Machine learning techniques can be used to enhance the aspect of cognition of the agents; through a case study, we used supervised learning methods to build a classification model to support the process of urban planning by predicting the type of habitat adequate for the population based on their demographic and socio-economic characteristics. © 2022, The Author(s), under exclusive license to Springer Nature Switzerland AG.",2022,"Advances in Science, Technology and Innovation","Sassite F., Addou M., Barramou F.",10.1007/978-3-030-80458-9_1,Book Chapter,4.7944326401,6.208925724
4,21,2.0,Do land policies make a difference? A data-driven approach to trace effects on urban form in France and Germany,Comparative; land policy; random forest; urban analytics; urban form,"Against the backdrop of rapidly expanding urban structures, land policies in many countries have been adapted to contain and redirect growth to existing urban structures. However, obstacles remain to measure the effects of policies. In the meantime, geoinformation technologies have given rise to a wide range of approaches to measure and describe urban form. Nevertheless, its application for the assessment of land policy has a high, but not yet fully exploited, potential. It is thus the aim of this research to address and investigate the options of spatial analysis and machine learning in particular to analyse urban form from a land policy perspective. To do so, we develop urban metrics informed by urban planning and land readjustment policies of two countries describing urban form on different spatial levels. We therefore formulate hypotheses on causal relations between policy and form. Based on the metrics, we apply the random forest algorithm to classify the building stock of the region. We then extract the residential areas, those with single-family houses, as this is where the effects of the policy are considered most visible. In a next step, we use random forest to predict the nationality of a building. Through variable importance measures, we identify and discuss urban morphological differences between the two countries and test the hypotheses on effects of land policies. We develop and test the approach for the French-German city-region of Strasbourg using OpenStreetMap data. We identify significant differences in the building coverage ratios, which tend to be higher in Germany. This can be linked to differences in planning regulations. Furthermore, German residential areas appear to be more diverse in urban form. Differences in land readjustment policies have proven to be plausible here, as French policies favour strong actors that develop residential areas more uniformly. In Germany, policies favour fragmented ownership-oriented development of residential areas. The metrics and the applied algorithm for building classification have proven to be robust in terms of data heterogeneity and have shown high levels of accuracy. They could also be successfully used for tracing causal relations. © The Author(s) 2021.",2022,Environment and Planning B: Urban Analytics and City Science,"Jehling M., Hecht R.",10.1177/2399808321995818,Article,5.1395888329,6.5633487701
4,24,1.0,Urban soils as a spatial indicator of quality for urban socio-ecological systems,Andes; Cities; Environmental Quality; Machine learning; Volcanic urban soils,"The development of criteria and indicators to quantify the transition to sustainability of the urban socio-ecological systems quality is determinant for planning policies and the 21st century urban agenda. This study models the spatial variation in the concentration and distribution of some macronutrients, micronutrients, and trace nutrients in the soil of a high-altitude city in the Andes. Meanwhile, machine learning methods were employed to study some interactions between the different dimensions that constitute an urban socio-ecosystem that caused these variations. We proposed a methodology that considered two phases: a) field work to collect data on 300 soil samples; laboratory analysis to measure the concentrations of 24 macronutrients, micronutrients, and trace nutrients; and the design of geophysical, spectral, and urban co-variables; b) statistical and geo-informatics analysis, where multivariate analysis grouped the elements into factors; and, machine learning integrated with co-variables was applied to derive the intensity of each factor across the city. Multivariate statistics described the variation in soil co-concentrations with a moderate percentage (42%). Four factors were determined that grouped some of the analyzed elements, as follows: F1 (Zn, S, Cu, Pb, Ni, and Cr), F2 (Ba, Ag, K, In, and Mg), F3 (B, V, Li, and Sr), and F4 (Si and Mn). The percentage R2 out-of-bag of the spatial model were: F1 = 20%, F2 = 8%, F3 = 14%, and F4 = 10%. Our outputs show that the enrichment and contamination by anthropogenic factors, such as the increase in population density, land use, road network, and traffic generated by fossil fuel vehicles, should be prioritized in urban planning decisions. © 2021",2021,Journal of Environmental Management,"Bonilla-Bedoya S., López-Ulloa M., Mora-Garcés A., Macedo-Pezzopane J.E., Salazar L., Herrera M.Á.",10.1016/j.jenvman.2021.113556,Article,5.0332984924,6.3300890923
4,27,,Landslide susceptibility mapping using artificial neural network tuned by metaheuristic algorithms,Landslide; Machine learning; Metaheuristic optimization; Natural hazard; Susceptibility modeling,"As a frequent natural disaster, landslides incur significant economic and human losses worldwide. The main idea of this paper is to propose novel integrative models for landslide susceptibility evaluation in a prone area of Chaharmahal va Bakhtiari Province in Iran. To do this, four metaheuristic techniques, namely chimp optimization algorithm (ChOA), crow search algorithm (CSA), satin bowerbird optimization (SBO), and water cycle algorithm (WCA) are used to supervise the training of an artificial neural network (ANN). A spatial database is created by 170 historical landslides and 14 most common conditioning factors. The models are optimized in terms of hyper-parameters and elite ones are then used to produce the susceptibility maps. During the training phase, all models could acquire a reliable understanding of the landslide pattern. The obtained accuracy index of area under the receiving operating characteristic curve (AUROC) showed that the maps produced by the WCA-ANN (AUROC = 0.925) and SBO-ANN (AUROC = 0.900) are more accurate than those of the ChOA-ANN (AUROC = 0.851) and CSA-ANN (AUROC = 0.855). Considering this assessment, the suggested hybrid models are reliable enough for landslide susceptibility modeling. Accordingly, the generated susceptibility map can be used for urban planning and generating alert systems over the studied area. © 2021, The Author(s), under exclusive licence to Springer-Verlag GmbH Germany, part of Springer Nature.",2021,Environmental Earth Sciences,"Mehrabi M., Moayedi H.",10.1007/s12665-021-10098-7,Article,5.4169135094,6.4243674278
4,29,,Classification of the influence of urban canyon geometry and reflectance on seasonal solar irradiation in three European cities,Classification; Machine Learning; Reflectance; Simulation; Solar radiation; Urban canyon,"The study presents a methodological framework for simulating, analyzing and classifying the seasonal solar exposure and irradiation uniformity of symmetrical urban canyons in three European cities with different latitudes: Athens, Paris and Helsinki. Parametric solar radiation simulations are conducted by varying the urban canyon geometry, orientation and surface reflectance. The study proposes the Solar Irradiation Ratio (SIR) and develops a qualitative classification scheme for solar exposure and irradiation uniformity in order to compare simulation results from different cities and label each urban canyon surface accordingly. Finally, the study trains and tests Random Forest classifiers which enable the quick classification of any symmetrical canyon geometry by providing canyon geometry, orientation and surface reflectance as inputs. Testing reveals that the classifiers have decent performance (accuracy: 0.89 – 0.94, precision: 0.82 – 0.92) and consequently may be used in early urban design and planning studies to get a quick estimate of the solar performance of a given symmetrical urban canyon, before full-scale simulations take place. © 2021",2021,Sustainable Cities and Society,Vartholomaios A.,10.1016/j.scs.2021.103379,Article,5.5597829819,6.3585538864
4,32,,A machine learning-based approach for classifying tourists and locals using geotagged photos: the case of Tokyo,Big data; Classification; Flickr; Geotagged photos; Locals; Machine learning; Tokyo; Tourists,"In tourism-dependent cities, investigating the spatiotemporal distribution and dynamics of tourist flows is crucial for better urban planning in both steady and perturbed states. In recent years, researchers have started relying more on photo-based, geotagged social data, which offer insights about tourists, popular hotspots, and mobility patterns. However, distinguishing between tourists and locals from this data is problematic since residence information is often not provided. While previous studies rely on heuristic (e.g., period of stay) and probabilistic (Shannon entropy) approaches, this paper proposes a method for classifying tourists and residents based on machine learning (ML) algorithms and considering parameters that could explain the variability between the two (e.g., weather, mobility, and photo content). This approach was applied to Flickr users’ geotagged photos taken in Tokyo’s 23 special wards from July 2008 to December 2019. The results show that stacked ensemble (SE) models are superior to models based on five supervised-learning algorithms, including gradient boosting machine (GBM), generalized linear model (GLM), distributed random forest (DRF), deep learning (DL), and extremely randomized trees (XRT). Temporal entropy (TEN), mobility on workdays, and frequent visits to amusement venues and crowded places influenced how users were classified. While temporal distribution showed similar monthly/hourly patterns, spatial distribution varied. The proposed approach might pave the way for scholars to carry out future tourism research on different topics and subsequently support policymakers in the decision-making process, specifically in urban settings. © 2021, The Author(s), under exclusive licence to Springer-Verlag GmbH Germany, part of Springer Nature.",2021,Information Technology and Tourism,"Derdouri A., Osaragi T.",10.1007/s40558-021-00208-3,Article,5.0260996819,6.4904756546
