Cluster,DocId,Cited by,Title,Author Keywords,Abstract,Year,Source title,Authors,DOI,Document Type,x,y
4,156,,Human Origin-Destination Flow Prediction Based on Large Scale Mobile Signal Data,,"The human origin-destination (OD) flow prediction is of great significance for urban safety control, stampede prevention, disease transmission control, urban planning, and many other aspects. Most of the existing methods generally divide the urban area into grids and use vehicle GPS trajectories and metrocard check-in data, combined with machine learning or deep learning models to predict human OD flow. However, these kinds of methods are challenging to capture fine-grained human mobility patterns. Moreover, these methods usually deviate from the actual human OD transfer patterns on a citywide scale due to the particularity of different datasets. To this end, in this paper, we use large-scale mobile phone signal data to achieve human OD flow prediction between the coverage of varying signal base stations. Many signal base stations are distributed in urban geographical space, collecting all the mobile phone user's location information to obtain large-scale fine-grained unbiased human OD flow data. Due to the lack of natural topology structure between base stations, this paper adopts a TGCN model combined with a graph fusion module to pretrain the dynamic population distribution prediction task. The parameters of the graph fusion module are employed to capture the different semantic information in the proposed hybrid machine learning method and finally achieve citywide human OD flow prediction. Extensive experiments on the real-world signal datasets in Changchun, China, demonstrate the effectiveness of our model. © 2021 Qiuyang Huang et al.",2021,Wireless Communications and Mobile Computing,"Huang Q., Yang Y., Xu Y., Wang E., Zhu K.",10.1155/2021/1604268,Article,5.0931758881,6.5875005722
4,157,,From sonic experiences to urban planning innovations,crowdsourcing; smart cities; Soundscape research; tool support; urban planning,"It is widely accepted that personal responses to soundscapes are more dependent on listeners’ emotions and attitudes, than on sounds or their physical features alone. Fast-growing cities have catalyzed the importance of designing urban spaces that citizens find pleasant and homely and that support a communal style of living. Unfortunately, there are no standardized methods or techniques to translate sonic experiences into measurable and reliable data, which urban planning professionals or the building industry could turn into innovations and solutions. Most of the data pertaining to noise pollution and city soundscapes is still based on predictive acoustic models and rarely takes any real-life experiences or physical measurements into consideration. This paper presents the concept of a smart and participatory approach for gathering sonic experiences that could be translated into measurable values. The aim is to search for data collection methods to provide data to train deep learning. With machine learning methods, it is possible to find patterns in both desirable and undesirable urban soundscapes. The aim of this concept is to create crowdsourced data collection methods and improve the understanding and communication between citizens and planning processes by producing more accurate and comparable experiential data. © 2021 Informa UK Limited, trading as Taylor & Francis Group.",2021,European Planning Studies,"Kaarivuo A., Salo K., Mikkonen T.",10.1080/09654313.2021.1988062,Article,4.9870581627,6.2337713242
4,158,,Development of a Methodology for Complex Monitoring of the Development of Urban and Suburban Areas Based on the Intellectual Analysis of Earth Remote Sensing Data and Geospatial Technologies,Area monitoring; Intelligent analysis; Machine learning; Remote sensing data; Urban area,"Over the past half century, mankind is increasingly faced with the problems of rational use of the Earth’s territories and its resources without negative impact on the environment and the person himself. The organization of human life activity requires solving the issues of urban planning and the correct distribution of zones for the construction of industrial facilities, recreation, waste disposal zones, communications, routes, etc. Balanced planning is based on monitoring the current state of infrastructure and territory. This article proposes a methodology for integrated monitoring of the development of urban and suburban areas. It is proposed to use Earth remote sensing data as a basis for the study. The issues of collection, integration and intelligent processing of satellite images are considered. The definition and segmentation of objects in images to create digital maps is performed based on machine learning algorithms. © 2021, Springer Nature Switzerland AG.",2021,Communications in Computer and Information Science,"Malikov V., Sadovnikova N., Parygin D., Aleshkevich A., Savina O.",10.1007/978-3-030-87034-8_29,Conference Paper,5.0643825531,6.1091423035
4,163,,Transfer learning-based city similarity measurement: A case study on urban hotel,City similarity; Scale prediction; Transfer learning,"With the development of modern cities, multiple types and wide distribution of urban data has been gradually collected. Effectively using urban data to solve city development and planning issues has become a research hot-spot. Currently, the data scale in modern cities is quite different, and the fitting degree of machine learning algorithm based on single city is not mature yet. This paper studies the problem with transfer learning technique, and trains the prediction model of urban hotel development scale using multi-source city data. Based on the location data and related information of 15 different cities, the relevant knowledge is transferred, and a city feature extraction and similarity measurement framework is proposed. © 2021 Knowledge Systems Institute Graduate School. All rights reserved.",2021,"Proceedings of the International Conference on Software Engineering and Knowledge Engineering, SEKE","Zhang G., Che X., Wei S., Na T.",10.18293/SEKE2021-011,Conference Paper,5.0401000977,6.3046388626
4,166,,Planning Support Systems for Long-Term Climate Resilience: A Critical Review,Academic publishing; Literature review; Long-term planning; Machine learning; Planning support systems; Topic modeling; Uncertainty; Urban climate adaptation; Urban knowledge systems; Urban resilience,"As climate change is becoming a reality, there is an increasing demand to improve urban resilience. Planning Support Systems (PSS) enable climate-informed planning. However, previous research confirms difficulties in the uptake of PSS due to their resource-intensive nature and lack of awareness of their usefulness. This chapter aims to make a headway in understanding research priorities and gaps that need to be addressed for PSS to address climate resilience in the long run. To this end, we review the emerging body of knowledge in academia and practice, by conducting a text-mining analysis of academic (n = 36,405) and non-academic (practice) (n = 86) literature on urban planning and climate resilience. We extract trends on climate pressures, infrastructure drivers, and planning responses. A key finding from academic literature is that long-term planning continues to be limited to a few fixed scenarios and places a strong focus on single sector strategies. Practice documents continue to be designed to inform high-level policies, but not spatial plans that require integrated thinking. Our analysis concludes with a research agenda for improving PSS to (1) identify and integrate the full range of variables in the long-term; (2) support selection of appropriate planning responses across multiple infrastructure systems; and (3) improve flexibility in planning by a deeper understanding of temporal aspects such as planning timeframes. © 2021, The Author(s), under exclusive license to Springer Nature Switzerland AG.",2021,Urban Book Series,"Krishnan S., Aydin N.Y., Comes T.",10.1007/978-3-030-76059-5_24,Book Chapter,4.914853096,6.2482309341
4,167,,Detection of Urban Built-Up Area Change from Sentinel-2 Images Using Multiband Temporal Texture and One-Class Random Forest,Built-up area change; improved one-class random forest (iOCRF); multiband temporal texture; multitemporal data; pseudo cross multivariate variogram (PCMV),"Detection of urban land expansion is important for understanding the urbanization process and improving urban planning. Spatio-temporal contextual information derived from multitemporal high-resolution imagery is useful for highlighting urban land cover changes. This article proposes a new method for detecting urban built-up area change from multitemporal high spatial resolution imagery by combining spectral and spatio-temporal features. A multiband temporal texture measured using pseudo cross multivariate variogram (PCMV) is adopted to quantify the local spatio-temporal dependence between bitemporal multispectral images. The PCMV textures at multiple scales, bitemporal spectral features, and normalized difference vegetation indices are together input to an improved one-class random forest classifier for urban built-up area change mapping. The proposed method is evaluated in urban built-up area change detection using multitemporal Sentinel-2 images of Tianjin area acquired from 2015 to 2019. It is also compared with three feature combinations and an existing postclassification comparison method based on one-class support vector machine. Experimental results demonstrate that the proposed method outperformed the traditional ones, with increases of 2.15%-7.38%, 2.07%-5.45%, 1.93%-6.76%, and 5.98%-13.11% in overall accuracy. Moreover, the proposed method also achieves the best performance using the bitemporal Sentinel-2 images over the east of Beijing area. The proposed method is promising as a simple and reliable way to detect urban built-up area change with multitemporal Sentinel-2 imagery. © 2008-2012 IEEE.",2021,IEEE Journal of Selected Topics in Applied Earth Observations and Remote Sensing,"Feng X., Li P., Cheng T.",10.1109/JSTARS.2021.3092064,Article,5.4034366608,6.2570567131
4,168,,An Intelligent Tree Planning Approach Using Location-Based Social Networks Data,Community detection algorithms; Mobility data; Multi-objective optimization; Social network analysis; Tree planning; Urban computing,"How do we make sure that all citizens in a city have access to enough green space? An increasing part of the world’s population lives in urban areas, where contact with nature is largely reduced to street trees and parks. As optional tree planting sites and financial resources are limited, determining the best planting site can be formulated as an optimization problem with constraints. Can we locate these sites based on the popularity of nearby venues? How can we ensure that we include groups of people who tend to spend time in tree deprived areas? Currently, tree location sites are chosen based on criteria from spatial-visual, physical and biological, and functional categories. As these criteria do not give any insights into which citizens are benefiting from the tree placement, we propose new data-driven tree planting policies that take socio-cultural aspects as represented by the citizens’ behavior into account. We combine a Location Based Social Network (LBSN) mobility data set with tree location data sets, both of New York City and Paris, as a case study. The effect of four different policies is evaluated on simulated movement data and assessed on the average, overall exposure to trees as well as on how much inequality in tree exposure is mitigated. © 2021, Springer Nature Switzerland AG.",2021,Communications in Computer and Information Science,"van Staalduinen J.H., Tetteroo J., Gawehns D., Baratchi M.",10.1007/978-3-030-76640-5_10,Conference Paper,4.8470287323,6.3366880417
4,173,,"Frontier topics in italian regional science in its forties: The increasing role of heterogeneity in theory, policy and planning",R11; R12; Regional planning. cation: R10; Regional policy; Regional theory,"This paper introduces the second volume of the special issue edited to celebrate the 40th Anniversary of AISRe. It presents different contributions ranging from the analysis of knowledge spillovers, the use of microdata in the spatial context, the application of machine learning tools for regional policy evaluation studies, the assessment of smart specialization and inner area strategies, the role of the evolutionary approach in regional planning and that of urban planning instruments in land rent measurement. The common denominator of the different essays may be found in the increasing diffusion of approaches dealing with heterogeneity of firms, geographical spaces and territories in modern regional science. © Società editrice il Mulino.",2021,Scienze Regionali,"Mazzola F., Pellegrini G.",10.14650/100873,Article,4.8977804184,6.2003331184
4,174,1.0,EquiTensors: Learning Fair Integrations of Heterogeneous Urban Data,data integration; fairness in machine learning; neural networks; open data; spatial-temporal predictions,"Neural methods are state-of-the-art for urban prediction problems such as transportation resource demand, accident risk, crowd mobility, and public safety. Model performance can be improved by integrating exogenous features from open data repositories (e.g., weather, housing prices, traffic, etc.), but these uncurated sources are often too noisy, incomplete, and biased to use directly. We propose to learn integrated representations, called EquiTensors, from heterogeneous datasets that can be reused across a variety of tasks. We align datasets to a consistent spatio-temporal domain, then describe an unsupervised model based on convolutional denoising autoencoders to learn shared representations. We extend this core integrative model with adaptive weighting to prevent certain datasets from dominating the signal. To combat discriminatory bias, we use adversarial learning to remove correlations with a sensitive attribute (e.g., race or income). Experiments with 23 input datasets and 4 real applications show that EquiTensors could help mitigate the effects of the sensitive information embodied in the biased data. Meanwhile, applications using EquiTensors outperform models that ignore exogenous features and are competitive with ""oracle""models that use hand-selected datasets. © 2021 ACM.",2021,Proceedings of the ACM SIGMOD International Conference on Management of Data,"Yan A., Howe B.",10.1145/3448016.3452777,Conference Paper,4.9598402977,6.5172433853000005
4,175,1.0,Analysis of built-up areas of small polish cities with the use of deep learning and geographically weighted regression,Build-up areas; Deep learning; GWR; Hot Spot (Getis-Ord Gi*); Poland; Small cities,"Small cities are an important part of the settlement system, a link between rural areas and large cities. Although they perform important functions, research focuses on large cities and metropolises while marginalizing small cities, the study of which is of great importance to progress in social sciences, geography, and urban planning. The main goal of this paper was to verify the impact of selected socio-economic factors on the share of built-up areas in 665 small Polish cities in 2019. Data from the Database of Topographic Objects (BDOT), Sentinel-2 satellite imagery from 2015 and 2019, and Local Data Bank by Statistics Poland form 2019 were used in the research. A machine learning segmentation procedure was used to obtain the data on the occurrence of built-up areas. Hot Spot (Getis-Ord Gi*) analysis and geographically weighted regression (GWR) was applied to explain spatially varying impact of factors related to population, spatial and economic development, and living standards on the share of built-up areas in the area of small cities. Significant association was found between the population density and the share of built-up areas in the area of the cities studied. The influence of the other socio-economic factors examined, related to the spatial and economic development of the cities and the quality of life of the inhabitants, showed great regional variation. The results also indicated that the share of built-up areas in the area of the cities under study is a result of the conditions under which they were established and developed throughout their existence, and not only of the socio-economic factors affecting them at present. © 2021 by the authors. Licensee MDPI, Basel, Switzerland.",2021,Geosciences (Switzerland),"Adamiak M., Jażdżewska I., Nalej M.",10.3390/geosciences11050223,Article,5.1896696091,6.5190024376
4,178,,Estimating the influence of building and urban form on the thermal loads of urban dwellings in the Mediterranean climate using machine learning,cooling loads; energy plus; Heating loads; machine learning; metamodeling; residential; urban form,"The paper presents a novel method of generating metamodels that can quantify the influence of urban form on the heating and cooling loads of dwellings for the Mediterranean climate. The goal of the metamodels is to inform the early urban design process with quick and accurate feedback on the energy demand of a given urban configuration. The proposed method generates training datasets through Monte Carlo dynamic energy simulations of a single thermal zone. The study focuses on the geometrical parameters that affect building energy balance at the urban scale, such as dwelling shape, compactness, adjacencies and shading, utilizing a set of morphological indicators to relate these parameters to heating and cooling loads. The study focuses on the Mediterranean climate of Thessaloniki, Greece and utilizes several open-source tools (Ladybug Tools, EnergyPlus and Scikit-learn) under a streamlined workflow. The metamodels, which are trained using the Random Forest algorithm are then validated on 12 real-world urban sites of Thessaloniki with a reported Mean Average Percentage Error (MAPE) of 12% and 15% for heating and cooling loads, respectively. © 2021 Taylor & Francis Group, LLC.",2021,"Energy Sources, Part B: Economics, Planning and Policy","Vartholomaios A., Chatzidimitriou A., Ioannidis K.",10.1080/15567249.2021.1916796,Article,5.4929552078,6.4261717796
4,181,,Modeling Urban Futures: Data-Driven Scenarios of Climate Change and Vulnerability in Cities,Climate vulnerability; Hazard; Land use/cover change modeling; Mapping; Urban development scenarios,"Cities are complex systems where social, ecological, and technological processes are deeply coupled. This coupling complicates urban planning and land use development, as changing one facet of the urban fabric will likely impact the others. As cities grapple with climate change, there is a growing need to envision urban futures that not only address more frequent and intense severe weather events but also improve day-to-day livability. Here we examine climate risks as functions of the local land use with numerical models. These models leverage a wide array of data sources, from satellite imagery to tax assessments and land cover. We then present a machine-learning cellular automata approach to combine historical land use change with local coproduced urban future scenarios. The cellular automata model uses historical and ancillary data like existing road systems and natural features to develop a set of probabilistic land use change rules, which are then modified according to stakeholder priorities. The resulting land use scenarios are evaluated against historical flood hazards, showcasing how they perform against stakeholder expectations. Our work shows that coproduced scenarios, when grounded with historical and emerging data, can provide paths that increase resilience to weather hazards as well as enhancing ecosystem services provided to citizens. © 2021, This is a U.S. government work and not under copyright protection in the U.S.; foreign copyright protection may apply.",2021,Urban Book Series,"Ortiz L., Mustafa A., Rosenzweig B., McPhearson T.",10.1007/978-3-030-63131-4_9,Book Chapter,4.9151749611,6.4059891701
4,191,,Predicting and mapping neighborhood-scale health outcomes: A machine learning approach,311 service; Crowdsourced data; Machine learning; Neighborhood; Urban health,"Estimating health outcomes at a neighborhood scale is important for promoting urban health, yet costly and time-consuming. In this paper, we present a machine-learning-enabled approach to predicting the prevalence of six common non-communicable chronic diseases at the census tract level. We apply our approach to the City of Austin and show that our method can yield fairly accurate predictions. In searching for the best predictive models, we experiment with eight different machine learning algorithms and 60 predictor variables that characterize the social environment, the physical environment, and the aspects and degrees of neighborhood disorder. Our analysis suggests that (a) the sociodemographic and socioeconomic variables are the strongest predictors for tract-level health outcomes and (b) the historical records of 311 service requests can be a useful complementary data source as the information distilled from the 311 data often helps improve the models' performance. The machine learning models yielded from this study can help the public and city officials evaluate future scenarios and understand how changes in the neighborhood conditions can lead to changes in the health outcomes. By analyzing where the most significant discrepancies between the predicted and the actual values are, we will also be ready to identify areas of best practice and areas in need of greater investment or policy intervention. © 2020",2021,"Computers, Environment and Urban Systems","Feng C., Jiao J.",10.1016/j.compenvurbsys.2020.101562,Article,4.8186278343,6.611717701
4,197,4.0,Remote measurement of building usable floor area – Algorithms fusion,Algorithms fusion; Building usable floor area; Computer vision; Fuzzy theory; Machine learning; Measurement data processing,"Rapid changes that are taking place in the urban environment have significant impact on urban growth. Most cities and urban regions all over the world compete to increase resident and visitor satisfaction. The growing requirements and rapidity of introducing new technologies to all aspects of residents’ lives force cities and urban regions to implement “smart cities” concepts in their activities. Real estate is one of the principal anthropogenic components of urban environment thus become a subject of thorough multidisciplinary analysis in the field of data requiring spatial information systems. Recent advances in information technology, combined with the increased availability of high-resolution imagery from Earth observation, create an opportunity to use new sources of data that enable to identify, monitor, and solved many of urban environmental problem. The aim of the paper is to elaborate precise, complete and detailed property information with the use of remote sensing observations in a suitable numerical algorithm. The authors concentrate on providing one of the most important, and probably the most lacking, feature describing properties – building usable floor area (BUFA). The solution is elaborated in the form of an automatic algorithm based on machine learning and computer vision technology related to LiDAR (big data), close range images with respect to spatial information systems requirements. The obtained results related to BUFA estimation in comparison to the state-of-the-art results are satisfactory and may increase the reliability of decision-making in investment, fiscal, registration and planning aspects. © 2020 Elsevier Ltd",2021,Land Use Policy,"Janowski A., Renigier-Biłozor M., Walacik M., Chmielewska A.",10.1016/j.landusepol.2020.104938,Article,5.1940879822,6.1903586388
4,199,17.0,The conceptual basis of water-energy-food nexus governance: systematic literature review using network and discourse analysis,discourse analysis; nexus governance; social network analysis; systematic literature review; Water-energy-food nexus,"In the last decade, the debate on the governance of water, energy, and food (WEF) has intensified, spurring the emergence of the term “nexus governance.” In general, the reduction of trade-offs and construction of synergies between WEF have been placed on the scientific, political, and economic agenda. However, although increasingly used, it is difficult to find a clear meaning and definition of what the term represents. Based on a systematic literature review (SLR), using text-mining and machine learning algorithms, this article investigates what are the conceptual basis of the nexus governance debate, and attempts to clarify the main themes, networks, and gaps within this literature. The analysis is based on quantitative and qualitative methods, combining social network analysis (SNA) and discourse analysis (DA). The results highlighted that twenty-four governance-related concepts support this literature, breaking down into eight groups: water and basin governance; environmental and systems governance; risk and resource security governance; economic governance; global governance; urban governance; integrative and cooperative governance; and “epistemic” and transdisciplinary governance. © 2020 The Author(s). Published by Informa UK Limited, trading as Taylor & Francis Group.",2020,Journal of Integrative Environmental Sciences,"Urbinatti A.M., Benites-Lazaro L.L., Carvalho C.M.D., Giatti L.L.",10.1080/1943815X.2020.1749086,Review,4.9345755577,6.2466278076
