Cluster,DocId,Cited by,Title,Author Keywords,Abstract,Year,Source title,Authors,DOI,Document Type,x,y
7,408,2.0,A multiscale clustering of the urban morphology for use in quantitative models,,"Geo-spatial data available to researchers and practitioners has increased substantially over the last decades, offering new opportunities for analyzing and characterizing locations and their spatial environment in an objective way. Various studies in the field of urban planning and design have given recommendations on “good urban form”, suggesting that especially characteristics of the urban morphology inform the quality of locations and additionally influence spatial behavior. While we find a growing number of quantitative spatial models such as hedonic price models, location choice models, or applied machine learning algorithms, characteristics describing the urban morphology are still rarely reported in these. One reason can be found in the limited knowledge on how to characterize the urban morphology best. In this chapter, we address this deficit and define attributes that are suitable to characterize the urban morphology in quantitative means at different scales. We show how these can be processed from a data model that is simple enough to allow for reproducibility in most study areas and process them for the case study of Switzerland. Finally, we use the attributes to define urban typologies through clustering methods. These are compared on their outcome, their consistency, and interpretation. © Springer Nature Switzerland AG 2019.",2019,"Modeling and Simulation in Science, Engineering and Technology","Schirmer P.M., Axhausen K.W.",10.1007/978-3-030-12381-9_16,Book Chapter,9.96281147,6.8810811043
7,409,11.0,"Generative design and performance modeling for relationships between urban built forms, sky opening, solar radiation and energy",Energy performance; Generative design; Parametric modeling; Reinforcement learning; Urban design,"For the past two decades, extensive research has been conducted to evaluate the performance of urban form scenarios such as sky view factors, solar radiation, or energy performance. Simulation-based performance analysis has been applied for optimizing urban design using multiple performance criteria of energy demands, daylighting, or radiance. Two major limitations exist in the performance evaluation methods of urban design: 1) the number of urban design alternatives or scenarios has been limited, and 2) various performance criteria and metrics have not been assessed synthetically. In this respect, we aim to generate all possible alternatives under constraints such as a city policy or development requirements. This paper addresses the integration of generative design and multi-criteria performance analysis for urban design decision making. The relationships between geometric urban forms and multiple performance criteria are identified. The proposed methodology incorporates the reinforcement learning algorithm, an advanced machine learning technique, along with parametric modeling techniques, to enhance urban design decisions based on various performance criteria. This methodology was tested on the design of an international campus of the Georgia Institute of Technology, located in Shenzhen, China. An algorithm generates numerous geometrical alternatives of campus design under site constraints and development requirements of the campus. Those alternatives are then evaluated based on performance criteria of sky openings, solar radiation, or energy consumption synthetically. The method enables an integrated performance analysis for all possible design under constraints. The paper proposes a data driven urban design approach that connect generative design and multi-criteria performance analyses. The relationships between urban geometric forms and performance criteria function derive guidelines for a sustainable and green campus. In future conduct multivariate analysis to examine the relationships between geometric elements and performance measurement metrics. © 2019 The Authors. Published by Elsevier Ltd. This is an open access article under the CC BY-NC-ND license (http://creativecommons.org/licenses/by-nc-nd/4.0/) Peer-review under responsibility of the scientific committee of ICAE2018 - The 10th International Conference on Applied Energy.",2019,Energy Procedia,"Chang S., Saha N., Castro-Lacouture D., Yang P.P.-J.",10.1016/j.egypro.2019.01.841,Conference Paper,9.6469278336,6.7839946747
7,413,10.0,Mapping long-term dynamics of population and dwellings based on a multi-temporal analysis of urban morphologies,Dasymetric mapping; Dwelling units; Dynamics; Estimation; Historical demography; Multi-temporal; Population; Topographic maps; Urban morphology; Urban planning,"Information on the distribution and dynamics of dwellings and their inhabitants is essential to support decision-making in various fields such as energy provision, land use planning, risk assessment and disaster management. However, as various different of approaches to estimate the current distribution of population and dwellings exists, further evidence on past dynamics is needed for a better understanding of urban processes. This article therefore addresses the question of whether and how accurately historical distributions of dwellings and inhabitants can be reconstructed with commonly available geodata from national mapping and cadastral agencies. For this purpose, an approach for the automatic derivation of such information is presented. The data basis is constituted by a current digital landscape model and a 3D building model combined with historical land use information automatically extracted from historical topographic maps. For this purpose, methods of image processing, machine learning, change detection and dasymetric mapping are applied. The results for a study area in Germany show that it is possible to automatically derive decadal historical patterns of population and dwellings from 1950 to 2011 at the level of a 100 m grid with slight underestimations and acceptable standard deviations. By a differentiated analysis we were able to quantify the errors for different urban structure types. © 2018 by the authors.",2019,ISPRS International Journal of Geo-Information,"Hecht R., Herold H., Behnisch M., Jehling M.",10.3390/ijgi8010002,Article,9.9929771423,6.8982453346
7,419,,ACM International Conference Proceeding Series,,The proceedings contain 66 papers. The topics discussed include: norm-based enterprise agent intelligence design; application of sparse auto-encoder in handwritten digit recognition; a texture analysis method based on statistical contourlet coefficient applied to the classification of pancreatic cancer and normal pancreas; study on the wind induced response in along wind of the high-rise building; machine learning hyperparameter fine tuning service on dynamic cloud resource allocation system – taking heart sounds as an example; numerical simulation on air-decking charge in the fragmentation of concrete; and considerations of the paradigms of urban design teaching application about big data.,2018,ACM International Conference Proceeding Series,[No author name available],,Conference Review,9.5753993988,7.0483374596
7,420,2.0,Accelerated exploration for long-term urban water infrastructure planning through machine learning,Adaptation planning; Artificial neural network; Multi-layer perception; Urban planning; Water infrastructure,"In this study, the neural network method (Multi-Layer Perceptron, MLP) was integrated with an explorative model, to study the feasibility of using machine learning to reduce the exploration time but providing the same support in long-term water system adaptation planning. The specific network structure and training pattern were determined through a comprehensive statistical trial-and-error (considering the distribution of errors). The network was applied to the case study in Scotchman's Creek, Melbourne. The network was trained with the first 10% of the exploration data, validated with the following 5% and tested on the rest. The overall root-mean-square-error between the entire observed data and the predicted data is 10.5722, slightly higher than the validation result (9.7961), suggesting that the proposed trial-and-error method is reliable. The designed MLP showed good performance dealing with spatial randomness from decentralized strategies. The adoption of MLP-supported planning may overestimate the performance of candidate urban water systems. By adopting the safety coefficient, a multiplicator or exponent calculated by observed data and predicted data in the validation process, the overestimation problem can be controlled in an acceptable range and have few impacts on final decision making. © 2018 by the authors.",2018,Sustainability (Switzerland),"Zhang J., Fu D., Urich C., Singh R.P.",10.3390/su10124600,Article,9.9378700256,6.7723236084
7,424,4.0,Structural health monitoring installation scheme using utility computing model,Geographical Area Network (GAN); Internet of Things (IoT); Structural Health Monitoring (SHM); Things as a Service (TaaS); Utility Computing,"In view of intensified disasters and fatalities caused by natural phenomena, there is a pressing need for an efficient environment logging that provides structural information to administrators for a better management and urban planning. This paper proposes a novel utility model for structural health monitoring that would enable early detection of risk factors and mitigation of loss. The proposed utility computing model takes the input data in terms of 'number of occupants' in a building (i.e. MAC, International Mobile Equipment Identifier addresses and biometric attendance system installed) and SHM system data (i.e. sensors readings). It give visual representation of all the data for utility managers and experts to decide better location of SHM and number of SHM needed per zone depending on high disturbances created due to higher occupancy and number of structures per zone. Denser area with higher structures and higher population will require more precise and accurate SHM systems compared to rural areas. It also analyzes the data from SHM system and using simple machine learning algorithm give experts' suggestions for type of SHM needed at an area. It make it possible for the data of each and every device of SHM systems over several zones to be accessible by specific authorities that can be used to predict as well as forecast any natural disaster. The Structural Health Monitoring utility model is unique in terms of its heterogeneity of resource management in realizing the utility processes. Finally, a case study of Qatar University is looked at where nodes are distributed in zones along with occupant measuring is used over each building. The data was taken over simulated occupation models and mathematical models from literature for occupation and zone calculation using ideal SHM system data. It can be inferred from the data that real-time analysis data will act similar to simulated and proposed Utility Computing System will give visual data and analyze the zones as can be seen in the results. Therefore, SHM Utility Computing model is efficient and most effective system that save cost as well as prepare authorities for maintenance of a structure or crisis management due to external surroundings. © 2018 IEEE.",2018,"Proceedings - 2018 2nd European Conference on Electrical Engineering and Computer Science, EECS 2018","Tariq H., Al-Hitmi M.A.E., Tahir A., Crescini D., Touati F., Manouer A.B.",10.1109/EECS.2018.00019,Conference Paper,9.6363801956,6.7832159996
7,432,,"Proceedings of the 1st ACM SIGSPATIAL International Workshop on Advances in Resilient and Intelligent Cities, ARIC 2018",,"The proceedings contain 8 papers. The topics discussed include: multiple evaluation in future population distribution for sustainable city; detecting street signs in cities based on object recognition with machine learning and GIS spatial analysis; D-record: disaster response and relief coordination pipeline; analysis, integration and visualization of urban data from multiple heterogeneous sources; SCOUTS: a smart community centric urban heat monitoring framework; real-time traffic light detection from videos with inertial sensor fusion; and an integrated visual analytics framework for spatiotemporal data.",2018,"Proceedings of the 1st ACM SIGSPATIAL International Workshop on Advances in Resilient and Intelligent Cities, ARIC 2018",[No author name available],,Conference Review,9.5529298782,7.0354351997
7,441,72.0,Data-driven Urban Energy Simulation (DUE-S): A framework for integrating engineering simulation and machine learning methods in a multi-scale urban energy modeling workflow,Building energy; Data-driven; Machine learning; Multi-scale; Simulation; Urban context; Urban energy modeling,"The world is rapidly urbanizing, and the energy intensive built environment is becoming increasingly responsible for the world's energy consumption and associated environmental emissions. As a result, significant efforts have been put forth to develop methods that can accurately model and characterize building energy consumption in cities. These models aim to utilize physics-based building energy simulations, reduced-order calculations and statistical learning methods to assess the energy performance of buildings within a dense urban area. However, current urban building energy models are limited in their ability to account for the inter-building energy dynamics and urban microclimate factors that can have a substantial impact on building energy use. To overcome these limitations, this paper proposes a novel Data-driven Urban Energy Simulation (DUE-S) framework that integrates a network-based machine learning algorithm (ResNet) with engineering simulation to better understand how buildings consume energy on multiple temporal (hourly, daily, monthly) and spatial scales in a city (single building, block, urban). We validate the proposed DUE-S framework on a proof of concept case study of 22 densely located university buildings in California, USA. Our results indicate that the DUE-S framework is able to accurately predict urban scale energy consumption at hourly, daily and monthly intervals. Moreover, our results also demonstrate that the integration of data-driven and engineering simulation approaches can partially capture the inter-building energy dynamics and impacts of the urban context and merits future work to explore how they can be improved to predict sub-urban scale energy predictions (single building, block). In the end, successfully predicting and modeling the energy performance of urban buildings has the potential to inform the decision-making of a wide variety of urban sustainability stakeholders including architects, engineers and policymakers. © 2018 Elsevier Ltd",2018,Applied Energy,"Nutkiewicz A., Yang Z., Jain R.K.",10.1016/j.apenergy.2018.05.023,Article,9.6954565048,6.7965641022
7,442,6.0,Comparison of Regression Tools for Regional Electric Load Forecasting,Electric Load Forecasting; k-NN; Machine Learning; Regression Tools,"Urban area electrical load forecasting is important for power generation capacity planning and also to integrate environment friendly energy sources at district level. Load predictions will help in developing demand side management in coordination with renewable power generation. Urban area load is influenced by meteorological conditions therefore it is important to include weather parameters for load predictions. Machine Learning algorithms can effectively contribute for electrical load predictions. The most commonly used algorithm for load prediction is Artificial Neural Network (ANN), which is a complex predictor that utilizes a big amount of training data. k-Nearest Neighbour (kNN) has proven to be efficient by the introduction of binary dummy variables for categorisation and it can be used for short term(30 min) and long term(24 hours) load forecasting. This paper explores the use of regression tool for regional electric load forecasting by correlating lower distinctive categorical level (season and day of the week) and weather parameters. The historical electrical load datasets with meteorological parameters are available for the Sydney region and they have been used to test the regression tools. Data correlation over seasonal changes have been argued by means of improving Mean Absolute Percentage Error(MAPE). By examining the structure of various regressors they are compared for the lowest MAPE. The regressors show good MAPE for short term (30 min) prediction and Random Forest Regressor scores best in the range of 1-2 % MAPE. © 2018 University of Split, FESB.",2018,"2018 3rd International Conference on Smart and Sustainable Technologies, SpliTech 2018","Johannesen N.J., Kolhe M., Goodwin M.",,Conference Paper,9.686715126,6.7785406113
7,446,3.0,Field Experiment of Localization Based on Machine Learning in LTE Network,Localization; LTE; Machine Learning; RF fingerprint,"In mobile communications networks, if we can estimate the location of each user equipment (UE) with high accuracy, efficient cell planning and network optimization become possible. However, it is difficult for operators to estimate the location of most commercial UEs because they cannot feedback their location information directly to their serving base stations with the exception of UEs with Minimization of Drive Test (MDT) functions specified in LTE Release 10. Radio Frequency (RF) fingerprint method is known as an effective localization method, with which we can estimate the location of UEs with only RF signature and location information beforehand. In LTE, RF fingerprint database can be collected by conducting drive tests or using measurement data from UEs compatible with MDT. Although the estimation accuracy can be better with more RF signatures, the increase in the amount of RF signatures causes the increase in the feedback, which consumes the uplink capacity and UE battery. Furthermore, keeping all RF signatures in database is inefficient because some RF signatures do not have effect on improving estimation accuracy. Hence, it is important to clarify the effect of each RF signature and use only effective ones in the localization. In this paper, we conducted a field experiment to create an RF fingerprint database in dense urban area, and evaluated the effectiveness of each RF signature by making several localization models based on machine learning. Eventually, we clarified minimum RF signatures required to operate RF fingerprint localization in LTE network. © 2018 IEEE.",2018,IEEE Vehicular Technology Conference,"Kanazawa N., Nagate A., Yamamoto A.",10.1109/VTCFall.2018.8690868,Conference Paper,9.2898597717,6.7462882996
7,447,25.0,"Using a gradient boosting model to improve the performance of low-cost aerosol monitors in a dense, heterogeneous urban environment",Air quality; Calibration; Low-cost sensing; Machine learning; Urban,"The increased availability and improved quality of new sensing technologies have catalyzed a growing body of research to evaluate and leverage these tools in order to quantify and describe urban environments. Air quality, in particular, has received greater attention because of the well-established links to serious respiratory illnesses and the unprecedented levels of air pollution in developed and developing countries and cities around the world. Though numerous laboratory and field evaluation studies have begun to explore the use and potential of low-cost air quality monitoring devices, the performance and stability of these tools has not been adequately evaluated in complex urban environments, and further research is needed. In this study, we present the design of a low-cost air quality monitoring platform based on the Shinyei PPD42 aerosol monitor and examine the suitability of the sensor for deployment in a dense heterogeneous urban environment. We assess the sensor's performance during a field calibration campaign from February 7th to March 25th 2017 with a reference instrument in New York City, and present a novel calibration approach using a machine learning method that incorporates publicly available meteorological data in order to improve overall sensor performance. We find that while the PPD42 performs well in relation to the reference instrument using linear regression (R2 = 0.36–0.51), a gradient boosting regression tree model can significantly improve device calibration (R2 = 0.68–0.76). We discuss the sensor's performance and reliability when deployed in a dense, heterogeneous urban environment during a period of significant variation in weather conditions, and important considerations when using machine learning techniques to improve the performance of low-cost air quality monitors. © 2018 Elsevier Ltd",2018,Atmospheric Environment,"Johnson N.E., Bonczak B., Kontokosta C.E.",10.1016/j.atmosenv.2018.04.019,Article,9.7596607208,6.7379388809
7,448,12.0,A machine learning approach for localization in cellular environments,,"A machine learning approach is developed for localization based on received signal strength (RSS) from cellular towers. The proposed approach only assumes knowledge of RSS fingerprints of the environment, and does not require knowledge of the cellular base transceiver station (BTS) locations, nor uses any RSS mathematical model. The proposed localization scheme integrates a weighted K-nearest neighbor (WKNN) and a multilayer neural network. The integration takes advantage of the robust clustering ability of WKNN and implements a neural network that could estimate the position within each cluster. Experimental results are presented to demonstrate the proposed approach in two urban environments and one rural environment, achieving a mean distance localization error of 5.9 m and 5.1 m in the urban environments and 8.7 m in the rural environment. This constitutes an improvement of 41%, 45%, and 16%, respectively, over the WKNN-only algorithm. © 2018 IEEE.",2018,"2018 IEEE/ION Position, Location and Navigation Symposium, PLANS 2018 - Proceedings","Abdallah A.A., Saab S.S., Kassas Z.M.",10.1109/PLANS.2018.8373508,Conference Paper,9.2636671066,6.7444705963
7,452,1.0,Application of machine learning in urban greenery land cover extraction,Auto extraction; Greenery land cover; Machine learning; Multispectral image; Neural network,"Urban greenery is a critical part of the modern city and the greenery coverage information is essential for land resource management, environmental monitoring and urban planning. It is a challenging work to extract the urban greenery information from remote sensing image as the trees and grassland are mixed with city built-ups. In this paper, we propose a new automatic pixel-based greenery extraction method using multispectral remote sensing images. The method includes three main steps. First, a small part of the images is manually interpreted to provide prior knowledge. Secondly, a five-layer neural network is trained and optimised with the manual extraction results, which are divided to serve as training samples, verification samples and testing samples. Lastly, the well-trained neural network will be applied to the unlabelled data to perform the greenery extraction. The GF-2 and GJ-1 high resolution multispectral remote sensing images were used to extract greenery coverage information in the built-up areas of city X. It shows a favourable performance in the 619 square kilometers areas. Also, when comparing with the traditional NDVI method, the proposed method gives a more accurate delineation of the greenery region. Due to the advantage of low computational load and high accuracy, it has a great potential for large area greenery auto extraction, which saves a lot of manpower and resources. © Authors 2018. CC BY 4.0 License.",2018,"International Archives of the Photogrammetry, Remote Sensing and Spatial Information Sciences - ISPRS Archives","Qiao X., Li L.L., Li D., Gan Y.L., Hou A.Y.",10.5194/isprs-archives-XLII-3-1409-2018,Conference Paper,9.6208610535,6.8451833725
7,466,2.0,Robust anomaly detection in urban environments using sensor and information fusion and a camera network,Anomaly detection; Camera network; Hidden Markov model; Information fusion,"The paper presents a method for detection of abnormal behaviors related to violent events in urban environments. We have further developed a person detection method and introduced a person tracker as an intermediate stage between person detection and anomaly detection. The method is presented together with results from evaluations based on real sensor data that have been recorded in a realistic urban environment. Several scenarios have been recorded such as normal situations, a person loitering, a person shooting and people escaping from sudden smoke development. The method uses sensor data from a static video surveillance system, consisting of two visual and two thermal infrared cameras. The person detection method combines foreground segmentation with a trained machine learning algorithm which is based on boosting. The tracker associates incoming detections to objects (i.e. people), and generates tracks of world coordinates and velocities of objects. The anomaly detection method, which is based on the hidden Markov model (HMM), fuses information that is derived from the tracker. The information contains a number of persons, their positions and velocities. The results indicate that the person detection method in combination with the tracker can produce robust and accurate observations to the HMM, which in turn provide good conditions for accurate anomaly detection. © 2018 SPIE.",2018,Proceedings of SPIE - The International Society for Optical Engineering,"Andersson M., Hemström F., Molin S.",10.1117/12.2326276,Conference Paper,9.1966314316,6.7036957741
