Cluster,DocId,Cited by,Title,Author Keywords,Abstract,Year,Source title,Authors,DOI,Document Type,x,y
7,257,7.0,Identifying the Structure of Cities by Clustering Using a New Similarity Measure Based on Smart Card Data,city structure; clustering analysis; data mining; public transportation; Smart cards,"Identifying the structure of cities has long been studied in urban planning and traffic modeling. This study presents a reliable method that reveals the structure of cities mainly based on clustering analysis using a new similarity measure. Several previous studies have used well-known clustering algorithms in machine learning fields, such as k-means clustering based on temporal mobility patterns of regions, whereas other studies have applied community detection algorithms on networks that depict traffic flows. However, the former does not reflect spatial interactions among places or areas, and the latter groups' places or areas with different land uses into the same cluster. To address these issues in existing approaches, this study proposes a new similarity method that considers not only temporal mobility patterns of areas but also spatial interactions with other areas. Moreover, the study combines spectral clustering repeated several times with hierarchical clustering to obtain a reliable structure that keeps the contiguity of clusters and determine the hierarchy of different areal units. The application of the proposed method to the data for Seoul, South Korea, reveals that the proposed clustering process divides a city into relatively homogeneous areas in terms of land uses. The flow maps based on the clustering results also revealed the spatial interactions between different areas and identify the polycentric structure of Seoul. © 2000-2011 IEEE.",2020,IEEE Transactions on Intelligent Transportation Systems,Kim K.,10.1109/TITS.2019.2910548,Article,9.5989608765,6.6314311028
7,258,1.0,Region2vec: An Approach for Urban Land Use Detection by Fusing multiple Features,machine learning; point of interest; region2vec; Urban land use,"With the advancement of urbanization, urban land use detection has become a research hotspot. Numerous methods have been proposed to identify urban land use, in which points of interest (POI) data is widely used, and sometimes other data source like GPS trajectories is incorporated. However, previous works have hardly fully utilized the global spatial information contained in the POI data, or ignored correlations between features when integrating multiple data source, so resulting in information loss. In this study, we propose an integrated framework titled Region2vec to detect urban land use type by combining POI and mobile phone data. First, POI-based region embeddings are generated by applying Glove model and LDA model to mine the global spatial information and land use topic distributions respectively. The mobile phone data is utilized to generate human activity pattern-based embeddings. Then a similarity matrix is constructed according to POI-based and activity pattern-based embeddings. Finally, the similarity measures are regarded as clustering features to extract the urban land use results. Experiments are implemented and compared with other urban land use algorithms based on data in Sanya, China. The results demonstrate the effectiveness of the proposed framework. This research can provide effective information support for urban planning. © 2020 ACM.",2020,ACM International Conference Proceeding Series,Xiang M.,10.1145/3404555.3404613,Conference Paper,9.6687555313,6.6495666504
7,262,,Data-driven historical preservation: a case study in Shanghai,Artificial neural network; Historical preservation; Machine learning; Urban planning,"Historical preservation is becoming ever important in globalizing Shanghai city. However, traditional survey-based ways of policy making are not efficient. This work introduces the data-driven technique with machine learning algorithm to find the relationship between the features of the historical sites and the popularity, which relates to the economy such as tourism and the associated GDP contribution. The method is automatic, which relieves the work load from statistical surveys and other inefficient traditional approaches. Moreover, while the surveys can only reflect the current conditions, the machine learning approach has the ability of predicting the possible outcomes based on existing data, which is helpful when decisions on protection and development are to be made. We collect data from selected historical sites in Shanghai to illustrate the procedure of the proposed data-driven approach. The case study demonstrates the capability of prediction and shows its promising future in guiding policy making, resource allocation and scientific research. © 2018, The Natural Computing Applications Forum.",2020,Neural Computing and Applications,"Wei Z., Tong Q.",10.1007/s00521-018-3710-z,Article,9.6900081635,6.6421494484
7,263,16.0,A deep learning architecture for semantic address matching,deep neural network; Geocoding; machine learning; semantic matching; word2vec,"Address matching is a crucial step in geocoding, which plays an important role in urban planning and management. To date, the unprecedented development of location-based services has generated a large amount of unstructured address data. Traditional address matching methods mainly focus on the literal similarity of address records and are therefore not applicable to the unstructured address data. In this study, we introduce an address matching method based on deep learning to identify the semantic similarity between address records. First, we train the word2vec model to transform the address records into their corresponding vector representations. Next, we apply the enhanced sequential inference model (ESIM), a deep text-matching model, to make local and global inferences to determine if two addresses match. To evaluate the accuracy of the proposed method, we fine-tune the model with real-world address data from the Shenzhen Address Database and compare the outputs with those of several popular address matching methods. The results indicate that the proposed method achieves a higher matching accuracy for unstructured address records, with its precision, recall, and F1 score (i.e., the harmonic mean of precision and recall) reaching 0.97 on the test set. © 2019, © 2019 Informa UK Limited, trading as Taylor & Francis Group.",2020,International Journal of Geographical Information Science,"Lin Y., Kang M., Wu Y., Du Q., Liu T.",10.1080/13658816.2019.1681431,Article,9.6116800308,6.6820244789
7,267,,Machine learning for comparative urban planning at scale: An aviation case study,,"Aviation is in flux, experiencing 5.4% yearly growth over the last two decades. However, with COVID-19 aviation was hard hit. This, along with its contribution to global warming, has led to louder calls to limit its use. This situation emphasizes how urban planners and technologists could contribute to understanding and responding to this change. This paper explores a novel workflow of performing image-based machine learning (ML) on satellite images of over 1.000 world airports that were algonthmically collated using European Space Agency Sentinel2 API. From these, the top 350 United States airports were analyzed with land use parameters extracted around the airport using computer vision, which were mapped against their passenger footfall numbers. The results demonstrate a scalable approach to identify how easy and beneficial it would be for certain airports to expand or contract and how this would impact the surrounding urban environment in terms of pollution and congestion. The generic nature of this workflow makes it possible to potentially extend this method to any large infrastructure and compare and analyze specific features across a large number of images while being able to understand the same feature through time. This is critical in answering key typology-based urban design challenges at a higher level and without needing to perform on-ground studies, which could be expensive and time-consuming. © Proceedings of the 40th Annual Conference of the Association for Computer Aided Design in Architecture: Distributed Proximities, ACADIA 2020. All rights reserved.",2020,"Proceedings of the 40th Annual Conference of the Association for Computer Aided Design in Architecture: Distributed Proximities, ACADIA 2020","Meeran A., Joyce S.C.",,Conference Paper,9.8959350586,6.9139752388
7,274,1.0,Evaluating multivariable statistical methods for downscaling nighttime land surface temperature in urban areas,Advanced spaceborne thermal emission and refiection radiometer (ASTER); Downscaling; Land surface temperature (LST); Landsat 8 operational land imager (OLI); Moderate resolution imaging spectroradiometer (MODIS); Nighttime; Urban areas,"For research and practice in fields such as the environment and meteorology, nighttime land surface temperature (LST) images at fine resolution provide important basic data. Since only a few satellite sensors can take fine-resolution thermal infrared images at night, such images are rather scarce. Downscaling of coarse-resolution LST images is a potential method for obtaining high-resolution LST images. However, downscaling methods have been mostly proposed for daytime LST images. This study aimed to evaluate the performance of methods that combine multiple explanatory variables and machine learning algorithms for downscaling coarse-resolution nighttime LST images in urban areas. Verification showed that the errors in the downscaling results were acceptable (mean absolute errors within 2 K). The resulting images could depict the spatial pattern of night LST in the study area in great detail. It was demonstrated that visible-near infrared images taken in the daytime could be used for downscaling of nighttime LST images, the rationality of which was deduced. It was also demonstrated that the performance of the spectral explanatory variables in nighttime LST downscalingwas not lower than that of the mechanism explanatory variables. This method has high application value in many academic and practical efforts, such as land-atmosphere interface radiation budget studies, suitability assessments of human settlement, and urban environmental planning. © 2020 Institute of Electrical and Electronics Engineers Inc.. All rights reserved.",2020,IEEE Access,"Qi P., Cui Y., Zhang H., Hu S., Yao L., Bailian Li L.",10.1109/ACCESS.2020.3021034,Article,9.8390102386,6.8284554482
7,275,1.0,Intelligent Unmanned Aerial Vehicle Technology in Urban Environments,Deep learning; Environmental pollution monitoring; Machine learning; Monitoring hazardous geological and geophysical processes; Monitoring of technical and engineering constructions; Multi-Criteria decision support systems; Smart city; Unmanned aerial vehicles; Urban environment,"Sustainable development of megacities requires a transition to the new management methods and technologies, based on the wide use of a large amount of heterogeneous data. Managing the urban economy needs to consider environmental restrictions, environmental monitoring tasks, engineering facilities, and transport. Operational control over the urban environment and the surrounding area can be produced using unmanned aerial vehicles (UAVs), and the collected data can be processed using a wide range of software and hardware technologies related to the field of artificial intelligence. However, along with any fairly new technology, intelligent unmanned technologies have both advantages and disadvantages. Strengths are mobility and efficiency, relative cheapness, the possibility of a high degree of automation, whereas weaknesses are short flight time, dependence on weather conditions, the certain outstanding tasks of data management and processing. This paper considers the possibilities of using intelligent unmanned technologies based on UAVs for solving the problems of monitoring the urban environment of the Kazakhstan megalopolises. Consideration is also being given to the scope for extending possibilities of applying these technologies to the field of environmental monitoring, monitoring of hazardous geological processes, technical constructions and vehicles. Furthermore, technological and economic issues, as well as necessary data processing technologies, are discussed. The economic effect of the use of IUVAT is estimated at $ 70-200 million, but it requires solving a set of data processing, control and technical problems. © 2020, Springer Nature Switzerland AG.",2020,Communications in Computer and Information Science,"Mukhamediev R., Kuchin Y., Yakunin K., Symagulov A., Ospanova M., Assanov I., Yelis M.",10.1007/978-3-030-65218-0_26,Conference Paper,9.5827636719,6.9015555382
7,278,3.0,NLOS multipath detection using convolutional neural network,,"In global navigation satellite system (GNSS) positioning, GNSS satellites are often obstructed by buildings, leading to reflected and diffracted signals, which are known as non-line-of-sight (NLOS) signals. Such signals cause major GNSS positioning (also known as “NLOS multipath”) errors. In this paper, a novel NLOS multipath detection technique using a machine-learning approach to improve the positioning accuracy in urban environments is proposed. The key idea behind this technique is to construct a classifier that discriminates NLOS multipath signals from the output of the multiple GNSS signal correlators of a software GNSS receiver. In the case of an NLOS signal, there are no direct signals; the first reflected signal has low power compared to a direct signal. Hence, the correlation function is expected to be more distorted in the case of an NLOS signal correlation. We use this phenomenon to detect NLOS signals. To consider the change in shape of the correlation values of NLOS signals and their temporal variation, we propose a method for constructing a convolutional neural network (CNN)-based NLOS discriminator. Furthermore, we propose a method for applying the NLOS probability, which is the output of the CNN, to the positioning calculation. To evaluate the proposed technique, we conducted NLOS classification experiments using signal correlation data acquired at different locations in the Shinjuku area of Japan. We compared the proposed method with a method using a simple NN. As the experiment results indicate, the proposed method can correctly discriminate approximately 98% of NLOS multipath signals, and the discrimination rate of the proposed CNN-based method is higher than that of the simple NN-based approach. Furthermore, we improved the positioning accuracy from 34.1 to 1.6 m using the proposed method and concluded that the proposed approach can increase the positioning accuracy in urban environments. © 2020 Proceedings of the 33rd International Technical Meeting of the Satellite Division of the Institute of Navigation, ION GNSS+ 2020. All rights reserved.",2020,"Proceedings of the 33rd International Technical Meeting of the Satellite Division of the Institute of Navigation, ION GNSS+ 2020","Suzuki T., Kusama K., Amano Y.",10.33012/2020.17663,Conference Paper,9.2287712097,6.720220089
7,279,1.0,A new method for non-line-of-sight GNSS signal detection for positioning accuracy improvement in urban environments,GNSS; MLSTM-FCN; NLOS detection; Time series features analysis; Urban environment,"The classification of the line-of-sight (LOS) and non-line-of-sight (NLOS) signals is one of the major problems for robust GNSS positioning and the shadow matching in urban environments. The existing techniques include the multi-sensor integration, 3D map aid, using a dual-polarized antenna, an omnidirectional camera aid are proposed to solve the classification problem. However, they all require external hardware or up-to-date map, which is expensive or impractical for mass-market applications. Consistency checking with the receiver autonomous integrity monitoring (RAIM) is widely used for the detection of NLOS signals, but it is efficient only when the majority of the received signals are LOS signals. Machine learning methods, including the decision tree, the support vector machine (SVM) have been explored to classify LOS and NLOS with good accuracy. However, all current machine learning based method only utilize information within one epoch, all the inter-epoch information and data features in time series are lost, and the information of signal propagation in the complex urban environments is not fully manifested in the Rinex level observation and NMEA level observations in one single epoch. In this paper, a multivariate Long Short Term Memory Fully Convolutional Network (MLSTM-FCN) based signal classification method is proposed. With the aid of the convolution layer and long short term memory block, this method handles the data features in both time domain and value domain. Six time series features of GNSS signal, including differenced C/N0, time differenced ambiguity, double difference phase and pseudorange, phase and pseudorange consistency are analyzed and used as the input of the MLSTM-FCN. Datasets from two locations in the urban Calgary are collected, each of which is used for training and testing purposes respectively. The results reveal that, compared to the SVM classification method, the overall testing accuracy of the newly proposed classifier is improved from 93.00% to 95.97% for the Rinex level observation, and from 92.99% to 93.83 for the NMEA level observation. This improved classification accuracy brought by the proposed classifier is encouraging since it will enhance the robustness of the conventional GNSS positioning and the shadow matching based navigation system by reducing unbounded NLOS signal errors in urban environments and result in significant improvement in positioning accuracy. Compared to the SVM classifier aided single point positioning (SPP) test, the accuracy in the form of RMS of the MLSTM-FCN aided SPP test can be improved by 24.3%, 17.8% and 24.4% in the East, North and Up directions respectively, and the rate of the valid solution can be increased from 99.02% to 99.94%. The new method has the potential to be widely applied by various receiver types with the output of the raw observation or only with the NMEA observations output. © 2020 Proceedings of the 33rd International Technical Meeting of the Satellite Division of the Institute of Navigation, ION GNSS+ 2020. All rights reserved.",2020,"Proceedings of the 33rd International Technical Meeting of the Satellite Division of the Institute of Navigation, ION GNSS+ 2020","Lyu Z., Gao Y.",10.33012/2020.17662,Conference Paper,9.2438583374,6.7204890251
7,284,5.0,Support Vector Machine for Path Loss Predictions in Urban Environment,Machine learning; Path loss; Radio network planning; Radio propagation; Support vector machine,"Path Loss (PL) propagation models are important for accurate radio network design and planning. In this paper, we propose a new radio propagation model for PL predictions in urban environment using Support Vector Machine (SVM). Field measurement campaigns are conducted in urban environment to obtain mobile network and path loss information of radio signals transmitted at 900, 1800 and 2100 MHz frequencies. SVM model is trained with field measurement data to predict path loss in urban propagation environment. Performance of SVM model is evaluated using Mean Absolute Error (MAE), Mean Square Error (MSE), Root Mean Square Error (RMSE) and Standard Error Deviation (SED). Results show that SVM achieve MAE, MSE, RMSE and SED of 7.953 dB, 99.966 dB, 9.998 dB and 9.940 dB respectively. SVM model outperforms existing empirical models (Okumura-Hata, COST 231, ECC-33 and Egli) with relatively low prediction error. © 2020, Springer Nature Switzerland AG.",2020,Lecture Notes in Computer Science (including subseries Lecture Notes in Artificial Intelligence and Lecture Notes in Bioinformatics),"Abolade R.O., Famakinde S.O., Popoola S.I., Oseni O.F., Atayero A.A., Misra S.",10.1007/978-3-030-58820-5_71,Conference Paper,9.3728122711,6.7546386719000004
7,285,70.0,Google Earth Engine Cloud Computing Platform for Remote Sensing Big Data Applications: A Comprehensive Review,Big data; cloud computing; Google Earth Engine (GEE); remote sensing (RS),"Remote sensing (RS) systems have been collecting massive volumes of datasets for decades, managing and analyzing of which are not practical using common software packages and desktop computing resources. In this regard, Google has developed a cloud computing platform, called Google Earth Engine (GEE), to effectively address the challenges of big data analysis. In particular, this platform facilitates processing big geo data over large areas and monitoring the environment for long periods of time. Although this platform was launched in 2010 and has proved its high potential for different applications, it has not been fully investigated and utilized for RS applications until recent years. Therefore, this study aims to comprehensively explore different aspects of the GEE platform, including its datasets, functions, advantages/limitations, and various applications. For this purpose, 450 journal articles published in 150 journals between January 2010 and May 2020 were studied. It was observed that Landsat and Sentinel datasets were extensively utilized by GEE users. Moreover, supervised machine learning algorithms, such as Random Forest, were more widely applied to image classification tasks. GEE has also been employed in a broad range of applications, such as Land Cover/land Use classification, hydrology, urban planning, natural disaster, climate analyses, and image processing. It was generally observed that the number of GEE publications have significantly increased during the past few years, and it is expected that GEE will be utilized by more users from different fields to resolve their big data processing challenges. © 2008-2012 IEEE.",2020,IEEE Journal of Selected Topics in Applied Earth Observations and Remote Sensing,"Amani M., Ghorbanian A., Ahmadi S.A., Kakooei M., Moghimi A., Mirmazloumi S.M., Moghaddam S.H.A., Mahdavi S., Ghahremanloo M., Parsian S., Wu Q., Brisco B.",10.1109/JSTARS.2020.3021052,Article,9.8371210098,7.0082182884
7,288,,A Machine Learning-Based Method for Predicting Urban Land Use,Artificial neural network; Land use; Machine learning; Urban planning and design,"Land use is one of the most basic elements of urban management. In urban planning and design, land use is often determined by experience and case studies. However, the development of urbanization has led to a combinatory trend for land use, and the land use of a plot is always impacted by the surrounding environment. In such a complex situation, it is difficult to find hidden relationships among types of land use by humans alone. Within artificial intelligence, machine learning can help find correlations among data. This paper presents a new method for learning the rules relating the known land use data and predicting the land use of a target plot by constructing an artificial neural network. We take Nanjing as a specific case and study the logic of its land use. The results not only demonstrate associations between the surroundings and the target but also show the feasibility of a combinatory land use index in urban planning and design. © 2020 and published by the Association for Computer-Aided Architectural Design Research in Asia (CAADRIA), Hong Kong.",2020,"RE: Anthropocene, Design in the Age of Humans - Proceedings of the 25th International Conference on Computer-Aided Architectural Design Research in Asia, CAADRIA 2020","Xia X., Tong Z.",,Conference Paper,9.780921936,6.7006764412
