Cluster,DocId,Cited by,Title,Author Keywords,Abstract,Year,Source title,Authors,DOI,Document Type,x,y
7,1,,Reconciling data-driven crime analysis with human-centered algorithms,Crime analysis; Machine learning; Social disorganization,"This study combines traditional statistical methods with machine learning to better understand locally relevant, contextual models for analyzing crime in two urban American cities. Using census tracts as the units of analysis and controlling for several structural characteristics associated with crime, we find that in Milwaukee, Wisconsin, violent crime is associated with concentrated disadvantage, residential stability, ethnic heterogeneity, total population, and spatial lag of violent crime. Yet, the most important variable is the spatial lag of violent crime, followed by residential stability, ethnic heterogeneity, total population, and concentrated disadvantage. In addition, we find that in Chicago, Illinois, violent crime is associated with immigration, owner-occupied housing, proportion in professional occupations, and proportion population with college degree or higher, as well as ethnic heterogeneity, total population, and the spatial lag for violent crime. Machine learning models suggest that for Chicago's violent crime, the most important variable is the spatial lag term for violent crime, followed by total population, immigration, college education or beyond, owner occupancy, ethnic heterogeneity, and employment in professional occupations. The findings for property crime are similar: in Milwaukee, we find that disadvantage, residential stability, ethnic heterogeneity, total population and spatial lag for property crime are significant predictors in the traditional regression models. However, the most important variable for property crime in Milwaukee is the spatial lag term, followed by total population, ethnic heterogeneity, residential stability and disadvantage. The statistically significant predictors of property crime in Chicago include immigration, owner-occupied housing units, living in the same house, proportion of workforce in professional occupations, college education and beyond, total population, and the spatial lag for property crime. In Chicago, the most important variable for property crime is the spatial lag term, then the total population, the proportion of individuals in professional occupations, concentrated immigration, college education and beyond, living in the same house, and the proportion of owner-occupied housing units. Urban planners must consider policies that can effectively reduce nearby crime and violence in all cities that experience high crime levels, but also design locally responsive policies that make sense within a local context: in Milwaukee, residential stability matters more for violent crime than for property crime, while in Chicago, total population is similarly important for both violent crime and property crime. In Milwaukee, ethnic heterogeneity is similarly important for violent and property crime, while in Chicago, ethnic heterogeneity is not a very important variable for violent crime and it is not a significant predictor of property crime. Therefore, urban policy must differently approach social disorganization indicators and support the nuances of the local context for urban planning and policy. © 2022 Elsevier Ltd",2022,Cities,"Clancy K., Chudzik J., Snowden A.J., Guha S.",10.1016/j.cities.2022.103604,Article,9.8339548111,6.6261234283
7,3,,Spatiotemporal patterns and mechanisms of street vending from the social sensing perspective: A comparison between law-enforcement reported and residents complain events,High-frequency; Perception bias; Smart urban governance; Social sensing; Spatiotemporal big data; Street vending,"Street vending is an important part of the urban informal economy, especially in developing countries. How to control its negative externalities while augmenting its positive roles in the urban socio-economic system poses challenges to urban planning and governance. Existing studies have insufficiently addressed the issue largely due to the lack of high-frequent observation data for street vending events. By introducing socially sensed big data from the smart urban governance platform, as well as records from the “12345” urban problem complaint hotline of Jiangbei District, Ningbo, China, this paper examines and compares the spatiotemporal patterns and occurrence mechanisms of street vending events from both the urban managers' “top-down” and the urban residents' “bottom-up” points of view. Statistical and machine learning models show that the distribution of street vending activities as sensed by the two subjects does not overlap. The former concentrates in central urban areas and work times, while the latter is scattered distributed in everyday life-related places and times. The findings reaffirm the existence of perception bias in social sensing data and show the potential for utilizing such bias to nudge better urban governance practices. Theoretically and empirically, this research has contributed to promoting the people-oriented transformation of urban governance. © 2022",2022,Cities,"Li C., Huang Y., Shen Y., Xu L.",10.1016/j.cities.2022.103597,Article,9.7776784897,6.6354250908
7,5,,A comprehensive study of the COVID-19 impact on PM2.5 levels over the contiguous United States: A deep learning approach,Community multiscale air quality (CMAQ) model; COVID-19; Deep convolutional neural network; Google mobility reports; PM2.5 estimation; United States,"We investigate the impact of the COVID-19 outbreak on PM2.5 levels in eleven urban environments across the United States: Washington DC, New York, Boston, Chicago, Los Angeles, Houston, Dallas, Philadelphia, Detroit, Phoenix, and Seattle. We estimate daily PM2.5 levels over the contiguous U.S. in March–May 2019 and 2020, and leveraging a deep convolutional neural network, we find a correlation coefficient, an index of agreement, a mean absolute bias, and a root mean square error of 0.90 (0.90), 0.95 (0.95), 1.34 (1.24) μg/m3, and 2.04 (1.87) μg/m3, respectively. Results from Google Community Mobility Reports and estimated PM2.5 concentrations show a greater reduction of PM2.5 in regions with larger decreases in human mobility and those in which individuals remain in their residential areas longer. The relationship between vehicular PM2.5 (i.e., the ratio of vehicular PM2.5 to other sources of PM2.5) emissions and PM2.5 reductions (R = 0.77) in various regions indicates that regions with higher emissions of vehicular PM2.5 generally experience greater decreases in PM2.5. While most of the urban environments ⸺ Washington DC, New York, Boston, Chicago, Los Angeles, Houston, Dallas, Philadelphia, Detroit, and Seattle ⸺ show a decrease in PM2.5 levels by 21.1%, 20.7%, 18.5%, 8.05%, 3.29%, 3.63%, 6.71%, 4.82%, 13.5%, and 7.73%, respectively, between March–May of 2020 and 2019, Phoenix shows a 5.5% increase during the same period. Similar to their PM2.5 reductions, Washington DC, New York, and Boston, compared to other cities, exhibit the highest reductions in human mobility and the highest vehicular PM2.5 emissions, highlighting the great impact of human activity on PM2.5 changes in eleven regions. Moreover, compared to changes in meteorological factors, changes in pollutant concentrations, including those of black carbon, organic carbon, SO2, SO4, and especially NO2, appear to have had a significantly greater impact on PM2.5 changes during the study period. © 2022 Elsevier Ltd",2022,Atmospheric Environment,"Ghahremanloo M., Lops Y., Choi Y., Jung J., Mousavinezhad S., Hammond D.",10.1016/j.atmosenv.2022.118944,Article,9.7828931808,6.6773152351
7,6,,Generative Adversarial Network Approach to Future Sermonizing of Housing Dispersal in Emerging Cities,Emerging cities; Generative adversarial network; Housing dispersal; Machine learning; Urban growth,"This study aims to visualize the future housing dispersal of expatriates, based on the predicted urban growth in emerging cities. Generalized adversarial networks (GANs) will be utilized to predict the future urban growth of Doha Metropolitan emerging city. The housing dispersal of expatriates will be visualized on the predicted urban growth map to investigate housing preferences, which will be based on Gordon's theory. This study will prove the feasibility of a process approach when practicing the management of urban growth in emerging cities worldwide. It could be a robust solution for the worsening imbalance in the urban morphology of metropolitan cities. The findings of the broad-spectrum housing dispersal guidelines could benefit the policymakers and planners for the realities of spatial patterns and future urban growth. © 2021 American Society of Civil Engineers.",2022,Journal of Urban Planning and Development,"Ibrahim H., Khattab Z., Khattab T., Abraham R.",10.1061/(ASCE)UP.1943-5444.0000783,Article,9.7192344666,6.7585597038
7,7,,Supervised Machine Learning Approaches to Modeling Residential Infill Development in the City of Los Angeles,,"While infill development is widely accepted by cities as an alternative to urban sprawl, a very dearth of research has attempted to measure infill development and identify contributing factors to infill development. Filling this research gap, this paper models residential infill development in the City of Los Angeles by employing five machine learning (ML) algorithms. This paper attempts to identify the best-performing ML algorithms by comparing the performance of the ML algorithms. Of the five ML algorithms tested, the random forest (RF) and k-nearest neighbor (kNN) algorithms are selected as the best-performing algorithms. The RF algorithm ranks independent variables from most to least important. Overall, the ranks suggested that residential infill development in the City of Los Angeles is significantly influenced by the physical conditions of property and neighborhood rather than socioeconomic characteristics. Diverse land uses, good housing mixes, and rail transit accessibility also, importantly, contributed to the infill development. This finding suggests that the city's planning efforts, such as the promotion of accessory dwelling unit (ADU) development and the expansion of rail transit, can create a virtuous circle for sustainable urban development. © 2021 American Society of Civil Engineers.",2022,Journal of Urban Planning and Development,"Kim D., Shim J., Park J., Cho J., Kumar S.",10.1061/(ASCE)UP.1943-5444.0000787,Article,9.9848642349,6.7421860695
7,12,,Investigation of Airflow around Buildings using Large-Eddy Simulations for Unmanned Aircraft Systems Applications,,"The ever-increasing demand for Unmanned Aircraft Systems (UAS) has led to the desire for integrating them into spaces in close proximity of humans like dense urban spaces, a reality previously thought of as inconceivable. One of the main concerns to be addressed before its widespread adoption is safety, especially in areas of operation adjacent to structures like buildings. This work investigates the effect of building geometries on the flow field in a simplified urban setup consisting of an isolated building to predict their potential impacts on UAS operations. Unanticipated wind gusts or turbulent flow conditions prevalent around various structures constitute a significant challenge for UAS operations in urban environments. We use Large-Eddy Simulation to better understand the unsteady and highly coherent turbulent flow structures produced by buildings in neutral atmospheric boundary layer flow. Furthermore, we also demonstrate a non-intrusive machine learning methodology to predict flow fields to augment safe wind-aware navigation systems for Unmanned Aerial Vehicles as a first step towards safely integrating UAS into existing aerial infrastructure. © 2022, American Institute of Aeronautics and Astronautics Inc.. All rights reserved.",2022,"AIAA Science and Technology Forum and Exposition, AIAA SciTech Forum 2022","Landua T.R., Vuppala R.K.S.S., Kara K.",10.2514/6.2022-1688,Conference Paper,9.4656963348,6.8111095428
7,14,,"A hybrid Daily PM2.5 concentration prediction model based on secondary decomposition algorithm, mode recombination technique and deep learning",Adaptive variational mode decomposition; Complete ensemble empirical mode decomposition with adaptive noise; Long short-term memory network; PM2.5 concentration prediction; Sample entropy,"Accurate and effective PM2.5 concentration prediction has important implications for public health and the ecological environment. To provide more accurate early warnings for haze prevention, urban planning, and people's travel planning, this paper proposes a new combined PM2.5 concentration prediction model. Firstly, the original sequence is decomposed by complete ensemble empirical mode decomposition with adaptive noise (CEEMDAN), followed by decomposition and reconstruction of the data by adaptive variational mode decomposition (AVMD) and sample entropy (SE), and then the reconstructed subseries are predicted by long and short-term memory networks (LSTM). The empirical analysis was carried out with three datasets from Beijing, Tianjin, and Baoding, and the following conclusions can be drawn: (1) The validity and robustness of the proposed model were verified, with R2 (0.982), RMSE (2.792), and MAPE (9.088%) being optimal in all comparison experiments. (2) The incorporation of secondary decomposition and pattern reorganization algorithms can effectively handle data with high volatility and non-linearity. (3) Compared with traditional machine learning models, the long and short-term memory network is more suitable for time series prediction. The model provides a novel and effective PM2.5 concentration prediction tool for the government and the public. © 2022, The Author(s), under exclusive licence to Springer-Verlag GmbH Germany, part of Springer Nature.",2022,Stochastic Environmental Research and Risk Assessment,"Sun W., Xu Z.",10.1007/s00477-021-02100-2,Article,9.7084054947,6.6346492767
7,15,,Automatic identification of addresses: A systematic literature review,Address geocoding; Address matching; Address parsing; Deep learning; Machine learning; Natural language processing,"Address matching continues to play a central role at various levels, through geocoding and data integration from different sources, with a view to promote activities such as urban planning, location-based services, and the construction of databases like those used in census operations. However, the task of address matching continues to face several challenges, such as non-standard or incomplete address records or addresses written in more complex languages. In order to better understand how current limitations can be overcome, this paper conducted a systematic literature review focused on automated approaches to address matching and their evolution across time. The Preferred Reporting Items for Systematic Reviews and Meta-Analyses (PRISMA) guidelines were followed, resulting in a final set of 41 papers published between 2002 and 2021, the great majority of which are after 2017, with Chinese authors leading the way. The main findings revealed a consistent move from more traditional approaches to deep learning methods based on semantics, encoder-decoder architectures, and attention mechanisms, as well as the very recent adoption of hybrid approaches making an increased use of spatial constraints and entities. The adoption of evolutionary-based approaches and privacy preserving methods stand as some of the research gaps to address in future studies. © 2021 by the authors. Licensee MDPI, Basel, Switzerland.",2022,ISPRS International Journal of Geo-Information,"Cruz P., Vanneschi L., Painho M., Rita P.",10.3390/ijgi11010011,Review,9.7655687332,6.9651837349
7,17,,Spatio-temporal prediction and factor identification of urban air quality using support vector machine,Air quality prediction; Geographic information system; Machine learning; Spatio-temporal features; Support vector machine,"Accurate air quality prediction can provide better supervision and reference for management policies. Due to difficulties in data acquisition, combined spatio-temporal prediction is still inconclusive. This study utilizes the support vector machine (SVM) method to predict air quality of unknown space and time. Extracted from a geographic information system (GIS), geographic features such as population, land use, economy, pollution sources, and terrain parameters were added to a time series. Temporal prediction was first executed in the reference stations, and the predicted air quality index (AQI) was then used to spatially infer the future AQI of unknown locations. Verification indicated high accuracy for short-term temporal prediction. Various meteorological and climatic effects were observed to be influential in seasonal difference. In the spatial inference stage, urbanization and city types were spatial features that appeared to impact air quality. Agriculture and forest use, transportation use, residential use, and economic factors were clearly correlated to AQIs, whereas population and labor force were not. This study establishes a prediction framework in northern Taipei based on SVM. Other locations can build their own models based on local actual data to achieve better decision-making, urban planning, or other applications. © 2021 Elsevier B.V.",2022,Urban Climate,"Liu C.-C., Lin T.-C., Yuan K.-Y., Chiueh P.-T.",10.1016/j.uclim.2021.101055,Article,9.8371610641,6.6652259827
7,19,,Predicting citywide distribution of air pollution using mobile monitoring and three-dimensional urban structure,Air pollution; Mobile monitoring; Spatial prediction; STURLA; Urban structure,"Understanding relationships between urban structure patterns and air pollutants is key to sustainable urban planning. In this study, we employ a mobile monitoring method to collect PM2.5 and BC data in the city of Philadelphia, PA during the summer of 2019 and apply the Structure of Urban Landscapes (STURLA) methodology to examine relationships between urban structure and atmospheric pollution. We find that PM2.5 and BC vary by STURLA class, and some classes exhibit significant difference in pollution concentrations. We also find that the proportions in which STURLA components are present throughout the urban landscape can be used to predict the spatial distribution of urban air pollution. Among frequently sampled STURLA classes, gpl (grass, pavement, and low-rise buildings) hosted the highest PM2.5 concentrations on average (16.60 ± 4.29 µg/m3), while tgbwp (trees, grass, bare soil, water, pavement) hosted the highest BC concentrations (2.31 ± 1.94 µg/m3). Furthermore, STURLA combined with machine learning modeling was able to correlate PM2.5 (R2= 0.68, RMSE 2.82 µg/m3) and BC (R2 = 0.64, RMSE 0.75 µg/m3) concentrations with urban landscape composition and interpolate concentrations throughout the city. These results demonstrate the efficacy of the STURLA methodology in modeling relationships between air pollution and urban structure patterns. © 2021 Elsevier Ltd",2022,Sustainable Cities and Society,"Cummings L.E., Stewart J.D., Kremer P., Shakya K.M.",10.1016/j.scs.2021.103510,Article,9.8151540756,6.6903047562
7,20,,Cultivating historical heritage area vitality using urban morphology approach based on big data and machine learning,Heritage conservation; Historical heritage; Urban morphology; Urban planning; Vitality,"The conservation of historical heritage can bring social benefits to cities by promoting community economic development and societal creativity. In the early stages of historical heritage conservation, the focus was on the museum-style concept for individual structures. At present, heritage area vitality is often adopted as a general conservation method to increase the vibrancy of such areas. However, it remains unclear whether urban morphological elements suitable for urban areas can be applied to heritage areas. This study uses ridge regression and LightGBM with multi-source big geospatial data to explore whether urban morphological elements that affect the vitality of heritage and urban areas are consistent or have different spatial distributions and daily variations. From a sample of 12 Chinese cities, our analysis shows the following results. First, factors affecting urban vitality differ from those influencing heritage areas. Second, factors influencing urban and heritage areas' vitality have diurnal variations and differ across cities. The overarching contribution of this study is to propose a quantitative and replicable framework for heritage adaptation, combining urban morphology and vitality measures derived from big geospatial data. This study also extends the understanding of forms of heritage areas and provides theoretical support for heritage conservation, urban construction, and economic development. © 2021 The Authors",2022,"Computers, Environment and Urban Systems","Wu J., Lu Y., Gao H., Wang M.",10.1016/j.compenvurbsys.2021.101716,Article,9.7501344681,6.6467676163
7,21,2.0,Do land policies make a difference? A data-driven approach to trace effects on urban form in France and Germany,Comparative; land policy; random forest; urban analytics; urban form,"Against the backdrop of rapidly expanding urban structures, land policies in many countries have been adapted to contain and redirect growth to existing urban structures. However, obstacles remain to measure the effects of policies. In the meantime, geoinformation technologies have given rise to a wide range of approaches to measure and describe urban form. Nevertheless, its application for the assessment of land policy has a high, but not yet fully exploited, potential. It is thus the aim of this research to address and investigate the options of spatial analysis and machine learning in particular to analyse urban form from a land policy perspective. To do so, we develop urban metrics informed by urban planning and land readjustment policies of two countries describing urban form on different spatial levels. We therefore formulate hypotheses on causal relations between policy and form. Based on the metrics, we apply the random forest algorithm to classify the building stock of the region. We then extract the residential areas, those with single-family houses, as this is where the effects of the policy are considered most visible. In a next step, we use random forest to predict the nationality of a building. Through variable importance measures, we identify and discuss urban morphological differences between the two countries and test the hypotheses on effects of land policies. We develop and test the approach for the French-German city-region of Strasbourg using OpenStreetMap data. We identify significant differences in the building coverage ratios, which tend to be higher in Germany. This can be linked to differences in planning regulations. Furthermore, German residential areas appear to be more diverse in urban form. Differences in land readjustment policies have proven to be plausible here, as French policies favour strong actors that develop residential areas more uniformly. In Germany, policies favour fragmented ownership-oriented development of residential areas. The metrics and the applied algorithm for building classification have proven to be robust in terms of data heterogeneity and have shown high levels of accuracy. They could also be successfully used for tracing causal relations. © The Author(s) 2021.",2022,Environment and Planning B: Urban Analytics and City Science,"Jehling M., Hecht R.",10.1177/2399808321995818,Article,10.0856180191,6.9001383781
7,24,1.0,Urban soils as a spatial indicator of quality for urban socio-ecological systems,Andes; Cities; Environmental Quality; Machine learning; Volcanic urban soils,"The development of criteria and indicators to quantify the transition to sustainability of the urban socio-ecological systems quality is determinant for planning policies and the 21st century urban agenda. This study models the spatial variation in the concentration and distribution of some macronutrients, micronutrients, and trace nutrients in the soil of a high-altitude city in the Andes. Meanwhile, machine learning methods were employed to study some interactions between the different dimensions that constitute an urban socio-ecosystem that caused these variations. We proposed a methodology that considered two phases: a) field work to collect data on 300 soil samples; laboratory analysis to measure the concentrations of 24 macronutrients, micronutrients, and trace nutrients; and the design of geophysical, spectral, and urban co-variables; b) statistical and geo-informatics analysis, where multivariate analysis grouped the elements into factors; and, machine learning integrated with co-variables was applied to derive the intensity of each factor across the city. Multivariate statistics described the variation in soil co-concentrations with a moderate percentage (42%). Four factors were determined that grouped some of the analyzed elements, as follows: F1 (Zn, S, Cu, Pb, Ni, and Cr), F2 (Ba, Ag, K, In, and Mg), F3 (B, V, Li, and Sr), and F4 (Si and Mn). The percentage R2 out-of-bag of the spatial model were: F1 = 20%, F2 = 8%, F3 = 14%, and F4 = 10%. Our outputs show that the enrichment and contamination by anthropogenic factors, such as the increase in population density, land use, road network, and traffic generated by fossil fuel vehicles, should be prioritized in urban planning decisions. © 2021",2021,Journal of Environmental Management,"Bonilla-Bedoya S., López-Ulloa M., Mora-Garcés A., Macedo-Pezzopane J.E., Salazar L., Herrera M.Á.",10.1016/j.jenvman.2021.113556,Article,10.0356502533,6.8107981682
