Cluster,DocId,Cited by,Title,Author Keywords,Abstract,Year,Source title,Authors,DOI,Document Type,x,y
7,113,1.0,A refined method of high-resolution remote sensing change detection based on machine learning for newly constructed building areas,Areas registration; Change detection; Deep learning; High-resolution remote sensing; Newly constructed building areas; SVM,"Automatic detection of newly constructed building areas (NCBAs) plays an important role in addressing issues of ecological environment monitoring, urban management, and urban planning. Compared with low-and-middle resolution remote sensing images, high-resolution remote sensing images are superior in spatial resolution and display of refined spatial details. Yet its problems of spectral heterogeneity and complexity have impeded research of change detection for high-resolution remote sensing images. As generalized machine learning (including deep learning) technologies proceed, the efficiency and accuracy of recognition for ground-object in remote sensing have been substantially improved, providing a new solution for change detection of high-resolution remote sensing images. To this end, this study proposes a refined NCBAs detection method consisting of four parts based on generalized machine learning: (1) pre-processing; (2) candidate NCBAs are obtained by means of bi-temporal building masks acquired by deep learning semantic segmentation, and then registered one by one; (3) rules and support vector machine (SVM) are jointly adopted for classification of NCBAs with high, medium and low confidence; and (4) the final vectors of NCBAs are obtained by post-processing. In addition, area-based and pixel-based methods are adopted for accuracy assessment. Firstly, the proposed method is applied to three groups of GF1 images covering the urban fringe areas of Jinan, whose experimental results are divided into three categories: high, high-medium, and high-medium-low confidence. The results show that NCBAs of high confidence share the highest F1 score and the best overall effect. Therefore, only NCBAs of high confidence are considered to be the final detection result by this method. Specifically, in NCBAs detection for three groups GF1 images in Jinan, the mean Recall of area-based and pixel-based assessment methods reach around 77% and 91%, respectively, the mean Pixel Accuracy (PA) 88% and 92%, and the mean F1 82% and 91%, confirming the effectiveness of this method on GF1. Similarly, the proposed method is applied to two groups of ZY302 images in Xi’an and Kunming. The scores of F1 for two groups of ZY302 images are also above 90% respectively, confirming the effectiveness of this method on ZY302. It can be concluded that adoption of area registration improves registration efficiency, and the joint use of prior rules and SVM classifier with probability features could avoid over and missing detection for NCBAs. In practical applications, this method is contributive to automatic NCBAs detection from high-resolution remote sensing images. © 2021 by the authors. Licensee MDPI, Basel, Switzerland.",2021,Remote Sensing,"Wang H., Qi J., Lei Y., Wu J., Li B., Jia Y.",10.3390/rs13081507,Article,9.5689849854,6.8171539307
7,122,4.0,Safe cities in the new urban world: A comparative cluster dynamics analysis through machine learning,Cluster analysis; Global cities; Machine learning; Magnetism; New Urban World; Safety; Security,"Cities in the ‘New Urban World’ display an enormous diversity in appearance, growth and performance. The awareness is growing that the urban development potential (‘magnetism’) of cities is closely related to safety and security conditions in these cities. This paper develops a new analytical framework based on a wealth of empirical data on both safety/security and socio-economic magnetism achievements of many world cities, by combining two comprehensive relevant global urban data bases. The aim of the study is to offer a comparative analysis of the combined safety/security data and socio-economic performance data of 30 global cities, through the use of an advanced sequential cluster dynamics analysis that is (partly) inspired by a novel machine learning approach (using Python software). In this way, cities can be categorized according to their quantitative characteristic features represented by the relevant clusters. It appears that city safety/security features are an important predictor of the variability in overall urban performance regarding magnetism. This study allows also for drawing relevant policy lessons. © 2020",2021,Sustainable Cities and Society,"Kourtit K., Marinescu Pele M.M., Nijkamp P., Traian Pele D.",10.1016/j.scs.2020.102665,Article,9.6907300949,6.7568449974
7,126,2.0,Geosilhouettes: Geographical measures of cluster fit,clustering; Data science; segregation; unsupervised learning; urban sociology,"Regionalization, under various guises and descriptions, is a longstanding and pervasive interest of urban studies. With an increasingly large number of studies on urban place detection in language, behavior, pricing, and demography, recent critiques of longstanding regional science perspectives on place detection have focused on the arbitrariness and non-geographical nature of measures of best fit. In this paper, we develop new explicitly geographical measures of cluster fit. These hybrid spatial–social measures, called geosilhouettes, are demonstrated to capture the “core” of geographical clusters in racial data on census blocks in Brooklyn neighborhoods. These new geosilhouettes are also useful in a variety of boundary analysis and outlier detection problems. In this paper, the thinking behind geosilhouettes is presented, their mathematical form is defined, they are demonstrated, and new directions of research are discussed. © The Author(s) 2019.",2021,Environment and Planning B: Urban Analytics and City Science,"Wolf L.J., Knaap E., Rey S.",10.1177/2399808319875752,Article,9.897397995,6.7996249199
7,131,11.0,"Rainfall-induced shallow landslide detachment, transit and runout susceptibility mapping by integrating machine learning techniques and gis-based approaches",Cinque Terre National Park; GISbased approach; Machine learning; Reach angle; Runout modeling; Shallow landslides; Susceptibility mapping,"Rainfall-induced shallow landslides represent a serious threat in hilly and mountain areas around the world. The mountainous landscape of the Cinque Terre (eastern Liguria, Italy) is increasingly popular for both Italian and foreign tourists, most of which visit this outstanding terraced coastal landscape to enjoy a beach holiday and to practice hiking. However, this area is characterized by a high level of landslide hazard due to intense rainfalls that periodically affect its rugged and steep territory. One of the most severe events occurred on 25 October 2011, causing several fatalities and damage for millions of euros. To adequately address the issues related to shallow landslide risk, it is essential to develop landslide susceptibility models as reliable as possible. Regrettably, most of the current land-use and urban planning approaches only consider the susceptibility to landslide detachment, neglecting transit and runout processes. In this study, the adoption of a combined approach allowed to estimate shallow landslide susceptibility to both detachment and potential runout. At first, landslide triggering susceptibility was assessed using Machine Learning techniques and applying the Ensemble approach. Nine predisposing factors were chosen, while a database of about 300 rainfall-induced shallow landslides was used as input. Then, a Geographical Information System (GIS)-based procedure was applied to estimate the potential landslide runout using the “reach angle” method. Information from such analyses was combined to obtain a susceptibility map describing detachment, transit, and runout. The obtained susceptibility map will be helpful for land planning, as well as for decision makers and stakeholders, to predict areas where rainfall-induced shallow landslides are likely to occur in the future and to identify areas where hazard mitigation measures are needed. © 2021 by the authors. Licensee MDPI, Basel, Switzerland.",2021,Water (Switzerland),"Di Napoli M., Di Martire D., Bausilio G., Calcaterra D., Confuorto P., Firpo M., Pepe G., Cevasco A.",10.3390/w13040488,Article,10.1311817169,6.7991628646999995
7,132,1.0,4D building reconstruction with machine learning and historical maps,3D building modelling; 4D city modelling; Historical maps; Machine learning,"The increasing importance of three-dimensional (3D) city modelling is linked to these data’s different applications and advantages in many domains. Images and Light Detection and Ranging (LiDAR) data availability are now an evident and unavoidable prerequisite, not always verified for past scenarios. Indeed, historical maps are often the only source of information when dealing with historical scenarios or multi-temporal (4D) digital representations. The paper presents a methodology to derive 4D building models in the level of detail 1 (LoD1), inferring missing height information through machine learning techniques. The aim is to realise 4D LoD1 buildings for geospatial analyses and visualisation, valorising historical data, and urban studies. Several machine learning regression techniques are analysed and employed for deriving missing height data from digitised multi-temporal maps. The implemented method relies on geometric, neighbours, and categorical attributes for height prediction. Derived elevation data are then used for 4D building reconstructions, offering multitemporal versions of the considered urban scenarios. Various evaluation metrics are also presented for tackling the common issue of lack of ground-truth information within historical data. © 2021 by the authors. Licensee MDPI, Basel, Switzerland.",2021,Applied Sciences (Switzerland),"Farella E.M., Özdemir E., Remondino F.",10.3390/app11041445,Article,9.5503482819,6.8913369179
7,140,,A glimpse into the future of exposure and vulnerabilities in cities? Modelling of residential location choice of urban population with random forest,,"The most common approach to assessing natural hazard risk is investigating the willingness to pay in the presence or absence of such risk. In this work, we propose a new, machine-learning-based, indirect approach to the problem, i.e. through residential-choice modelling. Especially in urban environments, exposure and vulnerability are highly dynamic risk components, both being shaped by a complex and continuous reorganization and redistribution of assets within the urban space, including the (re-)location of urban dwellers. By modelling residential-choice behaviour in the city of Leipzig, Germany, we seek to examine how exposure and vulnerabilities are shaped by the residential-location-choice process. The proposed approach reveals hot spots and cold spots of residential choice for distinct socioeconomic groups exhibiting heterogeneous preferences. We discuss the relationship between observed patterns and disaster risk through the lens of exposure and vulnerability, as well as links to urban planning, and explore how the proposed methodology may contribute to predicting future trends in exposure, vulnerability, and risk through this analytical focus. Avenues for future research include the operational strengthening of these linkages for more effective disaster risk management. © 2021 American Institute of Physics Inc.. All rights reserved.",2021,Natural Hazards and Earth System Sciences,"Scheuer S., Haase D., Haase A., Wolff M., Wellmann T.",10.5194/nhess-21-203-2021,Article,10.045879364,6.8162045479
7,142,,Research on Seasonal PM 2.5 Predication in Hangzhou City Based on SSA-ELM Model,correlation analysis; extreme learning machine; seasonal PM2. 5 forecast; sparrow search algorithm,"PM2.5 concentration is the main factor of air pollution, and accurate prediction of PM2.5 concentration can provide better preventive measures for urban governance. This paper selects the pollutant data and meteorological data of Hangzhou from 2016 to 2020 to analyze the influence of seasonal factors, pollutant factors and meteorological factors on PM2.5 concentration in Hangzhou. The results show that the concentration of PM2.5 varies significantly in different seasons, so this paper adopts the method of seasonal prediction. The Pearson correlation index is used to select the influence factors strongly related to the PM2.5 concentration value as the input variables of the model. Using Particle Swarm Optimization Random Forest (PSO-RF), Particle Swarm Optimization BP neural network (PSO-BP) and Sparrow Search Algorithm Extreme Learning Machine (SSA-ELM) model to predict Hangzhou PM2.5 concentration values in the four seasons of the city. Through the performance comparison of Root Mean Square Error (RMSE), Mean Absolute Error (MAE) and coefficient of certainty (R2), the results show that the prediction performance of SSA-ELM model is better than other models. In different season forecasts, the error value corresponding to summer is the smallest, R2 is higher, and the fitting effect is the best. © 2021 IEEE.",2021,"Proceedings - 2021 7th Annual International Conference on Network and Information Systems for Computers, ICNISC 2021","Liu B., Ye S.",10.1109/ICNISC54316.2021.00098,Conference Paper,9.7860078812,6.6356153488
7,146,,Intelligent image labeling system for recognizing traffic violations,Automatic image labeling; Comfortable urban environment; Intelligent system; Neural networks; OpenCV; Traffic violations; YOLO convolutional neural network,"The article examines the problems of traffic violations and possible changes in the city, including in the road infrastructure, based on their analysis. A conclusion is made about the applicability of machine learning methods for preparing and marking images for solving the problem. The article describes in detail the algorithms for automatic marking of images for recognizing traffic violations in order to create a comfortable urban environment. The existing information systems that solve this problem are analyzed, with an indication of their strengths and weaknesses. The description of an intelligent system developed by the authors and combining manual and automatic object recognition is given. The system development tools are described, including the libraries used. The experimental part contains the results of testing the system, incl. neural network training. Information on the number of images and objects on them is given, as well as information on the percentage of correctly detected objects for the automatic image labeling. © 2021 Copyright for this paper by its authors.",2021,CEUR Workshop Proceedings,"Titarev D., Korostelyov D., Titarev V., Kopeliovich D.",,Conference Paper,9.0734004974,6.7122635841000005
7,149,1.0,Autonomous 3-D UAV Localization Using Cellular Networks: Deep Supervised Learning Versus Reinforcement Learning Approaches,5G; deep learning; neural networks; optimization; Q-learning; reinforcement learning; UAV 3-D autonomous localization,"Unmanned aerial vehicles (UAVs) are becoming an integral part of numerous commercial and military applications. In many of these applications, the UAV is required to self-navigate in highly dynamic urban environments. This means that the UAV must have the ability to determine its location in an autonomous and real time manner. Existing localization techniques rely mainly on the Global Positioning System (GPS) and do not provide a reliable real time localization solution, particularly in dense urban environments. Our objective is to propose an effective alternative solution to enable the UAV to autonomously determine its location independent of the GPS and without message exchanges. We therefore propose utilizing the existing 5G cellular infrastructure to enable the UAV to determine its 3-D location without the need to interact with the cellular network. We formulate the UAV localization problem to minimize the error of the RSSI measurements from the surrounding cellular base stations. While exact optimization techniques can be applied to accurately solve such a problem, they cannot provide the real time calculation that is needed in such dynamic applications. Machine learning based techniques are strong candidates to provide an attractive alternative to provide a near-optimal localization solution with the needed practical real-time calculation. Accordingly, we propose two machine learning-based approaches, namely, deep neural network and reinforcement learning based approaches, to solve the formulated UAV localization problem in real time. We then provide a detailed comparative analysis for each of the proposed localization techniques along with a comparison with the optimization-based techniques as well as other techniques from the literature. © 2013 IEEE.",2021,IEEE Access,"Afifi G., Gadallah Y.",10.1109/ACCESS.2021.3126775,Article,9.259016037,6.7640471458
7,158,,Development of a Methodology for Complex Monitoring of the Development of Urban and Suburban Areas Based on the Intellectual Analysis of Earth Remote Sensing Data and Geospatial Technologies,Area monitoring; Intelligent analysis; Machine learning; Remote sensing data; Urban area,"Over the past half century, mankind is increasingly faced with the problems of rational use of the Earth’s territories and its resources without negative impact on the environment and the person himself. The organization of human life activity requires solving the issues of urban planning and the correct distribution of zones for the construction of industrial facilities, recreation, waste disposal zones, communications, routes, etc. Balanced planning is based on monitoring the current state of infrastructure and territory. This article proposes a methodology for integrated monitoring of the development of urban and suburban areas. It is proposed to use Earth remote sensing data as a basis for the study. The issues of collection, integration and intelligent processing of satellite images are considered. The definition and segmentation of objects in images to create digital maps is performed based on machine learning algorithms. © 2021, Springer Nature Switzerland AG.",2021,Communications in Computer and Information Science,"Malikov V., Sadovnikova N., Parygin D., Aleshkevich A., Savina O.",10.1007/978-3-030-87034-8_29,Conference Paper,9.7952203751,6.9585638046
7,159,1.0,Predicting susceptibility to landslides under climate change impacts in metropolitan areas of South Korea using machine learning,Climate change adaptation; disaster management; landslide susceptibility; random forest; representative concentration pathway,"Landslides cause considerable damage to life and property worldwide. In order to prevent and respond to landslides, it is necessary to identify vulnerable areas. This study identified areas that are likely to be damaged by landslides and aimed to predict future landslides. We compared and analyzed areas using machine learning (ML) algorithms, and conducted susceptibility mapping and landslide prediction using an algorithm that produced excellent results. For landslide predictions, the probability distribution of precipitation in the representative concentration pathway scenario 8.5 was used. We accounted for future uncertainties by using several regional climate model scenarios. Comparing the performances of different ML algorithms, the overall prediction accuracy of the random forest (0.932) was excellent. Susceptibility to landslides in the future determined using the random forest and five other regional climate models exhibited minor differences, but the average susceptibility increased over time. In addition, many urban areas are distributed around forest areas that have high landslide vulnerabilities, which provide important perspectives for urban and environmental planning. © 2021 The Author(s). Published by Informa UK Limited, trading as Taylor & Francis Group.",2021,"Geomatics, Natural Hazards and Risk","Park S.-J., Lee D.-K.",10.1080/19475705.2021.1963328,Article,10.0370769501,6.7413964272
7,164,,Machine Learning Predictors for Sustainable Urban Planning,machine learning; sustainable development; urban development classification model; urban development predictors; Urban planning,"While essential for economic reasons, rapid urbanization has had many negative impacts on the environment and the social wellbeing of humanity. Heavy traffic, unexpected geohazards are some of the effects of uncontrollable development. This situation points its fingerto urban planning and design; there are numerous automation tools to help urban planners assess and forecast, yet unplanned development still occurs, impeding sustainability. Automation tools use machine learning classification models to analyze spatial data and various trend views before planning a new urban development. Although there are many sophisticated tools and massive datasets, big cities with colossal migration still witness traffic jams, pollution, and environmental degradation affecting urban dwellers’ quality. This study will analyze the current predictors in urban planning machine learning models and identify the suitable predictors to support sustainable urban planning. A correct set of predictors could improve the efficiency of the urban development classification models and help urban planners to enhance the quality of life in big cities. © 2021. All Rights Reserved.",2021,International Journal of Advanced Computer Science and Applications,"Nagappan S.D., Daud S.M.",10.14569/IJACSA.2021.0120787,Article,9.6720838547,6.7455763817
7,167,,Detection of Urban Built-Up Area Change from Sentinel-2 Images Using Multiband Temporal Texture and One-Class Random Forest,Built-up area change; improved one-class random forest (iOCRF); multiband temporal texture; multitemporal data; pseudo cross multivariate variogram (PCMV),"Detection of urban land expansion is important for understanding the urbanization process and improving urban planning. Spatio-temporal contextual information derived from multitemporal high-resolution imagery is useful for highlighting urban land cover changes. This article proposes a new method for detecting urban built-up area change from multitemporal high spatial resolution imagery by combining spectral and spatio-temporal features. A multiband temporal texture measured using pseudo cross multivariate variogram (PCMV) is adopted to quantify the local spatio-temporal dependence between bitemporal multispectral images. The PCMV textures at multiple scales, bitemporal spectral features, and normalized difference vegetation indices are together input to an improved one-class random forest classifier for urban built-up area change mapping. The proposed method is evaluated in urban built-up area change detection using multitemporal Sentinel-2 images of Tianjin area acquired from 2015 to 2019. It is also compared with three feature combinations and an existing postclassification comparison method based on one-class support vector machine. Experimental results demonstrate that the proposed method outperformed the traditional ones, with increases of 2.15%-7.38%, 2.07%-5.45%, 1.93%-6.76%, and 5.98%-13.11% in overall accuracy. Moreover, the proposed method also achieves the best performance using the bitemporal Sentinel-2 images over the east of Beijing area. The proposed method is promising as a simple and reliable way to detect urban built-up area change with multitemporal Sentinel-2 imagery. © 2008-2012 IEEE.",2021,IEEE Journal of Selected Topics in Applied Earth Observations and Remote Sensing,"Feng X., Li P., Cheng T.",10.1109/JSTARS.2021.3092064,Article,9.790263176,6.8157587051
7,168,,An Intelligent Tree Planning Approach Using Location-Based Social Networks Data,Community detection algorithms; Mobility data; Multi-objective optimization; Social network analysis; Tree planning; Urban computing,"How do we make sure that all citizens in a city have access to enough green space? An increasing part of the world’s population lives in urban areas, where contact with nature is largely reduced to street trees and parks. As optional tree planting sites and financial resources are limited, determining the best planting site can be formulated as an optimization problem with constraints. Can we locate these sites based on the popularity of nearby venues? How can we ensure that we include groups of people who tend to spend time in tree deprived areas? Currently, tree location sites are chosen based on criteria from spatial-visual, physical and biological, and functional categories. As these criteria do not give any insights into which citizens are benefiting from the tree placement, we propose new data-driven tree planting policies that take socio-cultural aspects as represented by the citizens’ behavior into account. We combine a Location Based Social Network (LBSN) mobility data set with tree location data sets, both of New York City and Paris, as a case study. The effect of four different policies is evaluated on simulated movement data and assessed on the average, overall exposure to trees as well as on how much inequality in tree exposure is mitigated. © 2021, Springer Nature Switzerland AG.",2021,Communications in Computer and Information Science,"van Staalduinen J.H., Tetteroo J., Gawehns D., Baratchi M.",10.1007/978-3-030-76640-5_10,Conference Paper,9.6709861755,6.7177877426
